youtube#commentThread,iWdVlI2kaMHekrV-dqMO821cVo0,UgyDi1hQcsxgts9lLfl4AaABAg,UCeYSnd34IPe57sM8hkjWhrw,7Jo3NR5lgd8,youtube#comment,cV2CSaIsWeWkzGRiWUpCfbTGoT0,UgyDi1hQcsxgts9lLfl4AaABAg,UCeYSnd34IPe57sM8hkjWhrw,7Jo3NR5lgd8,"Hola, yo los escucho en Amazon music, desde que tenían un audio bien feo 😅.<br>Que onda con la lámpara de Iker 🤣🤣🤣🤣🤣","Hola, yo los escucho en Amazon music, desde que tenían un audio bien feo 😅.
Que onda con la lámpara de Iker 🤣🤣🤣🤣🤣",@perisqm1340,https://yt3.ggpht.com/ytc/AIdro_nouQSP4Kb2XeZ6XqCDJPsC02OWBYKZdVLJQNYbRFNaCmL3=s48-c-k-c0x00ffffff-no-rj,http://www.youtube.com/@perisqm1340,UCrkpEiXYMvIWUS1YD2NBu8A,True,none,9.0,2024-02-13T19:00:17Z,2024-02-13T19:00:17Z,True,0.0,True,,,,,,,,,,,,,
youtube#commentThread,PYle_nqCBP1m5x16yo9f74Zk7K8,Ugz0gP2BLSx0oqD5TDx4AaABAg,UCeYSnd34IPe57sM8hkjWhrw,7Jo3NR5lgd8,youtube#comment,ziOX93NchbWC8f8WiaMBqbTed40,Ugz0gP2BLSx0oqD5TDx4AaABAg,UCeYSnd34IPe57sM8hkjWhrw,7Jo3NR5lgd8,A mí sí me gustan las pasas😂!!!!!,A mí sí me gustan las pasas😂!!!!!,@yannomarzav2998,https://yt3.ggpht.com/ytc/AIdro_kEbkMqtXQbdDJsI9imgSrZWbhchUZoxUOd6IQ1XbteJYM=s48-c-k-c0x00ffffff-no-rj,http://www.youtube.com/@yannomarzav2998,UCXqMS9XDCHQBIEhdPQ_8n8g,True,none,3.0,2024-02-13T12:21:46Z,2024-02-13T12:21:46Z,True,0.0,True,,,,,,,,,,,,,
youtube#commentThread,SueQegOfHIo8RoN1rG-_4NS-3To,UgzF4R9j8g70S6f902d4AaABAg,UCeYSnd34IPe57sM8hkjWhrw,7Jo3NR5lgd8,youtube#comment,_KdLCAN0lNuib7bJ1g-F6y8_3ZQ,UgzF4R9j8g70S6f902d4AaABAg,UCeYSnd34IPe57sM8hkjWhrw,7Jo3NR5lgd8,El episodio más esperado por toda Latinoamérica unida,El episodio más esperado por toda Latinoamérica unida,@ProduccionesCERO,https://yt3.ggpht.com/ytc/AIdro_n8E3L03zG39xP70p5sFBd3xtB1_WCZQEy1PEANRCz4cg=s48-c-k-c0x00ffffff-no-rj,http://www.youtube.com/@ProduccionesCERO,UCEmgbPw-oeVKKSoRC1a8Tdg,True,none,3.0,2024-02-12T13:39:33Z,2024-02-12T13:39:33Z,True,0.0,True,,,,,,,,,,,,,
youtube#commentThread,e4GB27CXF8OK3LsQFe3kv6I_e68,Ugzc-poBKkBxF6-jgU94AaABAg,UCeYSnd34IPe57sM8hkjWhrw,7Jo3NR5lgd8,youtube#comment,H2pn6CEEPNeX6Bi0hSlZt9Tv6SE,Ugzc-poBKkBxF6-jgU94AaABAg,UCeYSnd34IPe57sM8hkjWhrw,7Jo3NR5lgd8,"Los árabes no eran dueños de esa región, así que no chillen, los Turcos aceptaron su derrota y se retiraron.Palestina es un nombre dado por los ingleses en 1920 y no eran todos árabes, fueron contados como musulmanes. Ellos recibieron trasjordania e irán, que tampoco existía y cisjordania y Gaza de pilón. Cuál pobrecitos que poquito les dieron.","Los árabes no eran dueños de esa región, así que no chillen, los Turcos aceptaron su derrota y se retiraron.Palestina es un nombre dado por los ingleses en 1920 y no eran todos árabes, fueron contados como musulmanes. Ellos recibieron trasjordania e irán, que tampoco existía y cisjordania y Gaza de pilón. Cuál pobrecitos que poquito les dieron.",@adrianarana3250,https://yt3.ggpht.com/ytc/AIdro_k4LkePajK8kGBw1xU-45gRgIwE9F3tfaNBqzwlf5A=s48-c-k-c0x00ffffff-no-rj,http://www.youtube.com/@adrianarana3250,UCwHqbBJ9iMqehdSHfTl44UA,True,none,2.0,2024-02-09T23:57:46Z,2024-02-09T23:57:46Z,True,0.0,True,,,,,,,,,,,,,
youtube#commentThread,08rRyP0C0t7WE-5SPvzmEQtilM8,Ugx7IV8ybQdxAcOGP_x4AaABAg,UCeYSnd34IPe57sM8hkjWhrw,7Jo3NR5lgd8,youtube#comment,oftwSuWiMLUeE8jwEwGjCur30T8,Ugx7IV8ybQdxAcOGP_x4AaABAg,UCeYSnd34IPe57sM8hkjWhrw,7Jo3NR5lgd8,"Algo que me llama la atención es que en Palestina hay muchas ciudades con nombres Judíos y que históricamente tiene nombres Hebreos, (Belen, Hebron, etc...)  y que cuando se creo el estado Israelí, los habitantes eran mas de los que habitaban, pues la mayoria estaba en proceso de exiliarse de todo Europa y otros paises , ósea que ese es el problema, que es el único pais Judío, mientras árabes tienen muchos paises donde pueden reubicarse","Algo que me llama la atención es que en Palestina hay muchas ciudades con nombres Judíos y que históricamente tiene nombres Hebreos, (Belen, Hebron, etc...)  y que cuando se creo el estado Israelí, los habitantes eran mas de los que habitaban, pues la mayoria estaba en proceso de exiliarse de todo Europa y otros paises , ósea que ese es el problema, que es el único pais Judío, mientras árabes tienen muchos paises donde pueden reubicarse",@jpsandov,https://yt3.ggpht.com/ytc/AIdro_k8_7PK9TUeyjoh80riO0WGTsjl5ehHf9d_j9jrXEx9bHg=s48-c-k-c0x00ffffff-no-rj,http://www.youtube.com/@jpsandov,UC5X1oRyoukGic6frUDHy0vA,True,none,0.0,2024-02-08T20:29:05Z,2024-02-08T20:29:05Z,True,1.0,True,"[{'kind': 'youtube#comment', 'etag': 'yrmWonWXUfxRQZToJu9_sws9fOQ', 'id': 'Ugx7IV8ybQdxAcOGP_x4AaABAg.A-ZuDD_VyrOA-breekGyIW', 'snippet': {'channelId': 'UCeYSnd34IPe57sM8hkjWhrw', 'videoId': '7Jo3NR5lgd8', 'textDisplay': 'Precisamente por que es y fue&#39; por más de 1500 años territorio de los judíos y su nombre era JUDEA. Podría refutar casi todo lo dicho aquí, pero que flojera.', 'textOriginal': ""Precisamente por que es y fue' por más de 1500 años territorio de los judíos y su nombre era JUDEA. Podría refutar casi todo lo dicho aquí, pero que flojera."", 'parentId': 'Ugx7IV8ybQdxAcOGP_x4AaABAg', 'authorDisplayName': '@adrianarana3250', 'authorProfileImageUrl': 'https://yt3.ggpht.com/ytc/AIdro_k4LkePajK8kGBw1xU-45gRgIwE9F3tfaNBqzwlf5A=s48-c-k-c0x00ffffff-no-rj', 'authorChannelUrl': 'http://www.youtube.com/@adrianarana3250', 'authorChannelId': {'value': 'UCwHqbBJ9iMqehdSHfTl44UA'}, 'canRate': True, 'viewerRating': 'none', 'likeCount': 0, 'publishedAt': '2024-02-10T00:04:29Z', 'updatedAt': '2024-02-10T00:04:29Z'}}]",,,,,,,,,,,,
youtube#commentThread,zezjlwR64aAAhgmdiJaG5o-aNRk,UgxVTIoByDQ_OwhETy54AaABAg,UCeYSnd34IPe57sM8hkjWhrw,7Jo3NR5lgd8,youtube#comment,GdN3wtMT3sjTxTfNPAcP1YbDLLQ,UgxVTIoByDQ_OwhETy54AaABAg,UCeYSnd34IPe57sM8hkjWhrw,7Jo3NR5lgd8,Seles olvida las mujeres violad@s por hamas fue halgo BRUTAL,Seles olvida las mujeres violad@s por hamas fue halgo BRUTAL,@juanguadalupemauricio755,https://yt3.ggpht.com/ytc/AIdro_k-MzDvwxnuj6z-kjvOikxxnpcpPdx-R7eZp8tEOxOxNwo=s48-c-k-c0x00ffffff-no-rj,http://www.youtube.com/@juanguadalupemauricio755,UCq3MX7j0aYxRiBst9MlfgyA,True,none,0.0,2024-02-08T06:03:28Z,2024-02-08T06:03:28Z,True,0.0,True,,,,,,,,,,,,,
youtube#commentThread,x-GJnJbrsQEiuFycvNpOhx-GKc8,Ugy9mwbfwWJ87aXhh6F4AaABAg,UCeYSnd34IPe57sM8hkjWhrw,7Jo3NR5lgd8,youtube#comment,iK4KSfjoNpNOmLV9uq2gcaaBqjU,Ugy9mwbfwWJ87aXhh6F4AaABAg,UCeYSnd34IPe57sM8hkjWhrw,7Jo3NR5lgd8,El 7 de octubre del 2023 no se olvidará VIVA ISRAEL AM ISRAEL JAI ❤️🇮🇱❤️❤️‍🔥❤️‍🔥❤️‍🔥,El 7 de octubre del 2023 no se olvidará VIVA ISRAEL AM ISRAEL JAI ❤️🇮🇱❤️❤️‍🔥❤️‍🔥❤️‍🔥,@juanguadalupemauricio755,https://yt3.ggpht.com/ytc/AIdro_k-MzDvwxnuj6z-kjvOikxxnpcpPdx-R7eZp8tEOxOxNwo=s48-c-k-c0x00ffffff-no-rj,http://www.youtube.com/@juanguadalupemauricio755,UCq3MX7j0aYxRiBst9MlfgyA,True,none,1.0,2024-02-08T05:28:02Z,2024-02-08T05:28:02Z,True,0.0,True,,,,,,,,,,,,,
youtube#commentThread,DytQjf1CiLexcAem6kXnO6Kh7gc,Ugy5q7eQHcQhMUfPIPt4AaABAg,UCeYSnd34IPe57sM8hkjWhrw,7Jo3NR5lgd8,youtube#comment,xiRjj9JIAq1bGof7xrLjHMwROYg,Ugy5q7eQHcQhMUfPIPt4AaABAg,UCeYSnd34IPe57sM8hkjWhrw,7Jo3NR5lgd8,ISRAEL ES SOBERANO YO COMO MEXICANO APOYO A ISRAEL,ISRAEL ES SOBERANO YO COMO MEXICANO APOYO A ISRAEL,@juanguadalupemauricio755,https://yt3.ggpht.com/ytc/AIdro_k-MzDvwxnuj6z-kjvOikxxnpcpPdx-R7eZp8tEOxOxNwo=s48-c-k-c0x00ffffff-no-rj,http://www.youtube.com/@juanguadalupemauricio755,UCq3MX7j0aYxRiBst9MlfgyA,True,none,0.0,2024-02-08T05:02:35Z,2024-02-08T05:02:35Z,True,1.0,True,"[{'kind': 'youtube#comment', 'etag': 'dUMIQ8Ar2zyzfQRnRkrRWbjHjVU', 'id': 'Ugy5q7eQHcQhMUfPIPt4AaABAg.A-YFBHBTUEcA7S8fU2411o', 'snippet': {'channelId': 'UCeYSnd34IPe57sM8hkjWhrw', 'videoId': '7Jo3NR5lgd8', 'textDisplay': 'Ya vete wey hueles a humedad', 'textOriginal': 'Ya vete wey hueles a humedad', 'parentId': 'Ugy5q7eQHcQhMUfPIPt4AaABAg', 'authorDisplayName': '@ArrocitoCL17', 'authorProfileImageUrl': 'https://yt3.ggpht.com/cNpKjf_AJjbP2filXHy48rCqyXTJIchKOLQy8fAu16o4dp3WsuCMLVlBF8H0ndAyDREwdIsQ=s48-c-k-c0x00ffffff-no-rj', 'authorChannelUrl': 'http://www.youtube.com/@ArrocitoCL17', 'authorChannelId': {'value': 'UCK3IC8Q8JRgcVcNqHbJiQ0A'}, 'canRate': True, 'viewerRating': 'none', 'likeCount': 0, 'publishedAt': '2024-08-22T16:21:23Z', 'updatedAt': '2024-08-22T16:21:23Z'}}]",,,,,,,,,,,,
youtube#commentThread,QXU9icM89Fj_JzuTwFAqkn4z2GU,UgwSryWi0MPvIPVHDop4AaABAg,UCeYSnd34IPe57sM8hkjWhrw,7Jo3NR5lgd8,youtube#comment,v20cWudzBgTw8b5yBW4HBQvdIFs,UgwSryWi0MPvIPVHDop4AaABAg,UCeYSnd34IPe57sM8hkjWhrw,7Jo3NR5lgd8,"Voy a investigar el conflicto de myanmar, ahorita regreso","Voy a investigar el conflicto de myanmar, ahorita regreso",@antoniodejesus8241,https://yt3.ggpht.com/ytc/AIdro_kJYuVvKpWjIiVwIMYkY0fqOO84VNSKBhs76X2XO1MgDac=s48-c-k-c0x00ffffff-no-rj,http://www.youtube.com/@antoniodejesus8241,UCEbIUaSb0pF74X6RW8b6cVQ,True,none,15.0,2024-02-08T01:48:46Z,2024-02-08T01:48:46Z,True,0.0,True,,,,,,,,,,,,,
youtube#commentThread,dqWrZyGeSRryf_MOGmqGzumK4PU,UgwUDlriCOIcRXbgdlt4AaABAg,UCeYSnd34IPe57sM8hkjWhrw,7Jo3NR5lgd8,youtube#comment,ntncv5tv4GyPYqgv3NPcJDsE_6Y,UgwUDlriCOIcRXbgdlt4AaABAg,UCeYSnd34IPe57sM8hkjWhrw,7Jo3NR5lgd8,Loviu chicos ✨ ya estaba esperando la continuación!,Loviu chicos ✨ ya estaba esperando la continuación!,@monicarodzeg,https://yt3.ggpht.com/qUCtzhkY8ueL5FaHPhcdcAevUDSDXQzWGQE80--hJIejyjXTrRAoGpqEpeEhxJJ2pyOgXJ9elg=s48-c-k-c0x00ffffff-no-rj,http://www.youtube.com/@monicarodzeg,UCAYoq3BjAkOdGNWfqPrzl-Q,True,none,2.0,2024-02-08T01:43:05Z,2024-02-08T01:43:05Z,True,0.0,True,,,,,,,,,,,,,
youtube#commentThread,0iq95mY2yghS5K_ZiD-VMa_OnL4,UgwUaxS2miE9XBlHy7B4AaABAg,UCeYSnd34IPe57sM8hkjWhrw,7Jo3NR5lgd8,youtube#comment,DQk53fuyLwqZp1fhC_dHU8JzOEA,UgwUaxS2miE9XBlHy7B4AaABAg,UCeYSnd34IPe57sM8hkjWhrw,7Jo3NR5lgd8,Buenas un saludo para cuando hablan de la mitología mexica 🫣,Buenas un saludo para cuando hablan de la mitología mexica 🫣,@DIEGORODRIGUEZ-co4uv,https://yt3.ggpht.com/mJ6BXNk_gRoDgG7Hqq25h9zk_VMpEorhBlqc3KOLTXZlUHfphavS9oHbU8aYy6twrGGoChhUyg=s48-c-k-c0x00ffffff-no-rj,http://www.youtube.com/@DIEGORODRIGUEZ-co4uv,UC3rt6oqNlblniIB1M0uGwmA,True,none,2.0,2024-02-08T00:49:30Z,2024-02-08T00:49:30Z,True,0.0,True,,,,,,,,,,,,,
youtube#commentThread,U9h12davH3mvuNobHHSvrUKd0xw,UgzNQyKPj7c50kM1bH54AaABAg,UCeYSnd34IPe57sM8hkjWhrw,7Jo3NR5lgd8,youtube#comment,aWrf-d8SPSoT-hErouMCjYE9wdQ,UgzNQyKPj7c50kM1bH54AaABAg,UCeYSnd34IPe57sM8hkjWhrw,7Jo3NR5lgd8,SIuuuuuu,SIuuuuuu,@kenoben007,https://yt3.ggpht.com/ytc/AIdro_kxWDZEJveR-n7lRBSA6p7mSF0yL6aRBHNQzPPaxx91AQ=s48-c-k-c0x00ffffff-no-rj,http://www.youtube.com/@kenoben007,UC6LvxKxuyDB3fKGwW1fODhg,True,none,2.0,2024-02-08T00:07:29Z,2024-02-08T00:07:29Z,True,0.0,True,,,,,,,,,,,,,
youtube#comment,yrmWonWXUfxRQZToJu9_sws9fOQ,Ugx7IV8ybQdxAcOGP_x4AaABAg.A-ZuDD_VyrOA-breekGyIW,UCeYSnd34IPe57sM8hkjWhrw,7Jo3NR5lgd8,,,,,,,,,,,,,,,,,,,,,"Precisamente por que es y fue&#39; por más de 1500 años territorio de los judíos y su nombre era JUDEA. Podría refutar casi todo lo dicho aquí, pero que flojera.","Precisamente por que es y fue' por más de 1500 años territorio de los judíos y su nombre era JUDEA. Podría refutar casi todo lo dicho aquí, pero que flojera.",Ugx7IV8ybQdxAcOGP_x4AaABAg,@adrianarana3250,https://yt3.ggpht.com/ytc/AIdro_k4LkePajK8kGBw1xU-45gRgIwE9F3tfaNBqzwlf5A=s48-c-k-c0x00ffffff-no-rj,http://www.youtube.com/@adrianarana3250,UCwHqbBJ9iMqehdSHfTl44UA,True,none,0.0,2024-02-10T00:04:29Z,2024-02-10T00:04:29Z
youtube#comment,dUMIQ8Ar2zyzfQRnRkrRWbjHjVU,Ugy5q7eQHcQhMUfPIPt4AaABAg.A-YFBHBTUEcA7S8fU2411o,UCeYSnd34IPe57sM8hkjWhrw,7Jo3NR5lgd8,,,,,,,,,,,,,,,,,,,,,Ya vete wey hueles a humedad,Ya vete wey hueles a humedad,Ugy5q7eQHcQhMUfPIPt4AaABAg,@ArrocitoCL17,https://yt3.ggpht.com/cNpKjf_AJjbP2filXHy48rCqyXTJIchKOLQy8fAu16o4dp3WsuCMLVlBF8H0ndAyDREwdIsQ=s48-c-k-c0x00ffffff-no-rj,http://www.youtube.com/@ArrocitoCL17,UCK3IC8Q8JRgcVcNqHbJiQ0A,True,none,0.0,2024-08-22T16:21:23Z,2024-08-22T16:21:23Z
youtube#commentThread,iXI5F5WJi3-NrpNrzwnbm_2jnrk,Ugz0Zqtrb_JtRSDizPB4AaABAg,UCeYSnd34IPe57sM8hkjWhrw,qSjSUN6Rxhk,youtube#comment,fN8jt_wMsYR-u1c1n1qLR9LdB9Q,Ugz0Zqtrb_JtRSDizPB4AaABAg,UCeYSnd34IPe57sM8hkjWhrw,qSjSUN6Rxhk,"Fan del potcast en Spotify, empecé a escucharlos este año 2024 y ya voy en <br>el cap. <a href=""http://www.youtube.com/results?search_query=%23104"">#104</a>.<br>♥ Amo la introducción de 15-20 min, sigan así, me alegran el camino en el metro ♥<br>literal, apenas entro a VERLOS regresando a escuchar/ver <br>𝑻𝒆𝒐𝒕𝒊𝒉𝒖𝒂𝒄𝒂𝒏 1 y 2<br>Saludos!","Fan del potcast en Spotify, empecé a escucharlos este año 2024 y ya voy en 
el cap. #104.
♥ Amo la introducción de 15-20 min, sigan así, me alegran el camino en el metro ♥
literal, apenas entro a VERLOS regresando a escuchar/ver 
𝑻𝒆𝒐𝒕𝒊𝒉𝒖𝒂𝒄𝒂𝒏 1 y 2
Saludos!",@ANGELE13nuit,https://yt3.ggpht.com/ytc/AIdro_n8_c08K49ta_Rmx4nCFTFYftzwgWLisTk7IHs8FinrrA=s48-c-k-c0x00ffffff-no-rj,http://www.youtube.com/@ANGELE13nuit,UCa-horileJFag1nLFZdwsSQ,True,none,0.0,2024-10-09T18:23:15Z,2024-10-09T18:23:15Z,True,0.0,True,,,,,,,,,,,,,
youtube#commentThread,Ogc4KFNeoTfWh_dSAJIQc3e6oQE,UgydFcDhN-9LRGpLidZ4AaABAg,UCeYSnd34IPe57sM8hkjWhrw,qSjSUN6Rxhk,youtube#comment,pZo2R-fUxrq6leR392QxO9zIwXw,UgydFcDhN-9LRGpLidZ4AaABAg,UCeYSnd34IPe57sM8hkjWhrw,qSjSUN6Rxhk,Parte 7 y parte 9 como las etapas de las pirámides 😊,Parte 7 y parte 9 como las etapas de las pirámides 😊,@SNAIDWER,https://yt3.ggpht.com/ytc/AIdro_m4AfvkQNBHJRHls5MImsmA5XY8e75Yt9H8FjAwBzMzmNs=s48-c-k-c0x00ffffff-no-rj,http://www.youtube.com/@SNAIDWER,UC-eJoAF8Pcd9IbzLLa_rvTg,True,none,0.0,2024-09-06T13:40:32Z,2024-09-06T13:40:32Z,True,0.0,True,,,,,,,,,,,,,
youtube#commentThread,CBU_dF-yOGs-WOsVcyuzoa7cm0o,Ugyr1TSeNMVx1CK_5r94AaABAg,UCeYSnd34IPe57sM8hkjWhrw,qSjSUN6Rxhk,youtube#comment,WoPPLeO0aK87MZ9zCO9yQylLaj8,Ugyr1TSeNMVx1CK_5r94AaABAg,UCeYSnd34IPe57sM8hkjWhrw,qSjSUN6Rxhk,"<a href=""https://www.youtube.com/watch?v=qSjSUN6Rxhk&amp;t=385"">6:25</a> Inicia<br><a href=""https://www.youtube.com/watch?v=qSjSUN6Rxhk&amp;t=535"">8:55</a> Desarrollo arquitectónico<br><a href=""https://www.youtube.com/watch?v=qSjSUN6Rxhk&amp;t=1300"">21:40</a> Porque es del sol?<br><a href=""https://www.youtube.com/watch?v=qSjSUN6Rxhk&amp;t=2731"">45:31</a> Preguntas","6:25 Inicia
8:55 Desarrollo arquitectónico
21:40 Porque es del sol?
45:31 Preguntas",@victorfernandogilcalderon6242,https://yt3.ggpht.com/ytc/AIdro_mS6L9rTinw6-pvtkl2fHU8-FPSjgoNXGGys8vGW-_ITw=s48-c-k-c0x00ffffff-no-rj,http://www.youtube.com/@victorfernandogilcalderon6242,UC_XTaP7e7GEki_dgCDZfW0A,True,none,0.0,2024-08-28T01:11:34Z,2024-08-28T01:51:05Z,True,0.0,True,,,,,,,,,,,,,
youtube#commentThread,Ol6a0HJ9slogIXwITiVDLLkd89g,UgwKLugMKg3TCbXgT5x4AaABAg,UCeYSnd34IPe57sM8hkjWhrw,qSjSUN6Rxhk,youtube#comment,8aBR0ivwYWfbdYixavI7bB_QPSk,UgwKLugMKg3TCbXgT5x4AaABAg,UCeYSnd34IPe57sM8hkjWhrw,qSjSUN6Rxhk,"Queremos todooooooo de Teotihuacan, ojala sea pronto 🙈","Queremos todooooooo de Teotihuacan, ojala sea pronto 🙈",@pamrl24,https://yt3.ggpht.com/TcS8Yah79r9rFRtLslrCJbAagCL7LB4k_CX_HqRKYTDYWajDZPHQ19X3P_YDf3EMls-BPAst=s48-c-k-c0x00ffffff-no-rj,http://www.youtube.com/@pamrl24,UCCR37xnLEhG80UHAlNB4dAQ,True,none,0.0,2024-08-23T05:02:53Z,2024-08-23T05:02:53Z,True,0.0,True,,,,,,,,,,,,,
youtube#commentThread,Ksm1BP0ZCDyJMLqWJvMpIt_ErdI,UgymkME8SCKSA2OQuIV4AaABAg,UCeYSnd34IPe57sM8hkjWhrw,qSjSUN6Rxhk,youtube#comment,dKRdVabwBwJBdg-0Sqz2W9vLlgY,UgymkME8SCKSA2OQuIV4AaABAg,UCeYSnd34IPe57sM8hkjWhrw,qSjSUN6Rxhk,Lo bueno es que no se sabe nada de los Teotihuacanos 😅,Lo bueno es que no se sabe nada de los Teotihuacanos 😅,@ivmarciott4695,https://yt3.ggpht.com/ytc/AIdro_mKrojca--bh6T1kP41dnZWFjEBed5ahFDPwFpTxICqGVs=s48-c-k-c0x00ffffff-no-rj,http://www.youtube.com/@ivmarciott4695,UCE4c_1LhjC2Re9pXZepXHHA,True,none,0.0,2024-08-09T20:48:46Z,2024-08-09T20:48:46Z,True,0.0,True,,,,,,,,,,,,,
youtube#commentThread,lZyqiIg2fBeMqwKhj2zHiqT17fA,UgyIqjXKI7MdR7WJ8H54AaABAg,UCeYSnd34IPe57sM8hkjWhrw,qSjSUN6Rxhk,youtube#comment,wfGyW0OUIxEJPz5odajWlwKcHwQ,UgyIqjXKI7MdR7WJ8H54AaABAg,UCeYSnd34IPe57sM8hkjWhrw,qSjSUN6Rxhk,"Son geniiales y ustedes hablando de phineas y ferb es mas genial, tambien me encanta la de ardillas por  doquier pero mi favorita es luchando con robots...","Son geniiales y ustedes hablando de phineas y ferb es mas genial, tambien me encanta la de ardillas por  doquier pero mi favorita es luchando con robots...",@celiamontiel2728,https://yt3.ggpht.com/ytc/AIdro_lChINaMGzuGgYEdxh2b3CDLHVRP0vOCNdungwimTXwMXnLgD61gOFh7OyoNaPYCYhBMA=s48-c-k-c0x00ffffff-no-rj,http://www.youtube.com/@celiamontiel2728,UCNKIG_SElIqKsZjXGpkigjQ,True,none,0.0,2024-07-13T17:24:09Z,2024-07-13T20:55:03Z,True,0.0,True,,,,,,,,,,,,,
youtube#commentThread,BfFFkTVFdoClIYd0y-nYpchwidw,UgxMLmVA4ACvmYc20Nd4AaABAg,UCeYSnd34IPe57sM8hkjWhrw,qSjSUN6Rxhk,youtube#comment,rW9PchOWXJwcx93mkh35N9ic0Ik,UgxMLmVA4ACvmYc20Nd4AaABAg,UCeYSnd34IPe57sM8hkjWhrw,qSjSUN6Rxhk,"Hahahahahahaha si hay algo chimba! Es fumarse un porro  y escuchar historia para tontos, hace que todos sus chistes tengan más sentido!!! Los amo ❤❤❤❤","Hahahahahahaha si hay algo chimba! Es fumarse un porro  y escuchar historia para tontos, hace que todos sus chistes tengan más sentido!!! Los amo ❤❤❤❤",@kmilamekno1074,https://yt3.ggpht.com/ytc/AIdro_lilzk2pKgR5jwH1vPZlKQD3i5v2OL0XxnI0vv83ZpoM4o=s48-c-k-c0x00ffffff-no-rj,http://www.youtube.com/@kmilamekno1074,UCGI-Svhl2yKFNoCj3UjgQ4w,True,none,1.0,2024-07-11T17:02:05Z,2024-07-11T17:02:05Z,True,0.0,True,,,,,,,,,,,,,
youtube#commentThread,FjvUNgGa1uBzkdS6BA9SFsQ3Q7g,UgyEfqYA3dcxZxl1dY54AaABAg,UCeYSnd34IPe57sM8hkjWhrw,qSjSUN6Rxhk,youtube#comment,bfqyfdOtUTNCOxNcDMMLKkfQ6V4,UgyEfqYA3dcxZxl1dY54AaABAg,UCeYSnd34IPe57sM8hkjWhrw,qSjSUN6Rxhk,Me encanta el chismecito previo al chismecito histórico.😂❤,Me encanta el chismecito previo al chismecito histórico.😂❤,@carolinachavez5747,https://yt3.ggpht.com/ytc/AIdro_kaVR9i-dtpHrmgVeLbIfJh3PSggAeeSHBkeFCAt8E2EA=s48-c-k-c0x00ffffff-no-rj,http://www.youtube.com/@carolinachavez5747,UC1FGTUWHTQA9p3wvnUXO5AQ,True,none,0.0,2024-07-06T04:57:26Z,2024-07-06T04:57:26Z,True,0.0,True,,,,,,,,,,,,,
youtube#commentThread,x4y1iNo8YVlfCfHRGFYoJGCnClU,Ugy3czwP2e88jiam4294AaABAg,UCeYSnd34IPe57sM8hkjWhrw,qSjSUN6Rxhk,youtube#comment,WxdS7hutSpdxpZjjGPzJKh47XuA,Ugy3czwP2e88jiam4294AaABAg,UCeYSnd34IPe57sM8hkjWhrw,qSjSUN6Rxhk,"Chingon, hablen de GUACHIMONTONES ZONA ARQUEOLOGICA EN GDL CON ESTRUCTURAS CIRCULARES","Chingon, hablen de GUACHIMONTONES ZONA ARQUEOLOGICA EN GDL CON ESTRUCTURAS CIRCULARES",@adanflores8711,https://yt3.ggpht.com/ytc/AIdro_kToWTo9cfPIW0F1gnatUSdIPwNLaYbQJZbOoILPNY=s48-c-k-c0x00ffffff-no-rj,http://www.youtube.com/@adanflores8711,UC80uODVSVMjeJuBWgVHsm8w,True,none,0.0,2024-07-04T17:05:15Z,2024-07-04T17:05:15Z,True,0.0,True,,,,,,,,,,,,,
youtube#commentThread,-TVvVvhJlmZL5e41vWlXpOQl4JI,UgxxksqJGOyxYwNlZ-F4AaABAg,UCeYSnd34IPe57sM8hkjWhrw,qSjSUN6Rxhk,youtube#comment,g4jUtWOqveDA0GwcA18tdoALW4k,UgxxksqJGOyxYwNlZ-F4AaABAg,UCeYSnd34IPe57sM8hkjWhrw,qSjSUN6Rxhk,"En el minuto <a href=""https://www.youtube.com/watch?v=qSjSUN6Rxhk&amp;t=1503"">25:03</a> dice que deberían ser 365 escalones por cada día del año pero en ese tiempo aún no se establecí cuántos días tiene un año, como sabían ellos que deberían de ser 365?","En el minuto 25:03 dice que deberían ser 365 escalones por cada día del año pero en ese tiempo aún no se establecí cuántos días tiene un año, como sabían ellos que deberían de ser 365?",@azucenamarquez6948,https://yt3.ggpht.com/5mx1khN6G2RVTRHz-y6brVi7Dm4ztZFnYI5KNft2qyhz1O8Frd2uo95qBw5oTvzZmd_Xc0SKsA=s48-c-k-c0x00ffffff-no-rj,http://www.youtube.com/@azucenamarquez6948,UCVWowv6YtJhy5JksHNBncww,True,none,0.0,2024-06-29T00:01:18Z,2024-06-29T00:01:18Z,True,1.0,True,"[{'kind': 'youtube#comment', 'etag': 'YW1Y8iZfWcSTmvBtoTsbMW8jEsQ', 'id': 'UgxxksqJGOyxYwNlZ-F4AaABAg.A5FL_skGLstA77qyJh-p8w', 'snippet': {'channelId': 'UCeYSnd34IPe57sM8hkjWhrw', 'videoId': 'qSjSUN6Rxhk', 'textDisplay': 'Porque ese saber no era exclusivo de Europa, aquí también teníamos astrónomos y usaban calendarios más exactos', 'textOriginal': 'Porque ese saber no era exclusivo de Europa, aquí también teníamos astrónomos y usaban calendarios más exactos', 'parentId': 'UgxxksqJGOyxYwNlZ-F4AaABAg', 'authorDisplayName': '@gerardomarin3704', 'authorProfileImageUrl': 'https://yt3.ggpht.com/ytc/AIdro_llsVXXNftH3IeJbqvGiarCVgu80IyChxSps7u5X2xSosc=s48-c-k-c0x00ffffff-no-rj', 'authorChannelUrl': 'http://www.youtube.com/@gerardomarin3704', 'authorChannelId': {'value': 'UCSx1Rju_L2MpgAxcmxgSmNg'}, 'canRate': True, 'viewerRating': 'none', 'likeCount': 1, 'publishedAt': '2024-08-14T19:13:07Z', 'updatedAt': '2024-08-14T19:13:33Z'}}]",,,,,,,,,,,,
youtube#commentThread,EU3y6SBssUU-8QP1vtx_kX0wUkk,UgwPOpojckZ8o7xAv-x4AaABAg,UCeYSnd34IPe57sM8hkjWhrw,qSjSUN6Rxhk,youtube#comment,ZANZSJiTzU5de_zuk2p3GP9wFRE,UgwPOpojckZ8o7xAv-x4AaABAg,UCeYSnd34IPe57sM8hkjWhrw,qSjSUN6Rxhk,Los anunnakis vienen de las Pleiades. No se si lo mencionan luego apenas voy por el min 15,Los anunnakis vienen de las Pleiades. No se si lo mencionan luego apenas voy por el min 15,@franco76r,https://yt3.ggpht.com/ytc/AIdro_kYohpF1hMy7pyDG0p2wjXeBRF0HpKgbON2UVFxDnK1jCo=s48-c-k-c0x00ffffff-no-rj,http://www.youtube.com/@franco76r,UCZoFQoHte5oM_gvcYvBqgCw,True,none,0.0,2024-06-27T04:04:03Z,2024-06-27T04:04:03Z,True,0.0,True,,,,,,,,,,,,,
youtube#commentThread,gSkVszlwnfPdfVBASQnOaCklRKE,UgzFWtZYNaw7hTtJFYZ4AaABAg,UCeYSnd34IPe57sM8hkjWhrw,qSjSUN6Rxhk,youtube#comment,sS1HRNhSKZRpyeRMhmgjQ4gmdT0,UgzFWtZYNaw7hTtJFYZ4AaABAg,UCeYSnd34IPe57sM8hkjWhrw,qSjSUN6Rxhk,"Por favor un podcast de San Agustín Huila Colombia, Tierradentro Cauca","Por favor un podcast de San Agustín Huila Colombia, Tierradentro Cauca",@Foyatan,https://yt3.ggpht.com/ytc/AIdro_miY3152Tczrm9mD_y1lYVCxo5P-0qDKcJ_crk7yRdPeQ=s48-c-k-c0x00ffffff-no-rj,http://www.youtube.com/@Foyatan,UCfVfq0wZr92nLoBB9NOf1yQ,True,none,0.0,2024-06-25T20:04:56Z,2024-06-25T20:04:56Z,True,0.0,True,,,,,,,,,,,,,
youtube#commentThread,LJ_B0w0pc1BfEvc1GLdYIfKna2I,UgxNkSdLgKjHfPClmYR4AaABAg,UCeYSnd34IPe57sM8hkjWhrw,qSjSUN6Rxhk,youtube#comment,srDxJrbV6FkozAZlsRSuHlct4sE,UgxNkSdLgKjHfPClmYR4AaABAg,UCeYSnd34IPe57sM8hkjWhrw,qSjSUN6Rxhk,Un video dedicado a la cultura Huasteca por favor!! 😎,Un video dedicado a la cultura Huasteca por favor!! 😎,@hectorefrainhardwellmancil8726,https://yt3.ggpht.com/ytc/AIdro_nt6scajPVlddhhHZd9TwV3A5VjENGe_IZEWE0jn25BmQ=s48-c-k-c0x00ffffff-no-rj,http://www.youtube.com/@hectorefrainhardwellmancil8726,UCyL4GkKLcLY474-sVaB7o9A,True,none,0.0,2024-06-25T19:22:27Z,2024-06-25T19:22:27Z,True,0.0,True,,,,,,,,,,,,,
youtube#commentThread,T5AUf2098330CPAfMm12kORAiTc,UgzHTIp2YdcVZFe71bF4AaABAg,UCeYSnd34IPe57sM8hkjWhrw,qSjSUN6Rxhk,youtube#comment,l4oegIWnLurv-76Z-C1G1IMN-Rg,UgzHTIp2YdcVZFe71bF4AaABAg,UCeYSnd34IPe57sM8hkjWhrw,qSjSUN6Rxhk,¿Y los shownotes de la parte 1 y 2?,¿Y los shownotes de la parte 1 y 2?,@JoseLuisLozanoAlberu,https://yt3.ggpht.com/ytc/AIdro_kvlt40bMazKWZHSmisfoktJVDG26WKImMeDDoatr1WBfQ=s48-c-k-c0x00ffffff-no-rj,http://www.youtube.com/@JoseLuisLozanoAlberu,UCcgBd_iWhBlDewCB_V_2fxg,True,none,0.0,2024-06-25T18:05:22Z,2024-06-25T18:05:22Z,True,0.0,True,,,,,,,,,,,,,
youtube#commentThread,33_tqB-_S95O2iZBqqLEMqh-6z0,UgxkVYg05Z-8mOajGGx4AaABAg,UCeYSnd34IPe57sM8hkjWhrw,qSjSUN6Rxhk,youtube#comment,vnJxLSR_mwvpsSuacypr1sgchxY,UgxkVYg05Z-8mOajGGx4AaABAg,UCeYSnd34IPe57sM8hkjWhrw,qSjSUN6Rxhk,Estaria chido que invitaran al Doctor Ricardo Stern la neta harian buen match,Estaria chido que invitaran al Doctor Ricardo Stern la neta harian buen match,@famoso182rob,https://yt3.ggpht.com/ytc/AIdro_mGaU09g-qNEt3ovKatTA6WxbRsrFxMyls75FdIIvzg4OA=s48-c-k-c0x00ffffff-no-rj,http://www.youtube.com/@famoso182rob,UCB8zr418pFMjE7C1FR6ZaIQ,True,none,0.0,2024-06-23T20:48:54Z,2024-06-23T20:48:54Z,True,0.0,True,,,,,,,,,,,,,
youtube#commentThread,kFz_aNG8aWI_-ZOuv6tmWG-HJ-A,UgzboAs1PSMCWpneJDN4AaABAg,UCeYSnd34IPe57sM8hkjWhrw,qSjSUN6Rxhk,youtube#comment,Uz3K0FYPdLndhbyvgS-zNv-DNP0,UgzboAs1PSMCWpneJDN4AaABAg,UCeYSnd34IPe57sM8hkjWhrw,qSjSUN6Rxhk,Carnales saquen un programa sobre Huellatlaco y todo sobre los descubrimientos del Valsequillo que parece ser los acentamientos humanos más antiguos del continente desde los increíbles 250 mil años hasta 40 mil y todo sobre las investigaciones muy rigurosas que se han echo por fa saludos,Carnales saquen un programa sobre Huellatlaco y todo sobre los descubrimientos del Valsequillo que parece ser los acentamientos humanos más antiguos del continente desde los increíbles 250 mil años hasta 40 mil y todo sobre las investigaciones muy rigurosas que se han echo por fa saludos,@josemanuellaramonrreal8739,https://yt3.ggpht.com/ytc/AIdro_l7jJ-TULIaWcjq5Vw1M_PgL5cpFYcFmUi7NoBRkXw9X1I=s48-c-k-c0x00ffffff-no-rj,http://www.youtube.com/@josemanuellaramonrreal8739,UCsG8ZFIrEEWdXRzKUi_IuZg,True,none,0.0,2024-06-22T21:20:21Z,2024-06-22T21:20:21Z,True,0.0,True,,,,,,,,,,,,,
youtube#commentThread,30JxNRIoJ68Glrvt35Rc1p8_A4Q,Ugz2z48NJMbXPBtVZOV4AaABAg,UCeYSnd34IPe57sM8hkjWhrw,qSjSUN6Rxhk,youtube#comment,meWy19N35FehtSJdr2c6CCWYi-E,Ugz2z48NJMbXPBtVZOV4AaABAg,UCeYSnd34IPe57sM8hkjWhrw,qSjSUN6Rxhk,Estoy para el tour,Estoy para el tour,@mareygoldaraz,https://yt3.ggpht.com/ytc/AIdro_kRSpf5NeAk7T1TMxhR5ttqRpWcg6zuZV-MPxnPMPNTuhTQ=s48-c-k-c0x00ffffff-no-rj,http://www.youtube.com/@mareygoldaraz,UCK1sXIrBsZNGi2N5cUN-YCg,True,none,0.0,2024-06-21T19:10:54Z,2024-06-21T19:10:54Z,True,0.0,True,,,,,,,,,,,,,
