youtube#commentThread,UpGbeGbT5NbBfelcX3huCkZZH0o,UgxwyLYt-NxBvI9IlQt4AaABAg,UCeYSnd34IPe57sM8hkjWhrw,rx108V8Ydtc,youtube#comment,_aG2zeLdjNkWXZbCy-ZbaTkzyaA,UgxwyLYt-NxBvI9IlQt4AaABAg,UCeYSnd34IPe57sM8hkjWhrw,rx108V8Ydtc,"Ay no 😢, por qué no lo estrenan primero en YouTube y después en Spotify?? Con mi amsiedad no pude esperar y ya lo escuché..si si...ya puse la campanita","Ay no 😢, por qué no lo estrenan primero en YouTube y después en Spotify?? Con mi amsiedad no pude esperar y ya lo escuché..si si...ya puse la campanita",@yasnaleon8118,https://yt3.ggpht.com/ytc/AIdro_lGUVYRAnHwjfntTy6Jh8uPX6yNxbtJncb1CZLkE1qmh8Y=s48-c-k-c0x00ffffff-no-rj,http://www.youtube.com/@yasnaleon8118,UCdW-7O8zM4I9kAAP5FyxojQ,True,none,13.0,2024-05-22T21:25:21Z,2024-05-22T21:29:02Z,True,0.0,True,,,,,,,,,,,,,
youtube#commentThread,X1gRH8lMHZJJkpZVQRoEhhn5NIE,UgzQrWz4WnyIOWMxqV54AaABAg,UCeYSnd34IPe57sM8hkjWhrw,rx108V8Ydtc,youtube#comment,ZfjVZI5XIjTf3TtApbL4SNYUAbs,UgzQrWz4WnyIOWMxqV54AaABAg,UCeYSnd34IPe57sM8hkjWhrw,rx108V8Ydtc,como que en la guerra de los pasteles no se aventaron pasteles😨⁉️,como que en la guerra de los pasteles no se aventaron pasteles😨⁉️,@reneeamelie,https://yt3.ggpht.com/ydWSri13kWsquqsS-sEjRD3UobBzPbl0J4RlE_HkOGyAcvcDjW_Od3Dd-qZpQKv8OeoxJ0WE_g=s48-c-k-c0x00ffffff-no-rj,http://www.youtube.com/@reneeamelie,UC2HbeGHouSrvztaB9v8ysIw,True,none,3.0,2024-05-22T21:12:55Z,2024-05-22T21:12:55Z,True,0.0,True,,,,,,,,,,,,,
youtube#commentThread,_3sFjBE6HBw95u5dKYU1pnfrtLA,UgyPQkOGZFyVEE6YRad4AaABAg,UCeYSnd34IPe57sM8hkjWhrw,rx108V8Ydtc,youtube#comment,wp300P_10IaRfmEX559Pq6BrzVA,UgyPQkOGZFyVEE6YRad4AaABAg,UCeYSnd34IPe57sM8hkjWhrw,rx108V8Ydtc,SIUUUUU,SIUUUUU,@kenoben007,https://yt3.ggpht.com/ytc/AIdro_kxWDZEJveR-n7lRBSA6p7mSF0yL6aRBHNQzPPaxx91AQ=s48-c-k-c0x00ffffff-no-rj,http://www.youtube.com/@kenoben007,UC6LvxKxuyDB3fKGwW1fODhg,True,none,0.0,2024-05-22T20:44:21Z,2024-05-22T20:44:21Z,True,0.0,True,,,,,,,,,,,,,
youtube#commentThread,xklD5TtHcdLZ-z-tH0E1mucPxb4,Ugzb_X9B6WmQBkaOIXR4AaABAg,UCeYSnd34IPe57sM8hkjWhrw,rx108V8Ydtc,youtube#comment,nUNKEWqHZWCmMaR60aJzINFrrpo,Ugzb_X9B6WmQBkaOIXR4AaABAg,UCeYSnd34IPe57sM8hkjWhrw,rx108V8Ydtc,❤,❤,@isabellaurrea6400,https://yt3.ggpht.com/ytc/AIdro_mrvZcV6068NsKezjJKnOE7lcrPEErYXQSPFTD6SjdpNDE=s48-c-k-c0x00ffffff-no-rj,http://www.youtube.com/@isabellaurrea6400,UCQLINujj0gvmy1qv80OYPMw,True,none,1.0,2024-05-22T20:42:44Z,2024-05-22T20:42:44Z,True,0.0,True,,,,,,,,,,,,,
youtube#comment,JEjxlP-bi8Pm2eurBwo64knTVc4,Ugw2ngc1YlVsVgWjVT14AaABAg.A3l-KnZejGkA3y9xdDeYUW,UCeYSnd34IPe57sM8hkjWhrw,rx108V8Ydtc,,,,,,,,,,,,,,,,,,,,,Gracias por la corrección!,Gracias por la corrección!,Ugw2ngc1YlVsVgWjVT14AaABAg,@historiaparatontospodcast5148,https://yt3.ggpht.com/Tw2Vt53uC3fCaRNDO884CZkc1inVcHFbKYcYg9ug9_tFVfi2y6Yk23-Z7KpoRup63Kf4Dwrd=s48-c-k-c0x00ffffff-no-rj,http://www.youtube.com/@historiaparatontospodcast5148,UCeYSnd34IPe57sM8hkjWhrw,True,none,2.0,2024-05-28T02:01:58Z,2024-05-28T02:01:58Z
youtube#commentThread,LY5WGw22qMyplH0Nvg_9npk26qY,UgyOG5SwEkLlyrlUz0t4AaABAg,UCeYSnd34IPe57sM8hkjWhrw,wCm4FNSnDPs,youtube#comment,Cg2MLCwfBhawKKG2-Jb_CppW8zs,UgyOG5SwEkLlyrlUz0t4AaABAg,UCeYSnd34IPe57sM8hkjWhrw,wCm4FNSnDPs,Jajaja pobrecito de Iker! No lo dejan ser!! Que malo eres teca!! Buen episodio. Estuvo muy bueno,Jajaja pobrecito de Iker! No lo dejan ser!! Que malo eres teca!! Buen episodio. Estuvo muy bueno,@lorenavelazqueztorres9813,https://yt3.ggpht.com/ytc/AIdro_lTVeac9TBBd07-AHzhpJtJaLgoqVGs9xKCtVA_W9cscirrK8ltE9feTCBKXtWrgp2aHQ=s48-c-k-c0x00ffffff-no-rj,http://www.youtube.com/@lorenavelazqueztorres9813,UCqqFZpFkm-bnQa13JNLc5zA,True,none,0.0,2024-10-13T17:12:46Z,2024-10-13T17:12:46Z,True,0.0,True,,,,,,,,,,,,,
youtube#commentThread,UjC8Zzi7H1OatE0qPZj4Q6hqVFw,UgyJrWIEbpPO4_XhZOx4AaABAg,UCeYSnd34IPe57sM8hkjWhrw,wCm4FNSnDPs,youtube#comment,myqT7ng620H6rkH-FHXKp_YTJdE,UgyJrWIEbpPO4_XhZOx4AaABAg,UCeYSnd34IPe57sM8hkjWhrw,wCm4FNSnDPs,"Saludos mi gente, me encanta su podcast. Deberían hablar en algún capítulo sobre el gran Calígula, estoy seguro que las risas no faltarían jajajajaj. Saludos desde Colombia!","Saludos mi gente, me encanta su podcast. Deberían hablar en algún capítulo sobre el gran Calígula, estoy seguro que las risas no faltarían jajajajaj. Saludos desde Colombia!",@diegoalejandrovidalrestrep7116,https://yt3.ggpht.com/ytc/AIdro_mwikkG2P2zvStKb9NbAmW3taNOe5jhgk5Mi_hvWaiOC6Y=s48-c-k-c0x00ffffff-no-rj,http://www.youtube.com/@diegoalejandrovidalrestrep7116,UC4J71zc7m1wWq1V6cNKKQYg,True,none,0.0,2024-10-13T13:42:41Z,2024-10-13T13:42:41Z,True,0.0,True,,,,,,,,,,,,,
youtube#commentThread,zyfDEnSV278PfvkbTx4rDojwkFA,UgxLe9KGhIt05RAxbDh4AaABAg,UCeYSnd34IPe57sM8hkjWhrw,wCm4FNSnDPs,youtube#comment,PK6sz6QnPJLQwaG7pbyg2DAzdDY,UgxLe9KGhIt05RAxbDh4AaABAg,UCeYSnd34IPe57sM8hkjWhrw,wCm4FNSnDPs,No mms como el iker no sabe que hay una casa que se dice que vivió Benito Juárez y tiene un podcasts de historia 😂,No mms como el iker no sabe que hay una casa que se dice que vivió Benito Juárez y tiene un podcasts de historia 😂,@olivoek4943,https://yt3.ggpht.com/ytc/AIdro_kUpev3UoxeMEST6HoCvjFH_DgpCCzbrQK_oNUjTkthH2-WV5A-n1zN2EavYE8xZ7xOFQ=s48-c-k-c0x00ffffff-no-rj,http://www.youtube.com/@olivoek4943,UC4fA8M7r-SPeyvI5zLhmbVQ,True,none,0.0,2024-10-12T21:22:56Z,2024-10-12T21:22:56Z,True,0.0,True,,,,,,,,,,,,,
youtube#commentThread,qp3q_ooCiA96Dg5EOQby2eM37eo,UgzrBn0PzLMlofvBDQx4AaABAg,UCeYSnd34IPe57sM8hkjWhrw,wCm4FNSnDPs,youtube#comment,byptIyK0GgzKPXTg4RZ9JdXXhc0,UgzrBn0PzLMlofvBDQx4AaABAg,UCeYSnd34IPe57sM8hkjWhrw,wCm4FNSnDPs,"Saludos chicos, los sigo desde el primer potcast en Spotify, y ahora escucho todos sus potcast mientras lavo la ropa y hago el aseo de la casa jajajaja un saludos para mis tontos favoritos ❤","Saludos chicos, los sigo desde el primer potcast en Spotify, y ahora escucho todos sus potcast mientras lavo la ropa y hago el aseo de la casa jajajaja un saludos para mis tontos favoritos ❤",@samuelflores3937,https://yt3.ggpht.com/ytc/AIdro_meLtS1C8gl1i7ctdw977aqXq65ZlRYz3nJcpNHxhajLNpRpb2AVHlBghoDuIef2xu6gQ=s48-c-k-c0x00ffffff-no-rj,http://www.youtube.com/@samuelflores3937,UCwX5UkZthvYlAl3cTiL63qA,True,none,0.0,2024-10-12T21:13:07Z,2024-10-12T21:13:07Z,True,0.0,True,,,,,,,,,,,,,
youtube#commentThread,j8od0-Yy8vYIV7zsUeACSBRJUKw,UgxP2_Y9eL1G75zyKUd4AaABAg,UCeYSnd34IPe57sM8hkjWhrw,wCm4FNSnDPs,youtube#comment,JkIG5ds0CKoLQhhDpvOgeXWeWag,UgxP2_Y9eL1G75zyKUd4AaABAg,UCeYSnd34IPe57sM8hkjWhrw,wCm4FNSnDPs,Chavos en noviembre voy a la cmdx recomienden museos porfas :) su podcast esta coolsito ❤,Chavos en noviembre voy a la cmdx recomienden museos porfas :) su podcast esta coolsito ❤,@eduardogamez6331,https://yt3.ggpht.com/rJgQ2YF3EUV5U_DfIn6yX78V1heqv46qqFy7pmrXmogitM3OrkeeE6HrLVU6WOzv-9oTECd9_w=s48-c-k-c0x00ffffff-no-rj,http://www.youtube.com/@eduardogamez6331,UC2KvC57taRsC-4EznL1v8Bw,True,none,1.0,2024-10-12T00:40:31Z,2024-10-12T00:40:31Z,True,1.0,True,"[{'kind': 'youtube#comment', 'etag': 'hbFh-HkHpSNd60h0DRapHTuohKk', 'id': 'UgxP2_Y9eL1G75zyKUd4AaABAg.A9TmY1CoQyLA9X5OH4i7Qj', 'snippet': {'channelId': 'UCeYSnd34IPe57sM8hkjWhrw', 'videoId': 'wCm4FNSnDPs', 'textDisplay': 'El de Antropología e Historia en Chapultepec', 'textOriginal': 'El de Antropología e Historia en Chapultepec', 'parentId': 'UgxP2_Y9eL1G75zyKUd4AaABAg', 'authorDisplayName': '@gerardomarin3704', 'authorProfileImageUrl': 'https://yt3.ggpht.com/ytc/AIdro_llsVXXNftH3IeJbqvGiarCVgu80IyChxSps7u5X2xSosc=s48-c-k-c0x00ffffff-no-rj', 'authorChannelUrl': 'http://www.youtube.com/@gerardomarin3704', 'authorChannelId': {'value': 'UCSx1Rju_L2MpgAxcmxgSmNg'}, 'canRate': True, 'viewerRating': 'none', 'likeCount': 0, 'publishedAt': '2024-10-13T07:31:40Z', 'updatedAt': '2024-10-13T07:31:40Z'}}]",,,,,,,,,,,,
youtube#commentThread,MpAatPnxrMf48MGe_lUfk7KYxWA,UgztcvCDulrMICrtect4AaABAg,UCeYSnd34IPe57sM8hkjWhrw,wCm4FNSnDPs,youtube#comment,fdEIEYu0SjH7r_WCaYRyvVKu89Y,UgztcvCDulrMICrtect4AaABAg,UCeYSnd34IPe57sM8hkjWhrw,wCm4FNSnDPs,Un saludo mis hermanos desde San Diego CA. Son unas unas riatas bien peludas y paradas alv. Pasado de lanza su contenido... ahuevo!!!,Un saludo mis hermanos desde San Diego CA. Son unas unas riatas bien peludas y paradas alv. Pasado de lanza su contenido... ahuevo!!!,@IRMC17,https://yt3.ggpht.com/ytc/AIdro_l01BbL5lABX-SbH32JPbtxYFTw0q_8IG6OWmxVRCh7FG4ikXjaFwgCw3dicMdaW20FGg=s48-c-k-c0x00ffffff-no-rj,http://www.youtube.com/@IRMC17,UCk3NZsBg-WBVup5OntBrhVQ,True,none,0.0,2024-10-11T22:50:13Z,2024-10-11T22:50:13Z,True,0.0,True,,,,,,,,,,,,,
youtube#commentThread,0jOhSdCUAemoY8emiSjrVJYeqNs,UgzjqUJ_GegyAM0U0bR4AaABAg,UCeYSnd34IPe57sM8hkjWhrw,wCm4FNSnDPs,youtube#comment,CFqQfBbukvxvJAozCGhc2m7_ZR4,UgzjqUJ_GegyAM0U0bR4AaABAg,UCeYSnd34IPe57sM8hkjWhrw,wCm4FNSnDPs,Hello mate,Hello mate,@isisaldivar7817,https://yt3.ggpht.com/ytc/AIdro_m9DGGEy8uJyhFMK_syYjX6IBeJjskJZDhlfv0CZcU=s48-c-k-c0x00ffffff-no-rj,http://www.youtube.com/@isisaldivar7817,UC1mpdoraCFwlC1EzNCWSWUg,True,none,0.0,2024-10-11T18:22:17Z,2024-10-11T18:22:17Z,True,0.0,True,,,,,,,,,,,,,
youtube#commentThread,os9Bxk5Uelnar4Qy56gQz6WQGwo,UgwVNk2I_julvEVUu5V4AaABAg,UCeYSnd34IPe57sM8hkjWhrw,wCm4FNSnDPs,youtube#comment,XFfECFC5HcsoLVQ44A3YslHgN2k,UgwVNk2I_julvEVUu5V4AaABAg,UCeYSnd34IPe57sM8hkjWhrw,wCm4FNSnDPs,Los conocí y ya solo los escucho a ustedes! Son interesantes y cómicos a la vez! Excelente!!<br>Tienen que escuchar los storybords de Tomás Rebord,"Los conocí y ya solo los escucho a ustedes! Son interesantes y cómicos a la vez! Excelente!!
Tienen que escuchar los storybords de Tomás Rebord",@lautarogerlo3771,https://yt3.ggpht.com/ytc/AIdro_nHzk2O3yfUhdgoznieCLNRuQHOiQG4iZDycJmhGKHnwYk=s48-c-k-c0x00ffffff-no-rj,http://www.youtube.com/@lautarogerlo3771,UCYTokTf35b6DPs2Q7vG6_Zg,True,none,0.0,2024-10-11T16:16:05Z,2024-10-11T16:16:05Z,True,0.0,True,,,,,,,,,,,,,
youtube#commentThread,yOILv9qK2j7h7R9bafa7UdScvUY,Ugz6gH1YMy-fSY9YIaN4AaABAg,UCeYSnd34IPe57sM8hkjWhrw,wCm4FNSnDPs,youtube#comment,aXHNpeTGbimh8Wdq9n7KknLJvlY,Ugz6gH1YMy-fSY9YIaN4AaABAg,UCeYSnd34IPe57sM8hkjWhrw,wCm4FNSnDPs,Imperio japonés pt4,Imperio japonés pt4,@ivanmelchor2889,https://yt3.ggpht.com/ytc/AIdro_nWKTGSonhM-T8UMp8LtgMeOca3WZgD7MbleE2lM08=s48-c-k-c0x00ffffff-no-rj,http://www.youtube.com/@ivanmelchor2889,UC6qmZLxUbR3ZIKT9Z2e2PCw,True,none,0.0,2024-10-11T15:49:35Z,2024-10-11T15:49:35Z,True,0.0,True,,,,,,,,,,,,,
youtube#commentThread,P7WoeiuuV_oE-eEtTiUhRcEB7PU,Ugz0IJJwwSARThjVwbZ4AaABAg,UCeYSnd34IPe57sM8hkjWhrw,wCm4FNSnDPs,youtube#comment,DFdFke5X0SNZ3XPPMrkjEgRlJhQ,Ugz0IJJwwSARThjVwbZ4AaABAg,UCeYSnd34IPe57sM8hkjWhrw,wCm4FNSnDPs,Saludos mis desconocidos🤣🤣 espero con ganas la sorpresa que puedan dar el 28 de diciembre... El primer año del podcast cuando dijeron q se terminaba!! Aún no lo supero,Saludos mis desconocidos🤣🤣 espero con ganas la sorpresa que puedan dar el 28 de diciembre... El primer año del podcast cuando dijeron q se terminaba!! Aún no lo supero,@AlbertoCortazar-vs4nw,https://yt3.ggpht.com/ytc/AIdro_n2udBzeYBteVO94AOvACDKqyHN4sBTqV2YenVzO3Y2Ic5h7sd9c1UhQi-g7V9kvb_L3A=s48-c-k-c0x00ffffff-no-rj,http://www.youtube.com/@AlbertoCortazar-vs4nw,UCavoJnHmfUqvG8mOMeInzzQ,True,none,0.0,2024-10-11T12:54:37Z,2024-10-11T12:54:37Z,True,0.0,True,,,,,,,,,,,,,
youtube#commentThread,s-IFky9P4usTjaFV9WyWwbB-Kjk,Ugz6w-vvBvBYXbWGRYl4AaABAg,UCeYSnd34IPe57sM8hkjWhrw,wCm4FNSnDPs,youtube#comment,VUzSOIbXkKX0Kh4qt8SzaNwAIH0,Ugz6w-vvBvBYXbWGRYl4AaABAg,UCeYSnd34IPe57sM8hkjWhrw,wCm4FNSnDPs,y si robin wiliams se 5uic1do para protejerse de beyonce?,y si robin wiliams se 5uic1do para protejerse de beyonce?,@LuisRodrigoLopezYhmoff,https://yt3.ggpht.com/ytc/AIdro_lH1zJmlsA1WqGJZyMpgTbIfXRnmiC714MlofQqnMaTuRgkpG4o42a60HhOGPyJpAPAuA=s48-c-k-c0x00ffffff-no-rj,http://www.youtube.com/@LuisRodrigoLopezYhmoff,UCC_GWcA2Phsr8pQIaKj_xLg,True,none,3.0,2024-10-11T12:22:24Z,2024-10-11T12:22:24Z,True,0.0,True,,,,,,,,,,,,,
youtube#commentThread,ULUAL8E_O4bHdpuOIN74XSHRjJo,UgzjWmxpQ3WqE9E61cd4AaABAg,UCeYSnd34IPe57sM8hkjWhrw,wCm4FNSnDPs,youtube#comment,EO1_d-vIIhjQxHlXMw9Lng0To4I,UgzjWmxpQ3WqE9E61cd4AaABAg,UCeYSnd34IPe57sM8hkjWhrw,wCm4FNSnDPs,Última vez que se atrasan al subir el podcast sin avisar me quede esperando y pensando que habrá pasado jaja,Última vez que se atrasan al subir el podcast sin avisar me quede esperando y pensando que habrá pasado jaja,@manuelabasto4573,https://yt3.ggpht.com/ytc/AIdro_k-uytXZfyM_Ria9_XlSMtJQSCBbZQZVaM5HnN0usoeyQ=s48-c-k-c0x00ffffff-no-rj,http://www.youtube.com/@manuelabasto4573,UCZXATMMsEvXtT1UCCbsvzbg,True,none,0.0,2024-10-11T12:06:52Z,2024-10-11T12:06:52Z,True,0.0,True,,,,,,,,,,,,,
youtube#commentThread,HgkALOKn1t_1pueyPRMASboU1Cs,UgyJ3nZr609gISgQV7F4AaABAg,UCeYSnd34IPe57sM8hkjWhrw,wCm4FNSnDPs,youtube#comment,WEgSyc_9H-BbWbJcOt2SlqRVKqk,UgyJ3nZr609gISgQV7F4AaABAg,UCeYSnd34IPe57sM8hkjWhrw,wCm4FNSnDPs,Hola hola. Un par de preguntas.<br>1. Es posible un episodio de Augusto Pinochet v/s Allende?<br>2. Algún día aprenderán a pronunciar Tarapacá?,"Hola hola. Un par de preguntas.
1. Es posible un episodio de Augusto Pinochet v/s Allende?
2. Algún día aprenderán a pronunciar Tarapacá?",@woafistico,https://yt3.ggpht.com/ytc/AIdro_nWxS0fN16JO_U3H0gM29PbEfh9R_e6gyWGH1RhQHQaRw=s48-c-k-c0x00ffffff-no-rj,http://www.youtube.com/@woafistico,UCE8MlmyeondB-130MP7cI8A,True,none,2.0,2024-10-11T11:52:47Z,2024-10-11T11:52:47Z,True,0.0,True,,,,,,,,,,,,,
youtube#commentThread,XkThGOZId_pPGWqHMISphvBF2sA,UgxbxfwHX2SSySBx6MF4AaABAg,UCeYSnd34IPe57sM8hkjWhrw,wCm4FNSnDPs,youtube#comment,mbfqal5-r2tyZAytlFR9KV9ZW5s,UgxbxfwHX2SSySBx6MF4AaABAg,UCeYSnd34IPe57sM8hkjWhrw,wCm4FNSnDPs,SE ESTÁ HACIENDO CANON Q IKER Y TEKA HACEN EL AMOR<br>impero japonés parte 4 va a ser mientras se graba el s3x tape también,"SE ESTÁ HACIENDO CANON Q IKER Y TEKA HACEN EL AMOR
impero japonés parte 4 va a ser mientras se graba el s3x tape también",@josueestrada6170,https://yt3.ggpht.com/ytc/AIdro_mMN3EMPm3ViIafObzQnzC8O-X7tVuKqE_Vp7Z081tOIcQD=s48-c-k-c0x00ffffff-no-rj,http://www.youtube.com/@josueestrada6170,UCxtF5gYfOjiAI57jnYUZPwQ,True,none,0.0,2024-10-11T06:26:14Z,2024-10-11T06:26:14Z,True,0.0,True,,,,,,,,,,,,,
youtube#commentThread,sEBI9EEy6T-0bEPrWZW30gl_IIs,UgwKlLDQnWVL_LOpE1d4AaABAg,UCeYSnd34IPe57sM8hkjWhrw,wCm4FNSnDPs,youtube#comment,kcZ5LOjPphfGKdazi1bbwgxM2LM,UgwKlLDQnWVL_LOpE1d4AaABAg,UCeYSnd34IPe57sM8hkjWhrw,wCm4FNSnDPs,"Gracias por el podcast de la semana, mis amores. Los extrañé ❤","Gracias por el podcast de la semana, mis amores. Los extrañé ❤",@LadySkywalkerW,https://yt3.ggpht.com/ytc/AIdro_lwbDah96CnBihX4Y-e36Gm0TnYnOORwUSk-Wx4KTUTgw=s48-c-k-c0x00ffffff-no-rj,http://www.youtube.com/@LadySkywalkerW,UCC-kANsNvPcG9ut34SPngeg,True,none,0.0,2024-10-11T03:38:25Z,2024-10-11T03:38:25Z,True,0.0,True,,,,,,,,,,,,,
youtube#commentThread,K4RP1-d9Y0iQX1E1gHfFGpYzexo,UgzKLF5Zm0zSKCjpA594AaABAg,UCeYSnd34IPe57sM8hkjWhrw,wCm4FNSnDPs,youtube#comment,8l1LhKLgFXsn3jZplJ14qWqKYmo,UgzKLF5Zm0zSKCjpA594AaABAg,UCeYSnd34IPe57sM8hkjWhrw,wCm4FNSnDPs,"Al chile que desesperación ver la banderita mal acomodada abajo, no pude ver el video, solo escucharlo jaja","Al chile que desesperación ver la banderita mal acomodada abajo, no pude ver el video, solo escucharlo jaja",@victorvatl149,https://yt3.ggpht.com/ytc/AIdro_lcMawsxGPkln1NhT0KjfXAGjawrFgPeeC755xELVc=s48-c-k-c0x00ffffff-no-rj,http://www.youtube.com/@victorvatl149,UCZvOWNzKMNdKGJEd7-N9oqQ,True,none,4.0,2024-10-11T03:33:48Z,2024-10-11T03:33:48Z,True,0.0,True,,,,,,,,,,,,,
youtube#commentThread,8VF0G_kOlYCM2yxHjvG5mXToQJM,UgwDKCEWtoVetri_tht4AaABAg,UCeYSnd34IPe57sM8hkjWhrw,wCm4FNSnDPs,youtube#comment,7aG_xnSaQXGwttq_dvTxBLK6ftY,UgwDKCEWtoVetri_tht4AaABAg,UCeYSnd34IPe57sM8hkjWhrw,wCm4FNSnDPs,"Hola tonotos, me mama el podcast. Los escucho mientras corro en el parque y así se me canso menos.<br><br>Inviten a Zunzunegui para un capítulo de los mitos más famosos de la historia de México, desmientan las mamadas heroicas y de villanos que nos enseñaban los libros de la SEP","Hola tonotos, me mama el podcast. Los escucho mientras corro en el parque y así se me canso menos.

Inviten a Zunzunegui para un capítulo de los mitos más famosos de la historia de México, desmientan las mamadas heroicas y de villanos que nos enseñaban los libros de la SEP",@carlosricardo7846,https://yt3.ggpht.com/ytc/AIdro_nZLN-vOMLDBtY_Uo5epxaWH3FbAm4dCma-eYgiRX4=s48-c-k-c0x00ffffff-no-rj,http://www.youtube.com/@carlosricardo7846,UCV0VPVA9biTi4XXTHvpQAyA,True,none,3.0,2024-10-11T02:54:54Z,2024-10-11T02:55:09Z,True,1.0,True,"[{'kind': 'youtube#comment', 'etag': '-3re8MIwLJPrXeDVElKUxMeZGO4', 'id': 'UgwDKCEWtoVetri_tht4AaABAg.A9RS7Kr88aIA9RWWx1k3_A', 'snippet': {'channelId': 'UCeYSnd34IPe57sM8hkjWhrw', 'videoId': 'wCm4FNSnDPs', 'textDisplay': 'Siiiiiii estaría muy cabrón mi hermano!!', 'textOriginal': 'Siiiiiii estaría muy cabrón mi hermano!!', 'parentId': 'UgwDKCEWtoVetri_tht4AaABAg', 'authorDisplayName': '@amilkariliammontielmolina9298', 'authorProfileImageUrl': 'https://yt3.ggpht.com/ytc/AIdro_lFTMfXRN71f0h-E4HpaSZDmsLKuVcE_yyfLoREXPMew0Ua=s48-c-k-c0x00ffffff-no-rj', 'authorChannelUrl': 'http://www.youtube.com/@amilkariliammontielmolina9298', 'authorChannelId': {'value': 'UC9vr8wOEhLkL28Ch1JzYRiA'}, 'canRate': True, 'viewerRating': 'none', 'likeCount': 0, 'publishedAt': '2024-10-11T03:33:21Z', 'updatedAt': '2024-10-11T03:33:21Z'}}]",,,,,,,,,,,,
youtube#commentThread,7baol0vMEODkdFEkW5X23x_uao0,Ugxk3uscHfHKDj-3Hsl4AaABAg,UCeYSnd34IPe57sM8hkjWhrw,wCm4FNSnDPs,youtube#comment,gTAs4-uCGkx_QTzJigXRwXzh3-0,Ugxk3uscHfHKDj-3Hsl4AaABAg,UCeYSnd34IPe57sM8hkjWhrw,wCm4FNSnDPs,Segundo comentario 😁,Segundo comentario 😁,@GermainVelez-w3v,https://yt3.ggpht.com/ytc/AIdro_kVfxBemKTXVOvYzuHj3r_aqBBGDF_m8iUtvR9qB3klUkFKm43FfQihtLRU7-euWiffJg=s48-c-k-c0x00ffffff-no-rj,http://www.youtube.com/@GermainVelez-w3v,UCbrPwylvOwhRI3vDkx47d8A,True,none,1.0,2024-10-11T01:40:11Z,2024-10-11T01:40:11Z,True,0.0,True,,,,,,,,,,,,,
youtube#commentThread,bxi2pLr1rgdHedjwAheyQYvmUXU,Ugx8Kkzvo7lQrIZXIcJ4AaABAg,UCeYSnd34IPe57sM8hkjWhrw,wCm4FNSnDPs,youtube#comment,npGcJikdX6hCDc9_bI41F4zYu7Q,Ugx8Kkzvo7lQrIZXIcJ4AaABAg,UCeYSnd34IPe57sM8hkjWhrw,wCm4FNSnDPs,Primer comentario,Primer comentario,@MartinAguilar-iv2nx,https://yt3.ggpht.com/ytc/AIdro_lMPVn-bYZHze4x8YxzN28-Vj2qW2tnuBYtXcbnuHNJ3Y-H=s48-c-k-c0x00ffffff-no-rj,http://www.youtube.com/@MartinAguilar-iv2nx,UC1QBPgmVhFzwdhYvJJIQODA,True,none,1.0,2024-10-11T01:37:58Z,2024-10-11T01:37:58Z,True,0.0,True,,,,,,,,,,,,,
youtube#comment,hbFh-HkHpSNd60h0DRapHTuohKk,UgxP2_Y9eL1G75zyKUd4AaABAg.A9TmY1CoQyLA9X5OH4i7Qj,UCeYSnd34IPe57sM8hkjWhrw,wCm4FNSnDPs,,,,,,,,,,,,,,,,,,,,,El de Antropología e Historia en Chapultepec,El de Antropología e Historia en Chapultepec,UgxP2_Y9eL1G75zyKUd4AaABAg,@gerardomarin3704,https://yt3.ggpht.com/ytc/AIdro_llsVXXNftH3IeJbqvGiarCVgu80IyChxSps7u5X2xSosc=s48-c-k-c0x00ffffff-no-rj,http://www.youtube.com/@gerardomarin3704,UCSx1Rju_L2MpgAxcmxgSmNg,True,none,0.0,2024-10-13T07:31:40Z,2024-10-13T07:31:40Z
youtube#comment,-3re8MIwLJPrXeDVElKUxMeZGO4,UgwDKCEWtoVetri_tht4AaABAg.A9RS7Kr88aIA9RWWx1k3_A,UCeYSnd34IPe57sM8hkjWhrw,wCm4FNSnDPs,,,,,,,,,,,,,,,,,,,,,Siiiiiii estaría muy cabrón mi hermano!!,Siiiiiii estaría muy cabrón mi hermano!!,UgwDKCEWtoVetri_tht4AaABAg,@amilkariliammontielmolina9298,https://yt3.ggpht.com/ytc/AIdro_lFTMfXRN71f0h-E4HpaSZDmsLKuVcE_yyfLoREXPMew0Ua=s48-c-k-c0x00ffffff-no-rj,http://www.youtube.com/@amilkariliammontielmolina9298,UC9vr8wOEhLkL28Ch1JzYRiA,True,none,0.0,2024-10-11T03:33:21Z,2024-10-11T03:33:21Z
youtube#commentThread,T1CyvqdC8PZKnmwvIbGwFlf5D8s,Ugw3_KAqOHt1p-oLO394AaABAg,UCeYSnd34IPe57sM8hkjWhrw,o7l_d75l-eo,youtube#comment,LPkUxLHvUdU263V7efdsoUjwXS0,Ugw3_KAqOHt1p-oLO394AaABAg,UCeYSnd34IPe57sM8hkjWhrw,o7l_d75l-eo,"Francely, en Belice se usa el dólar beliceño (no americano) y siguen siendo colonia británica, eso NO es gentrificación. Mérida NO es colonia!<br>En Singapur no hay ningún monumento a algún conquistador.<br><br>Iker y Teca, los restos de Cortés están Pino Suárez. Montejo primero se dirigió a Chichen itza y SÍ había itzaes, ahí estuvieron juntos, pero cuando comenzaron a adueñarse de sus mujeres y querer cobran o puestos los expulsaron y persiguieron (en su camino fundaron Dzilam y otras ciudades). Despues vino la fundación de Mérida y lo que antes se llamaba Tho.<br>El fray Diego de Landa fue quien hizo el acto de fé y quemo casi todo el conocimiento maya. DIEGO DE LANDA!<br><br>Y así como ésto, muchas y muchas inconsistencias y errores.<br>Cuando se habla de historia se debe ser muy preciso, sino se convierte en un ensayo de secundaria.<br>Ahora entiendo porque se llama historia para tontos... A ese sector van dirigidos.<br>Primer y último episodio que escucho.","Francely, en Belice se usa el dólar beliceño (no americano) y siguen siendo colonia británica, eso NO es gentrificación. Mérida NO es colonia!
En Singapur no hay ningún monumento a algún conquistador.

Iker y Teca, los restos de Cortés están Pino Suárez. Montejo primero se dirigió a Chichen itza y SÍ había itzaes, ahí estuvieron juntos, pero cuando comenzaron a adueñarse de sus mujeres y querer cobran o puestos los expulsaron y persiguieron (en su camino fundaron Dzilam y otras ciudades). Despues vino la fundación de Mérida y lo que antes se llamaba Tho.
El fray Diego de Landa fue quien hizo el acto de fé y quemo casi todo el conocimiento maya. DIEGO DE LANDA!

Y así como ésto, muchas y muchas inconsistencias y errores.
Cuando se habla de historia se debe ser muy preciso, sino se convierte en un ensayo de secundaria.
Ahora entiendo porque se llama historia para tontos... A ese sector van dirigidos.
Primer y último episodio que escucho.",@Angelina_Quiroz,https://yt3.ggpht.com/ytc/AIdro_lImVEFshLCzwKPwsKil_wI44W3fLO5VgHisdM_-Jtm5ZMsPSMXFTRot9-tSU3zW38Ftw=s48-c-k-c0x00ffffff-no-rj,http://www.youtube.com/@Angelina_Quiroz,UChqh572KFTwDMhbitpiJJhA,True,none,4.0,2024-07-16T04:41:55Z,2024-07-16T04:45:47Z,True,0.0,True,,,,,,,,,,,,,
youtube#commentThread,hln4no1uTyH0tc1KDCJWmXf8DNc,Ugwi7-Ksr_2Syn1aZd14AaABAg,UCeYSnd34IPe57sM8hkjWhrw,o7l_d75l-eo,youtube#comment,wmzBMmwFLFeTqGKclXcwYXcYV9I,Ugwi7-Ksr_2Syn1aZd14AaABAg,UCeYSnd34IPe57sM8hkjWhrw,o7l_d75l-eo,Lo mejor es la casaca de Venados!,Lo mejor es la casaca de Venados!,@oguerra31,https://yt3.ggpht.com/ytc/AIdro_mFOiVg1Uq2q_LnfGJz_NW1zF363d70AbPGvTjoz54=s48-c-k-c0x00ffffff-no-rj,http://www.youtube.com/@oguerra31,UCuWvtanCEZgfXayybtJhBcQ,True,none,0.0,2024-06-29T05:01:40Z,2024-06-29T05:01:40Z,True,0.0,True,,,,,,,,,,,,,
youtube#commentThread,iQyM4Fym5XViWBi4jlrDfxCwqvM,UgyEiq7UJg1snpD-fQx4AaABAg,UCeYSnd34IPe57sM8hkjWhrw,o7l_d75l-eo,youtube#comment,RfgLvyNEf_DDVZmkCBp9n-yccy0,UgyEiq7UJg1snpD-fQx4AaABAg,UCeYSnd34IPe57sM8hkjWhrw,o7l_d75l-eo,Hagan la batalla de Tarapaca!,Hagan la batalla de Tarapaca!,@TheRajastein,https://yt3.ggpht.com/ytc/AIdro_nMGdR3HSixC7x_4tZIarvZgWCMIsGutyMTe5A4bc8=s48-c-k-c0x00ffffff-no-rj,http://www.youtube.com/@TheRajastein,UCsKtbwyHM0U7dzSur9a-PGg,True,none,0.0,2024-06-12T00:09:08Z,2024-06-12T00:09:08Z,True,0.0,True,,,,,,,,,,,,,
youtube#commentThread,0hwExtHkF46kYnyNGfUEdfrcbhE,Ugx6eHKQh-x8nJhuj854AaABAg,UCeYSnd34IPe57sM8hkjWhrw,o7l_d75l-eo,youtube#comment,iUbv-Qd2Pj5Lnx-iXgMWA5nmHiQ,Ugx6eHKQh-x8nJhuj854AaABAg,UCeYSnd34IPe57sM8hkjWhrw,o7l_d75l-eo,"Es Historia PARA tontos, se supone que el tonto soy yo, no ustedes 🤣","Es Historia PARA tontos, se supone que el tonto soy yo, no ustedes 🤣",@joandavidfajardorios6024,https://yt3.ggpht.com/ytc/AIdro_mVIC891yV4gboGi32couoc_peRct7FUm6rvUkfkmIGJcY=s48-c-k-c0x00ffffff-no-rj,http://www.youtube.com/@joandavidfajardorios6024,UCj08F_WmpU3XbjyRf6m72Bw,True,none,0.0,2024-06-05T15:50:16Z,2024-06-05T15:50:16Z,True,0.0,True,,,,,,,,,,,,,
youtube#commentThread,qbKLdpwu1pZM_0REMtBKFX08gAE,Ugy5O8KPegCQcSQnekd4AaABAg,UCeYSnd34IPe57sM8hkjWhrw,o7l_d75l-eo,youtube#comment,NoifV6JfpXdaUFGwWrOYMIeO7iI,Ugy5O8KPegCQcSQnekd4AaABAg,UCeYSnd34IPe57sM8hkjWhrw,o7l_d75l-eo,Siempre vengo a Youtube porque dicen que Iker está chulón y termino decepcionado 🫤,Siempre vengo a Youtube porque dicen que Iker está chulón y termino decepcionado 🫤,@alvarocampos2966,https://yt3.ggpht.com/ytc/AIdro_k7TLyNcTul6KpEgNhTtcVPv_i6lN3sgOVa5NbUsic=s48-c-k-c0x00ffffff-no-rj,http://www.youtube.com/@alvarocampos2966,UCZUAPsWH8FPp7gmos_a4qpw,True,none,0.0,2024-05-28T14:59:17Z,2024-05-28T15:00:19Z,True,0.0,True,,,,,,,,,,,,,
youtube#commentThread,FUUJU4iKTfqjUN8O9WqDdKv-3rM,Ugy1L5Wc-szIXb1lw9R4AaABAg,UCeYSnd34IPe57sM8hkjWhrw,o7l_d75l-eo,youtube#comment,HGfO8uq3WyWxcsAiWisJo3AFKHs,Ugy1L5Wc-szIXb1lw9R4AaABAg,UCeYSnd34IPe57sM8hkjWhrw,o7l_d75l-eo,"¡Gentrificacion Positiva! Hola soy de Tijuana, desde que tengo memoria (tengo 40 años) Aquí las compras y el uso del dolar es de uso diario. Les mando un saludo y los 20 minutos de inicio son tan interesantes como el resto del tiempo del tema que se tratá","¡Gentrificacion Positiva! Hola soy de Tijuana, desde que tengo memoria (tengo 40 años) Aquí las compras y el uso del dolar es de uso diario. Les mando un saludo y los 20 minutos de inicio son tan interesantes como el resto del tiempo del tema que se tratá",@Foxerer,https://yt3.ggpht.com/ytc/AIdro_mqSNezEJnqcZwQIrJ0OxSJBrpG74YnLXhSC9m-iB1FADr-=s48-c-k-c0x00ffffff-no-rj,http://www.youtube.com/@Foxerer,UC7UBfty07JrNjauVNVBHIIQ,True,none,0.0,2024-05-24T21:59:13Z,2024-05-24T21:59:13Z,True,0.0,True,,,,,,,,,,,,,
