kind,etag,id,snippet.channelId,snippet.videoId,snippet.topLevelComment.kind,snippet.topLevelComment.etag,snippet.topLevelComment.id,snippet.topLevelComment.snippet.channelId,snippet.topLevelComment.snippet.videoId,snippet.topLevelComment.snippet.textDisplay,snippet.topLevelComment.snippet.textOriginal,snippet.topLevelComment.snippet.authorDisplayName,snippet.topLevelComment.snippet.authorProfileImageUrl,snippet.topLevelComment.snippet.authorChannelUrl,snippet.topLevelComment.snippet.authorChannelId.value,snippet.topLevelComment.snippet.canRate,snippet.topLevelComment.snippet.viewerRating,snippet.topLevelComment.snippet.likeCount,snippet.topLevelComment.snippet.publishedAt,snippet.topLevelComment.snippet.updatedAt,snippet.canReply,snippet.totalReplyCount,snippet.isPublic,replies.comments,snippet.textDisplay,snippet.textOriginal,snippet.parentId,snippet.authorDisplayName,snippet.authorProfileImageUrl,snippet.authorChannelUrl,snippet.authorChannelId.value,snippet.canRate,snippet.viewerRating,snippet.likeCount,snippet.publishedAt,snippet.updatedAt
youtube#commentThread,35SzVbfAjbh-WxxI6CDcz8jJalE,Ugz0QmXyVLSM0nUK7kB4AaABAg,UCeYSnd34IPe57sM8hkjWhrw,cQ9RLDhq6JY,youtube#comment,yopv5G2xkuk2ZN4mdQMDcEtKmS4,Ugz0QmXyVLSM0nUK7kB4AaABAg,UCeYSnd34IPe57sM8hkjWhrw,cQ9RLDhq6JY,"Me gusta su podcast, pero solo he escuchado los que están en Youtube, por favor suban todos los capítulos de Spotify a YouTube, muchas gracias","Me gusta su podcast, pero solo he escuchado los que están en Youtube, por favor suban todos los capítulos de Spotify a YouTube, muchas gracias",@fabianbecerra2272,https://yt3.ggpht.com/ytc/AIdro_nTXgELBQMWE4Ir8svSdi0RIoWd-SfyZM3_Svweath2GHOO=s48-c-k-c0x00ffffff-no-rj,http://www.youtube.com/@fabianbecerra2272,UC3In6JIjltN9q3vYip-nhbA,True,none,0.0,2024-07-15T12:41:43Z,2024-07-15T12:41:43Z,True,0.0,True,,,,,,,,,,,,,
youtube#commentThread,D5l-LBB9fD-VlBImz-EN9K8mTmM,UgyJhRBhVcbyStZdxjR4AaABAg,UCeYSnd34IPe57sM8hkjWhrw,cQ9RLDhq6JY,youtube#comment,avm1UM6tZkxbnMkp59t7_36GZrk,UgyJhRBhVcbyStZdxjR4AaABAg,UCeYSnd34IPe57sM8hkjWhrw,cQ9RLDhq6JY,weeeeey,weeeeey,@SantiagoItzcoatl,https://yt3.ggpht.com/ytc/AIdro_kNp7nO6H8vr_5I7bvyKls8Xw92PscyLo7G5HayDsfReTY=s48-c-k-c0x00ffffff-no-rj,http://www.youtube.com/@SantiagoItzcoatl,UCbDEMBgOeP90oPLWs7-FDvQ,True,none,0.0,2024-05-26T21:41:04Z,2024-05-26T21:41:04Z,True,0.0,True,,,,,,,,,,,,,
youtube#commentThread,iKN6FQSPLo3xUlizd--6R0h2SN8,UgzT1q2am7kMEM5ckDp4AaABAg,UCeYSnd34IPe57sM8hkjWhrw,cQ9RLDhq6JY,youtube#comment,g6vw71KL8rJyQPLYPCUCm4O6rbA,UgzT1q2am7kMEM5ckDp4AaABAg,UCeYSnd34IPe57sM8hkjWhrw,cQ9RLDhq6JY,Les voy a enviar una foto de TARAPACA,Les voy a enviar una foto de TARAPACA,@Sonyeke_1,https://yt3.ggpht.com/LbaGDpq2Z-xKWB2ll8EsNzoUarz3MIX_bQpOXUPBp9uzneST04rMzp1HP33C4Hj2BhhlA8fT3g=s48-c-k-c0x00ffffff-no-rj,http://www.youtube.com/@Sonyeke_1,UCPfzEUeII0UXFcf2t01dClA,True,none,0.0,2024-05-23T22:06:21Z,2024-05-23T22:06:21Z,True,0.0,True,,,,,,,,,,,,,
youtube#commentThread,hkErqy7RZOwAKS6YyNXqwPFTCAg,Ugyckucg38lqZFdZhaR4AaABAg,UCeYSnd34IPe57sM8hkjWhrw,cQ9RLDhq6JY,youtube#comment,soQFV-F5m7bRA03fMjI1IoKQrGs,Ugyckucg38lqZFdZhaR4AaABAg,UCeYSnd34IPe57sM8hkjWhrw,cQ9RLDhq6JY,Entonces Teca esta  solterooooooooooooooo! ❤  woooooo,Entonces Teca esta  solterooooooooooooooo! ❤  woooooo,@alejandranavarro464,https://yt3.ggpht.com/_IdCNA3l2e4QZ175cWoUUzp_EG53aDHwC_Kf940vrAgfK75Vhph_tJ7B2vNTFBL_NeC3mbxf4A=s48-c-k-c0x00ffffff-no-rj,http://www.youtube.com/@alejandranavarro464,UCwfZIbgLOHYsNdWFfiMmfHg,True,none,0.0,2024-05-05T09:24:57Z,2024-05-05T09:24:57Z,True,0.0,True,,,,,,,,,,,,,
youtube#commentThread,9c50dNDxQ96ZYyFK1aeJYj4ofnQ,UgzhZHVt-tEbDpbCvtB4AaABAg,UCeYSnd34IPe57sM8hkjWhrw,cQ9RLDhq6JY,youtube#comment,wLebngIiKaOrIw1ibNjosSTEyFc,UgzhZHVt-tEbDpbCvtB4AaABAg,UCeYSnd34IPe57sM8hkjWhrw,cQ9RLDhq6JY,"Me encantan sus podcast, los escucho en spotify cuando viajo al trabajo! Cuando los conoci todavia usaban los microfonos viejos😂<br>Los felicito por terrible laburo que hacen y la onda que le ponen<br>Saludos desde Argentina💛","Me encantan sus podcast, los escucho en spotify cuando viajo al trabajo! Cuando los conoci todavia usaban los microfonos viejos😂
Los felicito por terrible laburo que hacen y la onda que le ponen
Saludos desde Argentina💛",@fiorellamartinez873,https://yt3.ggpht.com/ytc/AIdro_nrymCrT3X9YajJM76jpe6tbXiDBSZCZEMUolQsOPxUDLae=s48-c-k-c0x00ffffff-no-rj,http://www.youtube.com/@fiorellamartinez873,UC_aIjI_NTlEUd_zFkmTcpJQ,True,none,0.0,2024-04-21T21:09:08Z,2024-04-21T21:09:08Z,True,0.0,True,,,,,,,,,,,,,
youtube#commentThread,IMWj7jiP7fhzDhqcKehNq9rqub8,UgwrcWmR1WFRrp1eNDV4AaABAg,UCeYSnd34IPe57sM8hkjWhrw,cQ9RLDhq6JY,youtube#comment,tlvH3P8DBKfnhP7nvu0Tdd_VQOY,UgwrcWmR1WFRrp1eNDV4AaABAg,UCeYSnd34IPe57sM8hkjWhrw,cQ9RLDhq6JY,"Les dejo el mismo comentario que en iPodcast pero sé que no lo verán lol así que les quería felicitar porque los sigo fielmente desde el capítulo número ocho! 👏🏻 Un saludote desde Colombia, espero algún día verlos. <br><br>Dejaré la vergüenza y les comentaré más seguido! 🇨🇴","Les dejo el mismo comentario que en iPodcast pero sé que no lo verán lol así que les quería felicitar porque los sigo fielmente desde el capítulo número ocho! 👏🏻 Un saludote desde Colombia, espero algún día verlos. 

Dejaré la vergüenza y les comentaré más seguido! 🇨🇴",@angelicaaixag,https://yt3.ggpht.com/ytc/AIdro_n_VMYnmDVZNkFUrFDYjXiSC5c5XUc-n5cSg6jMZ6dC59w=s48-c-k-c0x00ffffff-no-rj,http://www.youtube.com/@angelicaaixag,UCvVTDVH4NsYshCKLKYdhM2Q,True,none,0.0,2024-04-21T14:07:13Z,2024-04-21T14:07:13Z,True,0.0,True,,,,,,,,,,,,,
youtube#commentThread,tJE1ktJ7jmnk1YavbnCxkIusEIc,UgwYysDGryEsZbRTAU14AaABAg,UCeYSnd34IPe57sM8hkjWhrw,cQ9RLDhq6JY,youtube#comment,3sn6c7a7MjPlXjpqK5M5T12G4sE,UgwYysDGryEsZbRTAU14AaABAg,UCeYSnd34IPe57sM8hkjWhrw,cQ9RLDhq6JY,Va a llegar el podcast de la guerra de China vs Taiwan y la de la guerra del medio oriente y seguiremos esperando la tercera parte del imperio japones 😁,Va a llegar el podcast de la guerra de China vs Taiwan y la de la guerra del medio oriente y seguiremos esperando la tercera parte del imperio japones 😁,@everlopez7073,https://yt3.ggpht.com/ytc/AIdro_k6fw9vKcDAuvnXi9WsgEk15f_HmEcmvBbTx6hiZGL2B7w=s48-c-k-c0x00ffffff-no-rj,http://www.youtube.com/@everlopez7073,UCXvmnkFrELyixdcNFadRfdA,True,none,0.0,2024-04-17T15:58:46Z,2024-04-17T15:58:46Z,True,0.0,True,,,,,,,,,,,,,
youtube#commentThread,UlHWlQZ-fmWV3eq8x2qHGL4iGx0,UgxFEqcV0iismXwJim54AaABAg,UCeYSnd34IPe57sM8hkjWhrw,cQ9RLDhq6JY,youtube#comment,-o035aZfxMhu0CoQVnr6veEpXPc,UgxFEqcV0iismXwJim54AaABAg,UCeYSnd34IPe57sM8hkjWhrw,cQ9RLDhq6JY,❤,❤,@miguelleal4920,https://yt3.ggpht.com/ytc/AIdro_lomUyWLDjs8BbUtU7XjeNNoFg76Ai22p5huLPehaLTKxY=s48-c-k-c0x00ffffff-no-rj,http://www.youtube.com/@miguelleal4920,UCvHySKELM8S4ZWFUETyoTRA,True,none,0.0,2024-04-15T14:48:27Z,2024-04-15T14:48:27Z,True,0.0,True,,,,,,,,,,,,,
youtube#commentThread,fy-Sknelczt9bS6WJw9yvjRrGcQ,UgxHA8_iEUSeBgZTsup4AaABAg,UCeYSnd34IPe57sM8hkjWhrw,cQ9RLDhq6JY,youtube#comment,T7yK109D4mZ3mv1eZQ-zmcL6plY,UgxHA8_iEUSeBgZTsup4AaABAg,UCeYSnd34IPe57sM8hkjWhrw,cQ9RLDhq6JY,Profirió Díaz por fi,Profirió Díaz por fi,@lizbethavendano9341,https://yt3.ggpht.com/ytc/AIdro_lUZp9TH0pl3f7kc8j9U4jJ4YWhEacA_RH52EZnvuo=s48-c-k-c0x00ffffff-no-rj,http://www.youtube.com/@lizbethavendano9341,UCrwBHZiV3ohnj4DD3pGIxvQ,True,none,0.0,2024-04-13T17:01:32Z,2024-04-13T17:01:32Z,True,0.0,True,,,,,,,,,,,,,
youtube#commentThread,OXooVse9x9PNHG9udr1VR8H6yC0,UgwmDUx8tVunEB6fjH14AaABAg,UCeYSnd34IPe57sM8hkjWhrw,cQ9RLDhq6JY,youtube#comment,TgSp8gwgR5nZhm77ZuftXwhBjNU,UgwmDUx8tVunEB6fjH14AaABAg,UCeYSnd34IPe57sM8hkjWhrw,cQ9RLDhq6JY,Aquí Colombia presente ✌🏼🇨🇴. Me encanta la historia y ustedes la hacen muy sabrosa. Gracias y larga vida a Historia para tontos!!,Aquí Colombia presente ✌🏼🇨🇴. Me encanta la historia y ustedes la hacen muy sabrosa. Gracias y larga vida a Historia para tontos!!,@ashckraky,https://yt3.ggpht.com/ytc/AIdro_l6m0F-8T5ULJ8Ehz07yAWSXuZmjn_GtSyNC_ovXA3n9FEh=s48-c-k-c0x00ffffff-no-rj,http://www.youtube.com/@ashckraky,UCnLRSzbANNXdlRfDyDswT6w,True,none,1.0,2024-04-13T16:55:26Z,2024-04-13T16:55:26Z,True,0.0,True,,,,,,,,,,,,,
youtube#commentThread,c_iUDLq8UTzkBqBAfU14bhRJDIw,Ugwt4G1SOIkcXe9YaKV4AaABAg,UCeYSnd34IPe57sM8hkjWhrw,cQ9RLDhq6JY,youtube#comment,gVXRVBn2rRrhjowCrwCT5ykWadE,Ugwt4G1SOIkcXe9YaKV4AaABAg,UCeYSnd34IPe57sM8hkjWhrw,cQ9RLDhq6JY,Alguien sabe dónde puedo encontrar la parte 2 de Napoleón? 😮 Ya lo busque en los dos canales pero sigo sin encontrarlo :(,Alguien sabe dónde puedo encontrar la parte 2 de Napoleón? 😮 Ya lo busque en los dos canales pero sigo sin encontrarlo :(,@frankconstantem2167,https://yt3.ggpht.com/ytc/AIdro_mw2WKXUwxnB4Y6vUjJsKiYEzq8wIIclOkN4KLGQgBY5td2=s48-c-k-c0x00ffffff-no-rj,http://www.youtube.com/@frankconstantem2167,UC9xVCP6tMFgBd2vyJCFpM0A,True,none,0.0,2024-04-12T12:34:21Z,2024-04-12T12:34:21Z,True,1.0,True,"[{'kind': 'youtube#comment', 'etag': 'a7mOGAgSO3DCwrGCaZ2qo99j0C8', 'id': 'Ugwt4G1SOIkcXe9YaKV4AaABAg.A27qlBtgdhtA28Lccpmg3z', 'snippet': {'channelId': 'UCeYSnd34IPe57sM8hkjWhrw', 'videoId': 'cQ9RLDhq6JY', 'textDisplay': 'Spotify', 'textOriginal': 'Spotify', 'parentId': 'Ugwt4G1SOIkcXe9YaKV4AaABAg', 'authorDisplayName': '@oscarag5640', 'authorProfileImageUrl': 'https://yt3.ggpht.com/ytc/AIdro_nCrNy342u7NXjfRrsuNB71manQ02RhRM0KOFc4i59Dw5M=s48-c-k-c0x00ffffff-no-rj', 'authorChannelUrl': 'http://www.youtube.com/@oscarag5640', 'authorChannelId': {'value': 'UCXt2CUFfO_6K1GU4SeBJneg'}, 'canRate': True, 'viewerRating': 'none', 'likeCount': 0, 'publishedAt': '2024-04-12T17:12:48Z', 'updatedAt': '2024-04-12T17:12:48Z'}}]",,,,,,,,,,,,
youtube#commentThread,pVYNQ3F4gZOgSpBM4m-Ry9_gw2c,Ugz2_HcTY8Nyk7CdYjp4AaABAg,UCeYSnd34IPe57sM8hkjWhrw,cQ9RLDhq6JY,youtube#comment,R6scQSe14JI5Oppy1e0vAOHse-M,Ugz2_HcTY8Nyk7CdYjp4AaABAg,UCeYSnd34IPe57sM8hkjWhrw,cQ9RLDhq6JY,"Yo soy la que los oye desde Republica Dominicana, pero soy cubana. Dos por uno lol.","Yo soy la que los oye desde Republica Dominicana, pero soy cubana. Dos por uno lol.",@hirochyit924,https://yt3.ggpht.com/ytc/AIdro_naehzbkf9TlUXqW_x9LBj8WGVskJgEQGnExIdOMzpasfg=s48-c-k-c0x00ffffff-no-rj,http://www.youtube.com/@hirochyit924,UCG5AWxp96Rm4umsyEY4owSg,True,none,0.0,2024-04-11T21:09:32Z,2024-04-11T21:09:32Z,True,0.0,True,,,,,,,,,,,,,
youtube#commentThread,qcAFsIoGj2cZQe4ZAwzkgn2IJww,UgxFcYy1EReSsKhDTIx4AaABAg,UCeYSnd34IPe57sM8hkjWhrw,cQ9RLDhq6JY,youtube#comment,p4Zdli7ZI3LxaSVvfVf7XIclaxw,UgxFcYy1EReSsKhDTIx4AaABAg,UCeYSnd34IPe57sM8hkjWhrw,cQ9RLDhq6JY,"El capítulo 98 no fue micro historia gracias a nosostros mismos, como siempre resolviendoles la chamba","El capítulo 98 no fue micro historia gracias a nosostros mismos, como siempre resolviendoles la chamba",@ignaciogomez2201,https://yt3.ggpht.com/ytc/AIdro_lOwVUPHxqmmgJhsIkZ7uWrlNR5Cg-FjJoX3TsvGgWjewM=s48-c-k-c0x00ffffff-no-rj,http://www.youtube.com/@ignaciogomez2201,UCCBOMg8EQdhMrCqmKyEGP4w,True,none,0.0,2024-04-11T15:26:33Z,2024-04-11T15:26:33Z,True,0.0,True,,,,,,,,,,,,,
youtube#commentThread,YxDKE6R2JdwUJOr2qYPMFCHUfVw,UgyUr5nbHHrU7jLb2Ml4AaABAg,UCeYSnd34IPe57sM8hkjWhrw,cQ9RLDhq6JY,youtube#comment,4ykkoFfdt3z58pfHHKBxtJzcgwE,UgyUr5nbHHrU7jLb2Ml4AaABAg,UCeYSnd34IPe57sM8hkjWhrw,cQ9RLDhq6JY,Hay alguna forma de hacer una donacion al podcast sin ser parte del patreon?. Este es uno de mis podcast favoritos,Hay alguna forma de hacer una donacion al podcast sin ser parte del patreon?. Este es uno de mis podcast favoritos,@carlosrosas9850,https://yt3.ggpht.com/ytc/AIdro_lRmD8D95MI3GoXcAZCwGLeQeBXvc2h3byF5WZCJOZtoaYI=s48-c-k-c0x00ffffff-no-rj,http://www.youtube.com/@carlosrosas9850,UCRaQffWu8tT13BpiJcAhiwQ,True,none,0.0,2024-04-11T00:33:00Z,2024-04-11T00:33:00Z,True,0.0,True,,,,,,,,,,,,,
youtube#commentThread,jVrcvkVi8JPX62VgMAtdp8k4lus,UgxKn24NimRksiYObqx4AaABAg,UCeYSnd34IPe57sM8hkjWhrw,cQ9RLDhq6JY,youtube#comment,vTs0_K9UNhr8LXsFDxY4UViLXHM,UgxKn24NimRksiYObqx4AaABAg,UCeYSnd34IPe57sM8hkjWhrw,cQ9RLDhq6JY,El capítulo 100 será la historia de los emos contra los puks <br><br>Guarden este comentario 🥱,"El capítulo 100 será la historia de los emos contra los puks 

Guarden este comentario 🥱",@gustavoangeles8064,https://yt3.ggpht.com/ytc/AIdro_nSlsVNumrZjS2aZVWmpYCelgiQ4nD_svCydIMUSXH872w=s48-c-k-c0x00ffffff-no-rj,http://www.youtube.com/@gustavoangeles8064,UCUh8jCHZUtrieU1XwqT8bBQ,True,none,1.0,2024-04-11T00:25:59Z,2024-04-11T00:25:59Z,True,0.0,True,,,,,,,,,,,,,
youtube#commentThread,j0L7bNUoPNsUwWAnYeaHfzb4dsM,UgzeUo9UexNKvJfPWJR4AaABAg,UCeYSnd34IPe57sM8hkjWhrw,cQ9RLDhq6JY,youtube#comment,18r4VBu2-CTau_LhCRfcRwz7YzI,UgzeUo9UexNKvJfPWJR4AaABAg,UCeYSnd34IPe57sM8hkjWhrw,cQ9RLDhq6JY,"Gracias por existir ♥️<br><br>Ojalá salga en su siguiente video, han sido mi compañía en mi camino a la universidad, saludos  ✨","Gracias por existir ♥️

Ojalá salga en su siguiente video, han sido mi compañía en mi camino a la universidad, saludos  ✨",@ismacaza1560,https://yt3.ggpht.com/ytc/AIdro_k8l4OSBeGQI2ScL0DVDswU--StlBa2L_yaO6yOJz7h8DUE=s48-c-k-c0x00ffffff-no-rj,http://www.youtube.com/@ismacaza1560,UCNUhaTqC5pmEwVZ1BsYcJEA,True,none,2.0,2024-04-10T23:12:56Z,2024-04-10T23:12:56Z,True,0.0,True,,,,,,,,,,,,,
youtube#commentThread,hbs95lz_kxnaswwQ9VXEjfJYkN4,UgwOVXkvvKOEHIkNhKN4AaABAg,UCeYSnd34IPe57sM8hkjWhrw,cQ9RLDhq6JY,youtube#comment,o8extb25OMFoWN3fZHGpaCFZKIs,UgwOVXkvvKOEHIkNhKN4AaABAg,UCeYSnd34IPe57sM8hkjWhrw,cQ9RLDhq6JY,"Jjajajaja ya habían contado la historia de como comenzo su podcast. Yo la más fan de volverla a escuchar!!! Mega fan de su trabajo, adoro el podcast. Saludos desde Qro!!!!!1 :)","Jjajajaja ya habían contado la historia de como comenzo su podcast. Yo la más fan de volverla a escuchar!!! Mega fan de su trabajo, adoro el podcast. Saludos desde Qro!!!!!1 :)",@PaulaPadillaSanchez,https://yt3.ggpht.com/ytc/AIdro_kumUAO-vDqQ2LEQWnE98-Xq0zXVpU65GxPkF_IPO9-vNgWNB8GdeOI-ErUh6jDMTWOLQ=s48-c-k-c0x00ffffff-no-rj,http://www.youtube.com/@PaulaPadillaSanchez,UCd5t_5rExmrpluj-QVrAxeA,True,none,1.0,2024-04-10T20:46:20Z,2024-04-10T20:46:20Z,True,0.0,True,,,,,,,,,,,,,
youtube#commentThread,gAIYnR4quLstyMaxjfCjRIkPni0,Ugxn2_LVG3xBcAtfqpd4AaABAg,UCeYSnd34IPe57sM8hkjWhrw,cQ9RLDhq6JY,youtube#comment,UnF6JZDtkYiDzVkvSh4wboO8Od4,Ugxn2_LVG3xBcAtfqpd4AaABAg,UCeYSnd34IPe57sM8hkjWhrw,cQ9RLDhq6JY,Me encanta escucharlos y más me encanta verlos ❤,Me encanta escucharlos y más me encanta verlos ❤,@lizbethannetteolivasrios9208,https://yt3.ggpht.com/ytc/AIdro_m0Uf5UJRm1LrHokG1Ewa8-RildPTXX2XwQJU3RYE3ctcs=s48-c-k-c0x00ffffff-no-rj,http://www.youtube.com/@lizbethannetteolivasrios9208,UCiSyVfsmsrkicGkWyjieWqQ,True,none,0.0,2024-04-10T19:33:14Z,2024-04-10T19:33:14Z,True,0.0,True,,,,,,,,,,,,,
youtube#commentThread,kT5fE-yd2bXciGgxe4mLgyIBIPU,Ugxd4V-u03nSngLN5-p4AaABAg,UCeYSnd34IPe57sM8hkjWhrw,cQ9RLDhq6JY,youtube#comment,fjugbBAYqS4bmTW8Wk2P7sAGhxA,Ugxd4V-u03nSngLN5-p4AaABAg,UCeYSnd34IPe57sM8hkjWhrw,cQ9RLDhq6JY,"El capitulo de Mariana Yampolsky está fregón, soy estudiante de ciencias computacionales y maestro de inglés en una secundaria, en una clase dije &quot;chingue a su madre el inglés, vamos a hablar de Mariana Yampolsky&quot;. Fue una clase muy buena gracias a ustedes","El capitulo de Mariana Yampolsky está fregón, soy estudiante de ciencias computacionales y maestro de inglés en una secundaria, en una clase dije ""chingue a su madre el inglés, vamos a hablar de Mariana Yampolsky"". Fue una clase muy buena gracias a ustedes",@isaaciturralde2591,https://yt3.ggpht.com/OMuMWNOmXnhwPvt4Eh9idtSh5DLQ07IsTH6U3qJCJ6jo-tEVlLdT9HCJbC3umh8Yodq-KLJp=s48-c-k-c0x00ffffff-no-rj,http://www.youtube.com/@isaaciturralde2591,UC3yJbcMd7VM50rZSLLDLOQQ,True,none,1.0,2024-04-10T17:50:54Z,2024-04-10T17:50:54Z,True,0.0,True,,,,,,,,,,,,,
youtube#commentThread,POoq-PzOet2390iYdz5iEChz-_A,UgyUO8cTftTdXPNmqN94AaABAg,UCeYSnd34IPe57sM8hkjWhrw,cQ9RLDhq6JY,youtube#comment,c3LQstsT4TIczbW6XwVwHlAv_mU,UgyUO8cTftTdXPNmqN94AaABAg,UCeYSnd34IPe57sM8hkjWhrw,cQ9RLDhq6JY,"Tarapacá es una región en Chile, se entiende que se enreden al decirlo, yo lo hago con los nombres de ciudades mexicanas que son complejos de nombrar","Tarapacá es una región en Chile, se entiende que se enreden al decirlo, yo lo hago con los nombres de ciudades mexicanas que son complejos de nombrar",@CathyIMM,https://yt3.ggpht.com/ytc/AIdro_kedfP1JPszGxcR3sqDq2LYa1XWG87qwF0MlyHMOqiqaao=s48-c-k-c0x00ffffff-no-rj,http://www.youtube.com/@CathyIMM,UCgBlnzVE5sxMGLznH8PkjFw,True,none,3.0,2024-04-10T14:36:30Z,2024-04-10T14:36:30Z,True,0.0,True,,,,,,,,,,,,,
youtube#commentThread,ecPiM26BJWCoy1H6ePGUHe2pTJE,UgxVEyBYUcv9_dXi1_t4AaABAg,UCeYSnd34IPe57sM8hkjWhrw,cQ9RLDhq6JY,youtube#comment,UUgAkBeuctwdC7p0qKqQoSdAoNw,UgxVEyBYUcv9_dXi1_t4AaABAg,UCeYSnd34IPe57sM8hkjWhrw,cQ9RLDhq6JY,historia del box o de la MMA porfa chicos me encanta su contenido 🙌🙌🙌🙌,historia del box o de la MMA porfa chicos me encanta su contenido 🙌🙌🙌🙌,@cesarperez8418,https://yt3.ggpht.com/ytc/AIdro_mCkxSl15tnoMYNH_WJz-XR0vwVtrFMbsiC6UcbGEZWvQw=s48-c-k-c0x00ffffff-no-rj,http://www.youtube.com/@cesarperez8418,UCZVKqjx9lu_DkvqlglODDUg,True,none,0.0,2024-04-10T04:57:59Z,2024-04-10T04:57:59Z,True,0.0,True,,,,,,,,,,,,,
youtube#commentThread,Qz7NvgxL5TjRHMuII1TZhwA0iWE,UgwRRAJjPUH3jLtn7xp4AaABAg,UCeYSnd34IPe57sM8hkjWhrw,cQ9RLDhq6JY,youtube#comment,pxBp741cM5BJpiUQQeQfrm6zeCc,UgwRRAJjPUH3jLtn7xp4AaABAg,UCeYSnd34IPe57sM8hkjWhrw,cQ9RLDhq6JY,"Empecé a oír el podcast desde el inicio y no puedo creer que ya llevo casi tres años oyéndo sus estupideces jajajaja, ya fuera de broma, me encanta el podcast y me han amenizado muchas horas que los he oído, me parece un podcast con la mezcla justa entre humor e información, sigan así, les deseo lo mejor para el podcast y para ustedes","Empecé a oír el podcast desde el inicio y no puedo creer que ya llevo casi tres años oyéndo sus estupideces jajajaja, ya fuera de broma, me encanta el podcast y me han amenizado muchas horas que los he oído, me parece un podcast con la mezcla justa entre humor e información, sigan así, les deseo lo mejor para el podcast y para ustedes",@SanchezHernandezJuanPablo,https://yt3.ggpht.com/ytc/AIdro_lNF7dSiEL_LyfgA0aj5RVA0wXQLLSvFX8BpPBI5HIdtb8=s48-c-k-c0x00ffffff-no-rj,http://www.youtube.com/@SanchezHernandezJuanPablo,UCEPl47sM3rl6j7D6jTKIpkg,True,none,8.0,2024-04-10T04:41:26Z,2024-04-10T04:41:26Z,True,0.0,True,,,,,,,,,,,,,
youtube#commentThread,a2BEwyNOk9WC_noPpj9QmK7KZmU,Ugy7lGMBtn2VdLIYrU14AaABAg,UCeYSnd34IPe57sM8hkjWhrw,cQ9RLDhq6JY,youtube#comment,er99SL032C8-sNJsXibJt9P-zCY,Ugy7lGMBtn2VdLIYrU14AaABAg,UCeYSnd34IPe57sM8hkjWhrw,cQ9RLDhq6JY,Aquí esperando la 3ra parte del imperio japones. <br><br>Saludos desde mi casa.,"Aquí esperando la 3ra parte del imperio japones. 

Saludos desde mi casa.",@Lotus4kHd,https://yt3.ggpht.com/ytc/AIdro_k4aCF8bLyrhlFnafsDgsyFgC0Uc6yhFOEHK1no9EcuKw=s48-c-k-c0x00ffffff-no-rj,http://www.youtube.com/@Lotus4kHd,UCtbYI7EAx1d9Mw8eJpEAy6g,True,none,4.0,2024-04-10T03:13:38Z,2024-04-10T03:13:38Z,True,0.0,True,,,,,,,,,,,,,
youtube#commentThread,BvmpRA5ca1iz1O76Xr8RBzB2cYQ,UgwqU9XKaUKE-CxWiWJ4AaABAg,UCeYSnd34IPe57sM8hkjWhrw,cQ9RLDhq6JY,youtube#comment,Ec3PKfRSokmpZIMF00gzgB2S4Fo,UgwqU9XKaUKE-CxWiWJ4AaABAg,UCeYSnd34IPe57sM8hkjWhrw,cQ9RLDhq6JY,"Si los seguidores de Historia para Tontos nos organizamos, si andamos conquistando Bolivia.","Si los seguidores de Historia para Tontos nos organizamos, si andamos conquistando Bolivia.",@abrahamsanchez9943,https://yt3.ggpht.com/ytc/AIdro_nHwh8vTulBZj4BeIjtFMkE0c9wrIZoinbmO0tT8E6lriih=s48-c-k-c0x00ffffff-no-rj,http://www.youtube.com/@abrahamsanchez9943,UC4K3bVuU9oYTSmiWhjr6WFA,True,none,19.0,2024-04-10T02:27:10Z,2024-04-10T02:27:10Z,True,1.0,True,"[{'kind': 'youtube#comment', 'etag': 'm5VqhYbtIPyhwrxzQIogNS5uYOY', 'id': 'UgwqU9XKaUKE-CxWiWJ4AaABAg.A21bgH6IvK_A239CeCK6uD', 'snippet': {'channelId': 'UCeYSnd34IPe57sM8hkjWhrw', 'videoId': 'cQ9RLDhq6JY', 'textDisplay': 'Wuuuu', 'textOriginal': 'Wuuuu', 'parentId': 'UgwqU9XKaUKE-CxWiWJ4AaABAg', 'authorDisplayName': '@historiaparatontospodcast5148', 'authorProfileImageUrl': 'https://yt3.ggpht.com/Tw2Vt53uC3fCaRNDO884CZkc1inVcHFbKYcYg9ug9_tFVfi2y6Yk23-Z7KpoRup63Kf4Dwrd=s48-c-k-c0x00ffffff-no-rj', 'authorChannelUrl': 'http://www.youtube.com/@historiaparatontospodcast5148', 'authorChannelId': {'value': 'UCeYSnd34IPe57sM8hkjWhrw'}, 'canRate': True, 'viewerRating': 'none', 'likeCount': 1, 'publishedAt': '2024-04-10T16:48:04Z', 'updatedAt': '2024-04-10T16:48:04Z'}}]",,,,,,,,,,,,
youtube#commentThread,3zSMh6K-HOzym35wTdxRgD4f1Hk,UgwOzXSh_kmIh0N3lsV4AaABAg,UCeYSnd34IPe57sM8hkjWhrw,cQ9RLDhq6JY,youtube#comment,U1ZvFnt9RsAwRVVXsBEFfRZ9AxQ,UgwOzXSh_kmIh0N3lsV4AaABAg,UCeYSnd34IPe57sM8hkjWhrw,cQ9RLDhq6JY,2do Comentario,2do Comentario,@hergestron,https://yt3.ggpht.com/ytc/AIdro_kyYvLgTdHqZ9EW-hmHeGMRqviHnb2wDZZAGdKG9JeDCd6x=s48-c-k-c0x00ffffff-no-rj,http://www.youtube.com/@hergestron,UCoiT9YnYhmZJT4dh-Uu89Ww,True,none,2.0,2024-04-10T01:14:57Z,2024-04-10T01:14:57Z,True,0.0,True,,,,,,,,,,,,,
youtube#commentThread,QW9tPBMkbfWZzvLaqLvUqpHlAi0,Ugyuq3YLMXxknytwCpZ4AaABAg,UCeYSnd34IPe57sM8hkjWhrw,cQ9RLDhq6JY,youtube#comment,jGKPCj1js1EFt5B44Pmzp78jtU4,Ugyuq3YLMXxknytwCpZ4AaABAg,UCeYSnd34IPe57sM8hkjWhrw,cQ9RLDhq6JY,"ME ENCANTA SU PODCAST !! Soy fan desde el inicio !! Que increíbles son !! Me divierto , aprendo y sobretodo me encanta que me acompañen cuando ceno para poder dormir con una sonrisa , saludos desde Francia y sigan haciendo a México chingon 💪🏾✨💙🌈","ME ENCANTA SU PODCAST !! Soy fan desde el inicio !! Que increíbles son !! Me divierto , aprendo y sobretodo me encanta que me acompañen cuando ceno para poder dormir con una sonrisa , saludos desde Francia y sigan haciendo a México chingon 💪🏾✨💙🌈",@Niche_08,https://yt3.ggpht.com/7D4RFwqGzD2BSNuCAK_vZTqSVeB524ikXmuQ7Sk2cdbjlO_9fPiVulPtZd38Wmez0dRaTaVt=s48-c-k-c0x00ffffff-no-rj,http://www.youtube.com/@Niche_08,UCumqaABtp3PZ6FclSAUv7Aw,True,none,2.0,2024-04-10T01:12:17Z,2024-04-10T01:12:17Z,True,0.0,True,,,,,,,,,,,,,
youtube#comment,a7mOGAgSO3DCwrGCaZ2qo99j0C8,Ugwt4G1SOIkcXe9YaKV4AaABAg.A27qlBtgdhtA28Lccpmg3z,UCeYSnd34IPe57sM8hkjWhrw,cQ9RLDhq6JY,,,,,,,,,,,,,,,,,,,,,Spotify,Spotify,Ugwt4G1SOIkcXe9YaKV4AaABAg,@oscarag5640,https://yt3.ggpht.com/ytc/AIdro_nCrNy342u7NXjfRrsuNB71manQ02RhRM0KOFc4i59Dw5M=s48-c-k-c0x00ffffff-no-rj,http://www.youtube.com/@oscarag5640,UCXt2CUFfO_6K1GU4SeBJneg,True,none,0.0,2024-04-12T17:12:48Z,2024-04-12T17:12:48Z
youtube#comment,m5VqhYbtIPyhwrxzQIogNS5uYOY,UgwqU9XKaUKE-CxWiWJ4AaABAg.A21bgH6IvK_A239CeCK6uD,UCeYSnd34IPe57sM8hkjWhrw,cQ9RLDhq6JY,,,,,,,,,,,,,,,,,,,,,Wuuuu,Wuuuu,UgwqU9XKaUKE-CxWiWJ4AaABAg,@historiaparatontospodcast5148,https://yt3.ggpht.com/Tw2Vt53uC3fCaRNDO884CZkc1inVcHFbKYcYg9ug9_tFVfi2y6Yk23-Z7KpoRup63Kf4Dwrd=s48-c-k-c0x00ffffff-no-rj,http://www.youtube.com/@historiaparatontospodcast5148,UCeYSnd34IPe57sM8hkjWhrw,True,none,1.0,2024-04-10T16:48:04Z,2024-04-10T16:48:04Z
youtube#commentThread,8d1x-aK4Qn3_2hIMxe8nlMLn-CM,Ugw7erABCbcc7tDxNQl4AaABAg,UCeYSnd34IPe57sM8hkjWhrw,0IDFrBktWIA,youtube#comment,-90oKee2QfFkB8lSbsUFlbHv_4E,Ugw7erABCbcc7tDxNQl4AaABAg,UCeYSnd34IPe57sM8hkjWhrw,0IDFrBktWIA,HASTA ACÁ HUELE A GARNACHA,HASTA ACÁ HUELE A GARNACHA,@gerardomunoz1813,https://yt3.ggpht.com/z3dA0sobLR9j_Qm7qJKhHmtwdom7LA8x6TTAVmVU8hizlWmYGohnU8nRVJdMizttdXvnnu0q1g=s48-c-k-c0x00ffffff-no-rj,http://www.youtube.com/@gerardomunoz1813,UCzvKCtQj4Yw8il6HuQj2ciQ,True,none,0.0,2024-09-29T17:15:08Z,2024-09-29T17:15:08Z,True,0.0,True,,,,,,,,,,,,,
youtube#commentThread,OIrEUnDv1sAjwK8xhFVwGiX8aPA,UgxoEIKeWw_KpF5b-0V4AaABAg,UCeYSnd34IPe57sM8hkjWhrw,0IDFrBktWIA,youtube#comment,hMkAGsHQIRP_XFGv8K9U9T0YGo0,UgxoEIKeWw_KpF5b-0V4AaABAg,UCeYSnd34IPe57sM8hkjWhrw,0IDFrBktWIA,"Me encanta que usen de referencia Age of Empire o Age of Mythology porque si jugaba esos juegos, me queda más claro todo. Antes solo escuchaba los podcast pero ahora ya también los veo aquí, y si les confieso que deje volar mi imaginación, y me los imagina de trajecito, sin barba, así super pulidos, y en realidad se ven más relax, LOL, eso les pasa por tener vocabulario amplio y pues si usan palabras coloquiales y léxico relajado pero igual mi mente los imaginaba así muy peinados, LOL. Pero la realidad esta más chida que la ficción, no se preocupen, además nada quita que lo más sexy que tienen son sus cerebros.","Me encanta que usen de referencia Age of Empire o Age of Mythology porque si jugaba esos juegos, me queda más claro todo. Antes solo escuchaba los podcast pero ahora ya también los veo aquí, y si les confieso que deje volar mi imaginación, y me los imagina de trajecito, sin barba, así super pulidos, y en realidad se ven más relax, LOL, eso les pasa por tener vocabulario amplio y pues si usan palabras coloquiales y léxico relajado pero igual mi mente los imaginaba así muy peinados, LOL. Pero la realidad esta más chida que la ficción, no se preocupen, además nada quita que lo más sexy que tienen son sus cerebros.",@fakatzinsky,https://yt3.ggpht.com/ytc/AIdro_kv9bK23Qw-f7YdyaJpN2X45jPEEp546uYCf89lwS3hIaQb=s48-c-k-c0x00ffffff-no-rj,http://www.youtube.com/@fakatzinsky,UCC88MGTy6yBVxmpyXeTrtWA,True,none,0.0,2024-09-24T00:41:16Z,2024-09-24T00:41:16Z,True,0.0,True,,,,,,,,,,,,,
