youtube#commentThread,ktoA0p_GlR0bPEVZ29PK0V5KFL8,UgxFI5ajvm28hLSlLFp4AaABAg,UCeYSnd34IPe57sM8hkjWhrw,ShW6FY-vbmo,youtube#comment,6n6wk9YAGvnefc_qm3YmItfgLZc,UgxFI5ajvm28hLSlLFp4AaABAg,UCeYSnd34IPe57sM8hkjWhrw,ShW6FY-vbmo,"Saludos, llevo ya mas de 1 año escuchandolos, los escucho para tareas, proyectos y me han acompañado en todo lo que llevo de universidad, normalmente los escucho en apple podcasts pero ahora vuelvo a ver este episodio en youtube para apoyar.<br>(Se ve que iker es muy inquieto TDAchoso)","Saludos, llevo ya mas de 1 año escuchandolos, los escucho para tareas, proyectos y me han acompañado en todo lo que llevo de universidad, normalmente los escucho en apple podcasts pero ahora vuelvo a ver este episodio en youtube para apoyar.
(Se ve que iker es muy inquieto TDAchoso)",@davidmartinezrangel3670,https://yt3.ggpht.com/SGhUXjBMze_xxkXX-7fCbMsnkwsnPy0BW5jU8pWlYexOgr1f5xSfY6tKVI8s2JtpAqBiwvqR9w=s48-c-k-c0x00ffffff-no-rj,http://www.youtube.com/@davidmartinezrangel3670,UCDMkqhs18XVXf8btfunG_mA,True,none,0.0,2024-06-06T23:34:41Z,2024-06-06T23:36:36Z,True,0.0,True,,,,,,,,,,,,,
youtube#commentThread,LrSclf9Fg56wWbQ0joU5lTtWyvc,UgxpITVt9nfHbcjomqh4AaABAg,UCeYSnd34IPe57sM8hkjWhrw,ShW6FY-vbmo,youtube#comment,y_W1TUuHvZmEXmgPgcQfXep3u2E,UgxpITVt9nfHbcjomqh4AaABAg,UCeYSnd34IPe57sM8hkjWhrw,ShW6FY-vbmo,"Por fin un buen podcast de historia!, mucho mejor q esa basura de bully egolatramagnets","Por fin un buen podcast de historia!, mucho mejor q esa basura de bully egolatramagnets",@ale-cd1jv,https://yt3.ggpht.com/ytc/AIdro_lImTm6IlMTJaYhHDnM7oicZZ166Z81MNcmaOUeq6VI87qejGFPJ63x3dMS0eFRNb-3qw=s48-c-k-c0x00ffffff-no-rj,http://www.youtube.com/@ale-cd1jv,UCvvOXwd5iIgEHZobd9i5mwQ,True,none,1.0,2024-06-06T16:38:27Z,2024-06-06T16:38:27Z,True,0.0,True,,,,,,,,,,,,,
youtube#commentThread,vqjqJZQLLEKxc29MbUXKfpOfDsQ,UgzCoBteENmYasci8DF4AaABAg,UCeYSnd34IPe57sM8hkjWhrw,ShW6FY-vbmo,youtube#comment,vH_y053rN0IRBgOP52z99jePcjw,UgzCoBteENmYasci8DF4AaABAg,UCeYSnd34IPe57sM8hkjWhrw,ShW6FY-vbmo,"Realmente seria una muy buena colaboración con Juan Miguel Zunzunegui, también creo que seria buena idea que revisaran el podcast de Chismes de Historia y Ciencia (<a href=""https://www.youtube.com/@chismesdehistoriayciencia)"">https://www.youtube.com/@chismesdehistoriayciencia)</a>","Realmente seria una muy buena colaboración con Juan Miguel Zunzunegui, también creo que seria buena idea que revisaran el podcast de Chismes de Historia y Ciencia (https://www.youtube.com/@chismesdehistoriayciencia)",@Kitsenna,https://yt3.ggpht.com/ytc/AIdro_naeHwORfn3tVRDj8H71nla4inXbGy4p3sh6WqRUL-JjQ=s48-c-k-c0x00ffffff-no-rj,http://www.youtube.com/@Kitsenna,UCpE_hqREqyJQr5t7OCdPUMQ,True,none,0.0,2024-06-06T16:23:33Z,2024-06-06T16:23:33Z,True,0.0,True,,,,,,,,,,,,,
youtube#commentThread,1OV_QgzwmpNXnmWv1NOwLimv5z4,Ugz5ZVUR8TrYO5nj5Oh4AaABAg,UCeYSnd34IPe57sM8hkjWhrw,ShW6FY-vbmo,youtube#comment,kvJAHWcDLLp9wEBt1T16zGs-3Mg,Ugz5ZVUR8TrYO5nj5Oh4AaABAg,UCeYSnd34IPe57sM8hkjWhrw,ShW6FY-vbmo,"Fun fact: Julio César es el que mandó a Virgilio a escribir la Eneida, Por qué al parecer era muy fan de la Odisea, y quería hacerse ver a sí mismo como un semidiós también (lo que hacían los reyes que decían que eran elegidos de Dios y así). Por eso la Eneida es casi una copia de la Odisea","Fun fact: Julio César es el que mandó a Virgilio a escribir la Eneida, Por qué al parecer era muy fan de la Odisea, y quería hacerse ver a sí mismo como un semidiós también (lo que hacían los reyes que decían que eran elegidos de Dios y así). Por eso la Eneida es casi una copia de la Odisea",@dianaguzman9589,https://yt3.ggpht.com/ytc/AIdro_nH_Aauf3VlId3MxZ8yLlOpw-OuGQy_OftSin-yj3wh7w=s48-c-k-c0x00ffffff-no-rj,http://www.youtube.com/@dianaguzman9589,UC24NxR6biydVSd3RCVmCeKQ,True,none,0.0,2024-06-06T15:10:57Z,2024-06-06T15:10:57Z,True,0.0,True,,,,,,,,,,,,,
youtube#commentThread,LXCrBRkdzahSUe23HigEgJm0KLU,UgybjyJGbscFV3T4FV94AaABAg,UCeYSnd34IPe57sM8hkjWhrw,ShW6FY-vbmo,youtube#comment,g7MeonxCFSTaS3QNaGb3T6EKVsY,UgybjyJGbscFV3T4FV94AaABAg,UCeYSnd34IPe57sM8hkjWhrw,ShW6FY-vbmo,"Muchachos hagan un podcast con Diego Ruzzarin, el ni los topa jeje le he preguntado en sus transmisiones en twitch jeje, pero seguramente se llevarían a toda madre","Muchachos hagan un podcast con Diego Ruzzarin, el ni los topa jeje le he preguntado en sus transmisiones en twitch jeje, pero seguramente se llevarían a toda madre",@musicodesconocido,https://yt3.ggpht.com/6d9wkRzKT_0h46LyR8D8_i8aCMPrqzYxBdsG2WlICSQZYb0xyqrQobjTpXiS0ylyyyESuNyQhcs=s48-c-k-c0x00ffffff-no-rj,http://www.youtube.com/@musicodesconocido,UCRV6qG5h6C4PmMn1qtE-Z1Q,True,none,0.0,2024-06-06T03:50:18Z,2024-06-06T03:50:18Z,True,0.0,True,,,,,,,,,,,,,
youtube#commentThread,z1uEBRB4NwI3k1miYbQnrbBJ534,UgzLMS0FLErSATT9wdJ4AaABAg,UCeYSnd34IPe57sM8hkjWhrw,ShW6FY-vbmo,youtube#comment,bBjccFsf3PilMSnLfjLw7uKL2WU,UgzLMS0FLErSATT9wdJ4AaABAg,UCeYSnd34IPe57sM8hkjWhrw,ShW6FY-vbmo,"Felicidades por su contenido!, me acompañan en mis horas de trabajo, solo un comentario, el Coliseo aún no se construía en la época de César, se inauguró hasta el año 80 D.C.","Felicidades por su contenido!, me acompañan en mis horas de trabajo, solo un comentario, el Coliseo aún no se construía en la época de César, se inauguró hasta el año 80 D.C.",@violeta6979,https://yt3.ggpht.com/ytc/AIdro_nFPV4j63lJmuwFxRS1J46nwYqmh4Xa3qWpNgCImx6hH24=s48-c-k-c0x00ffffff-no-rj,http://www.youtube.com/@violeta6979,UCzTVaii_Mh1leVYfBx0aq7A,True,none,0.0,2024-06-05T21:52:06Z,2024-06-05T21:52:06Z,True,0.0,True,,,,,,,,,,,,,
youtube#commentThread,EGAgWil5a8sWC-HU1mf1yw5P9tI,UgwrkXVG0DrwjdtGGPJ4AaABAg,UCeYSnd34IPe57sM8hkjWhrw,ShW6FY-vbmo,youtube#comment,KStmDS2ZRVyO46UdukJjLRqUvGc,UgwrkXVG0DrwjdtGGPJ4AaABAg,UCeYSnd34IPe57sM8hkjWhrw,ShW6FY-vbmo,Su podcast me da vida 🌈,Su podcast me da vida 🌈,@angelicadanielalara7675,https://yt3.ggpht.com/Sy-NmkTVJkl_ZSi6Kzco-bSpog2JjGvubCoDCIYrwpvniCNDMpvYhdWRDJ2P6wLFAXqoM2Rj4g=s48-c-k-c0x00ffffff-no-rj,http://www.youtube.com/@angelicadanielalara7675,UCw5mo9u4Y7R4V_gV_w5SBRw,True,none,1.0,2024-06-05T21:42:12Z,2024-06-05T21:42:12Z,True,0.0,True,,,,,,,,,,,,,
youtube#commentThread,2F9OwDKxx9WZD2pbdQiYNElx1vE,UgzueqmTHOD5gKsspxZ4AaABAg,UCeYSnd34IPe57sM8hkjWhrw,ShW6FY-vbmo,youtube#comment,QVtWTessBbaYpMz9_ZZNPbj9kzo,UgzueqmTHOD5gKsspxZ4AaABAg,UCeYSnd34IPe57sM8hkjWhrw,ShW6FY-vbmo,Los amo ❤❤❤❤,Los amo ❤❤❤❤,@CRISTY5985,https://yt3.ggpht.com/ytc/AIdro_m5bonU3QdsgQ6C6YBuaLQ-R4dzzqe7l3gsPfvcY9Y=s48-c-k-c0x00ffffff-no-rj,http://www.youtube.com/@CRISTY5985,UCn1JN0UHLy3XBZcR6qogYHg,True,none,1.0,2024-06-05T18:26:48Z,2024-06-05T18:26:48Z,True,0.0,True,,,,,,,,,,,,,
youtube#commentThread,HSkiTQyhzapLDYict-zFQ7qJLwI,UgxJoKUQnWkVcqTiuM54AaABAg,UCeYSnd34IPe57sM8hkjWhrw,ShW6FY-vbmo,youtube#comment,cbTBCplc4kU_N3k8TspqbeARdh8,UgxJoKUQnWkVcqTiuM54AaABAg,UCeYSnd34IPe57sM8hkjWhrw,ShW6FY-vbmo,"Como siempre disfrute muchisimo! Por favor saquen parte 2 pronto 🙌<br>También un tema que estaría padrísimo sería la historia de la ciencia (o de los científicos más reconocidos), tomandoles la palabra de que podemos sugerir personas, inviten a su servidora ingeniera y amante de la historia y ciencia! 🙌 <br>(Chicle y pega 😜)","Como siempre disfrute muchisimo! Por favor saquen parte 2 pronto 🙌
También un tema que estaría padrísimo sería la historia de la ciencia (o de los científicos más reconocidos), tomandoles la palabra de que podemos sugerir personas, inviten a su servidora ingeniera y amante de la historia y ciencia! 🙌 
(Chicle y pega 😜)",@PamAuChocolat,https://yt3.ggpht.com/L7zngfeNqS82nOxQe6scDScACPDe17y7_Y1A7MFP-TXqz1CBhSQYjl2klLrkyMLYsImZMg31=s48-c-k-c0x00ffffff-no-rj,http://www.youtube.com/@PamAuChocolat,UCamOzisVZ4DUiTNQzTCMtxQ,True,none,2.0,2024-06-05T16:55:21Z,2024-06-05T16:59:06Z,True,0.0,True,,,,,,,,,,,,,
youtube#commentThread,Aes2o7LguzygZxHIWnYVe6M38dk,UgzTM25ABVSUwhb0YN54AaABAg,UCeYSnd34IPe57sM8hkjWhrw,ShW6FY-vbmo,youtube#comment,GxFmiFWkdsgLYvn1qSzcMopU3jk,UgzTM25ABVSUwhb0YN54AaABAg,UCeYSnd34IPe57sM8hkjWhrw,ShW6FY-vbmo,Imperio japonés pt4 plis,Imperio japonés pt4 plis,@ivanmelchor2889,https://yt3.ggpht.com/ytc/AIdro_nWKTGSonhM-T8UMp8LtgMeOca3WZgD7MbleE2lM08=s48-c-k-c0x00ffffff-no-rj,http://www.youtube.com/@ivanmelchor2889,UC6qmZLxUbR3ZIKT9Z2e2PCw,True,none,0.0,2024-06-05T16:47:48Z,2024-06-05T16:47:48Z,True,0.0,True,,,,,,,,,,,,,
youtube#commentThread,GXjQhsTo0gejwDBUbcZK3zmPqsc,Ugw8yiLi54o-Zgvx9zd4AaABAg,UCeYSnd34IPe57sM8hkjWhrw,ShW6FY-vbmo,youtube#comment,nYVXOVo8ntyY3nkj15SOThgmjoU,Ugw8yiLi54o-Zgvx9zd4AaABAg,UCeYSnd34IPe57sM8hkjWhrw,ShW6FY-vbmo,Wey! Es sacerdocio. Sacerdocio! <br>Es pan y circo!!! Cual pan y vino!!?? Ese es de Marcelino.,"Wey! Es sacerdocio. Sacerdocio! 
Es pan y circo!!! Cual pan y vino!!?? Ese es de Marcelino.",@tatzarialejandrafrancotiol417,https://yt3.ggpht.com/ytc/AIdro_lbe2ZFpk2Pn177J78hPTbTJ5MY9PG8xD-XOAsH-PI=s48-c-k-c0x00ffffff-no-rj,http://www.youtube.com/@tatzarialejandrafrancotiol417,UC_QDIdm41fT--KztBRBVT0Q,True,none,1.0,2024-06-05T15:47:32Z,2024-06-05T15:47:32Z,True,0.0,True,,,,,,,,,,,,,
youtube#commentThread,FqXksPDE3vFdSpNTj0MnoJScLPw,Ugw_mfwCwBkxctLGi7V4AaABAg,UCeYSnd34IPe57sM8hkjWhrw,ShW6FY-vbmo,youtube#comment,VBY6Yu08RcUxrqaMdy7ySwLnGlk,Ugw_mfwCwBkxctLGi7V4AaABAg,UCeYSnd34IPe57sM8hkjWhrw,ShW6FY-vbmo,"Banda el todo tibio es México, por un lado medio condena la invasión, medio apoya a Palestina, pero no hace nada cuando le matan al rehén y felicita a Israel :/.... Por cierto, y el podcast? :/","Banda el todo tibio es México, por un lado medio condena la invasión, medio apoya a Palestina, pero no hace nada cuando le matan al rehén y felicita a Israel :/.... Por cierto, y el podcast? :/",@draimary,https://yt3.ggpht.com/ytc/AIdro_kpExIYauHueHd5allIIsycN6RA6tHezm3uDtEZ3F1GWA=s48-c-k-c0x00ffffff-no-rj,http://www.youtube.com/@draimary,UCw6Ih_5j5-gnD42StwLIcbg,True,none,1.0,2024-06-05T13:07:01Z,2024-06-05T13:07:01Z,True,0.0,True,,,,,,,,,,,,,
youtube#commentThread,PjuEPPicluDn72DEtzj-orrmGmY,UgxX99IyK2MC70HE_MN4AaABAg,UCeYSnd34IPe57sM8hkjWhrw,ShW6FY-vbmo,youtube#comment,1g7rKbf4i2nC9UgR3obTvG9TF9U,UgxX99IyK2MC70HE_MN4AaABAg,UCeYSnd34IPe57sM8hkjWhrw,ShW6FY-vbmo,Sacerdocio,Sacerdocio,@LuisGarcia-wm9fl,https://yt3.ggpht.com/ytc/AIdro_n5OvKIk8mtwD6UTGqvN2f5pMrAizyEMCSYoYXLOGyk2ItA=s48-c-k-c0x00ffffff-no-rj,http://www.youtube.com/@LuisGarcia-wm9fl,UCXgtvnpR8NRzdYazpiBlGHg,True,none,0.0,2024-06-05T05:00:52Z,2024-06-05T05:00:52Z,True,0.0,True,,,,,,,,,,,,,
youtube#commentThread,S-1x_1ztcSPbdpmnGvTyLCOdvjg,UgzlZEu9I0YXeeL2q4p4AaABAg,UCeYSnd34IPe57sM8hkjWhrw,ShW6FY-vbmo,youtube#comment,EuXKtD2eJqvMscI4KAN_InTO4BY,UgzlZEu9I0YXeeL2q4p4AaABAg,UCeYSnd34IPe57sM8hkjWhrw,ShW6FY-vbmo,"@historiaparatontos los descubrí hace poco y me encanta el contenido , los pongo en la noche para hacer ejercicio y no aburrirme😃","@historiaparatontos los descubrí hace poco y me encanta el contenido , los pongo en la noche para hacer ejercicio y no aburrirme😃",@KarenRamirezGonzalez-n7f,https://yt3.ggpht.com/z03dz_dRp7ZidnG4X5cttioQ-W2-JjkFDKt2UbRPl61Hi2zkEjtswb6jKtWnI7HvH5CmuMNxXw=s48-c-k-c0x00ffffff-no-rj,http://www.youtube.com/@KarenRamirezGonzalez-n7f,UCYR51dEYqOpAI1FmStLATXQ,True,none,1.0,2024-06-05T03:13:22Z,2024-06-05T03:13:22Z,True,0.0,True,,,,,,,,,,,,,
youtube#commentThread,I04ZEljRMVwp9nbefKg8r6D_Pss,Ugwh0W_hviiB3Znrqzd4AaABAg,UCeYSnd34IPe57sM8hkjWhrw,ShW6FY-vbmo,youtube#comment,dMPEmbAhXQU_NCwvGZvCQi4zhQM,Ugwh0W_hviiB3Znrqzd4AaABAg,UCeYSnd34IPe57sM8hkjWhrw,ShW6FY-vbmo,“Vamos a felicitar a Palestina por algo” 🎉,“Vamos a felicitar a Palestina por algo” 🎉,@israelluis6938,https://yt3.ggpht.com/ytc/AIdro_kXyY6zOX2GDMb8iwPGS_i8yG-jUKuxu0AplEHoGujomqA=s48-c-k-c0x00ffffff-no-rj,http://www.youtube.com/@israelluis6938,UC5eORwY3_14nPLpQRnNdXlg,True,none,0.0,2024-06-05T03:04:28Z,2024-06-05T03:04:28Z,True,0.0,True,,,,,,,,,,,,,
youtube#commentThread,pAZCZ33kPFJ9uw65-wZZcbiovO8,UgyeesDxtb-P3-tSFtx4AaABAg,UCeYSnd34IPe57sM8hkjWhrw,ShW6FY-vbmo,youtube#comment,7uI_q_vIRxdsF701FSFRqwq4BuQ,UgyeesDxtb-P3-tSFtx4AaABAg,UCeYSnd34IPe57sM8hkjWhrw,ShW6FY-vbmo,"Se dice guens yulia, guens yulia (léase cómo el meme de: se dice atómico, de los Simpsons)","Se dice guens yulia, guens yulia (léase cómo el meme de: se dice atómico, de los Simpsons)",@taur0210,https://yt3.ggpht.com/ytc/AIdro_ln8naBuwZ6PzJDXS8vkvRq1TvtW_EfGlmteKi4hpU0GQ=s48-c-k-c0x00ffffff-no-rj,http://www.youtube.com/@taur0210,UCng2spa7gcLuUDL7UpOTjWw,True,none,0.0,2024-06-05T02:35:41Z,2024-06-05T02:41:55Z,True,0.0,True,,,,,,,,,,,,,
youtube#commentThread,0OFuUIa7BU-sJoybuEkOOl9vN-4,UgyN9pJbPPMAKrsirHR4AaABAg,UCeYSnd34IPe57sM8hkjWhrw,ShW6FY-vbmo,youtube#comment,4qPVuVNyLtuly7fTLWdPWRrlYsE,UgyN9pJbPPMAKrsirHR4AaABAg,UCeYSnd34IPe57sM8hkjWhrw,ShW6FY-vbmo,Teotihuacan parte 2 para cuando?,Teotihuacan parte 2 para cuando?,@anamariamartinezgamez7035,https://yt3.ggpht.com/ytc/AIdro_m5iaXugmbufx1L-3mzepB32iIt-G53N522nvmgnlyw6AMM=s48-c-k-c0x00ffffff-no-rj,http://www.youtube.com/@anamariamartinezgamez7035,UCLVpTOywS0BONlB3sEN-gLw,True,none,0.0,2024-06-05T01:11:49Z,2024-06-05T01:11:49Z,True,0.0,True,,,,,,,,,,,,,
youtube#commentThread,FSEeTDpaiHH9-MekKbdoAheLHtI,UgwUHMvNLoB0ANj03fd4AaABAg,UCeYSnd34IPe57sM8hkjWhrw,ShW6FY-vbmo,youtube#comment,ZpoPwaN1f923bSpQUnS65byfGpQ,UgwUHMvNLoB0ANj03fd4AaABAg,UCeYSnd34IPe57sM8hkjWhrw,ShW6FY-vbmo,Saludos desde Colombia por aquí los esperamos,Saludos desde Colombia por aquí los esperamos,@luisfelipelopezsantana895,https://yt3.ggpht.com/ytc/AIdro_mk-4W-blumZCJcV_EoRwXN--PZig9IYknyKBzfIgw=s48-c-k-c0x00ffffff-no-rj,http://www.youtube.com/@luisfelipelopezsantana895,UCakFCek29JCXEi35dCiCn1A,True,none,1.0,2024-06-05T00:32:52Z,2024-06-05T00:32:52Z,True,0.0,True,,,,,,,,,,,,,
youtube#commentThread,mkDA1F8gNjw4AJBiTYcTHLEUk7U,Ugyh0okD2BDVnPyprw94AaABAg,UCeYSnd34IPe57sM8hkjWhrw,ShW6FY-vbmo,youtube#comment,fWT1EMDbkHUVjA1jB4UC9BKix-E,Ugyh0okD2BDVnPyprw94AaABAg,UCeYSnd34IPe57sM8hkjWhrw,ShW6FY-vbmo,Los mejores de lo.mejor que no existe LOS MEJORES,Los mejores de lo.mejor que no existe LOS MEJORES,@luisfelipelopezsantana895,https://yt3.ggpht.com/ytc/AIdro_mk-4W-blumZCJcV_EoRwXN--PZig9IYknyKBzfIgw=s48-c-k-c0x00ffffff-no-rj,http://www.youtube.com/@luisfelipelopezsantana895,UCakFCek29JCXEi35dCiCn1A,True,none,1.0,2024-06-05T00:32:24Z,2024-06-05T00:32:24Z,True,0.0,True,,,,,,,,,,,,,
youtube#commentThread,KqOvhGnmt1xcAt4h1TrnUzj_KMY,Ugx3YYz-mo7WbBpxiax4AaABAg,UCeYSnd34IPe57sM8hkjWhrw,ShW6FY-vbmo,youtube#comment,xG-VudLMRlkYtGAQzsTtH-4OMSM,Ugx3YYz-mo7WbBpxiax4AaABAg,UCeYSnd34IPe57sM8hkjWhrw,ShW6FY-vbmo,Creo que es sacerdocio señoritos! 😊,Creo que es sacerdocio señoritos! 😊,@natalieespinoza9385,https://yt3.ggpht.com/ufio9g_mAPe4ZqkLiHz9zttMs3yvo9VviA5ozR4W9JDzLu3dZxg3-HZm-KyAoJVJ9LdByA9O=s48-c-k-c0x00ffffff-no-rj,http://www.youtube.com/@natalieespinoza9385,UCZ1sZB-tf1nam3VM7XR5znQ,True,none,0.0,2024-06-04T23:26:48Z,2024-06-04T23:26:48Z,True,0.0,True,,,,,,,,,,,,,
youtube#commentThread,H8psD1eJlzKSCc8YkATI-ZHlAsI,UgzRWdxot36g--eaGpV4AaABAg,UCeYSnd34IPe57sM8hkjWhrw,ShW6FY-vbmo,youtube#comment,d3qVHcs52WClc3JBd9jBS-RhIXo,UgzRWdxot36g--eaGpV4AaABAg,UCeYSnd34IPe57sM8hkjWhrw,ShW6FY-vbmo,Inviten a @Slobotzky !!,Inviten a @Slobotzky !!,@alvarojimenez1989,https://yt3.ggpht.com/ytc/AIdro_kXw2BTYXfUWl0JhD-0KD0kX_gJ0xR67BipRkVdnEY=s48-c-k-c0x00ffffff-no-rj,http://www.youtube.com/@alvarojimenez1989,UCum_F-iSj0qoJAr8nvg3q5Q,True,none,0.0,2024-06-04T22:43:47Z,2024-06-04T22:44:22Z,True,0.0,True,,,,,,,,,,,,,
youtube#commentThread,4S86UuL_K4TuAEOLaGugEpCXEA8,UgxbKNwjnUOTh0WvCkh4AaABAg,UCeYSnd34IPe57sM8hkjWhrw,ShW6FY-vbmo,youtube#comment,H5BkF_9g9_Em8Pabxaq_MW5jsXs,UgxbKNwjnUOTh0WvCkh4AaABAg,UCeYSnd34IPe57sM8hkjWhrw,ShW6FY-vbmo,Espero ese shot: deberías ser pro-paz porque está en la constitución. Acto siguiente le da &quot;paz!&quot; Al cubo para siempre xD,"Espero ese shot: deberías ser pro-paz porque está en la constitución. Acto siguiente le da ""paz!"" Al cubo para siempre xD",@eljogucho8790,https://yt3.ggpht.com/ytc/AIdro_lacMVVpp2CQlNMYF3Ql0XyGGlp684d30-aFIYJaOc=s48-c-k-c0x00ffffff-no-rj,http://www.youtube.com/@eljogucho8790,UCgrrkqQni4exAvXLDWvSqNw,True,none,0.0,2024-06-04T21:47:07Z,2024-06-04T21:47:07Z,True,0.0,True,,,,,,,,,,,,,
youtube#commentThread,2f8mPdNscE-ytFZuMBW400jEsAM,UgwC5IhAdVFnwYsUepN4AaABAg,UCeYSnd34IPe57sM8hkjWhrw,ShW6FY-vbmo,youtube#comment,lkL43O_DiqbUtwgn2w_KIm3OyTc,UgwC5IhAdVFnwYsUepN4AaABAg,UCeYSnd34IPe57sM8hkjWhrw,ShW6FY-vbmo,Cuando hablarán de ¿cómo se vivía en las URSS?,Cuando hablarán de ¿cómo se vivía en las URSS?,@ricardopachecodimas1107,https://yt3.ggpht.com/ytc/AIdro_lf5U7vkWsI8AAHCAO5rd7opKZW4T-Ecyo25tWY03GfLJcL=s48-c-k-c0x00ffffff-no-rj,http://www.youtube.com/@ricardopachecodimas1107,UC6VdqKcAd5KIByG9O_ah2fA,True,none,0.0,2024-06-04T21:04:53Z,2024-06-04T21:04:53Z,True,0.0,True,,,,,,,,,,,,,
youtube#commentThread,DFQ9PNGNTOrFDCkCiz39rT6mx94,Ugy_PHQegvQ-uxyaj7h4AaABAg,UCeYSnd34IPe57sM8hkjWhrw,ShW6FY-vbmo,youtube#comment,5DMO3m7qX_IarWUTlZezjz0Qvdc,Ugy_PHQegvQ-uxyaj7h4AaABAg,UCeYSnd34IPe57sM8hkjWhrw,ShW6FY-vbmo,Mmmm Teca enojado 😍🫣🤤,Mmmm Teca enojado 😍🫣🤤,@lauraresendizmartinez8811,https://yt3.ggpht.com/ytc/AIdro_ndZ7amwdHjweuMojBghby2dYYiKubjzSXtaqy90lqBdQ=s48-c-k-c0x00ffffff-no-rj,http://www.youtube.com/@lauraresendizmartinez8811,UCaCqk7uYSTCYpFj06GJN52Q,True,none,0.0,2024-06-04T20:51:26Z,2024-06-04T20:51:26Z,True,0.0,True,,,,,,,,,,,,,
youtube#commentThread,T7newD26ho7jDq6AmwcYEj9Y_Fg,Ugxey_U7AxYdITT5jaN4AaABAg,UCeYSnd34IPe57sM8hkjWhrw,ShW6FY-vbmo,youtube#comment,jpHFvv8hFJI3Q7SxWLKAqtK-HsM,Ugxey_U7AxYdITT5jaN4AaABAg,UCeYSnd34IPe57sM8hkjWhrw,ShW6FY-vbmo,Tremendo Brazil que hizo una aportación con sus elocuentes palabras ❤,Tremendo Brazil que hizo una aportación con sus elocuentes palabras ❤,@LadySkywalkerW,https://yt3.ggpht.com/ytc/AIdro_lwbDah96CnBihX4Y-e36Gm0TnYnOORwUSk-Wx4KTUTgw=s48-c-k-c0x00ffffff-no-rj,http://www.youtube.com/@LadySkywalkerW,UCC-kANsNvPcG9ut34SPngeg,True,none,3.0,2024-06-04T20:31:47Z,2024-06-04T20:31:47Z,True,0.0,True,,,,,,,,,,,,,
youtube#commentThread,R24dD2I01eOTH5HxkQAD-lC_MuU,Ugx5oWjxU-xoGVNj-lN4AaABAg,UCeYSnd34IPe57sM8hkjWhrw,ShW6FY-vbmo,youtube#comment,_UGvkQKh-uxQBNn7-HB0RaQRSsE,Ugx5oWjxU-xoGVNj-lN4AaABAg,UCeYSnd34IPe57sM8hkjWhrw,ShW6FY-vbmo,❤❤❤❤,❤❤❤❤,@miguelleal4920,https://yt3.ggpht.com/ytc/AIdro_lomUyWLDjs8BbUtU7XjeNNoFg76Ai22p5huLPehaLTKxY=s48-c-k-c0x00ffffff-no-rj,http://www.youtube.com/@miguelleal4920,UCvHySKELM8S4ZWFUETyoTRA,True,none,0.0,2024-06-04T19:59:31Z,2024-06-04T19:59:31Z,True,0.0,True,,,,,,,,,,,,,
youtube#commentThread,BXWbbpeBQ7DBTGd9S3ftNixAlw0,Ugy0Rkx4EKQyKYP33Qh4AaABAg,UCeYSnd34IPe57sM8hkjWhrw,ShW6FY-vbmo,youtube#comment,ra_m5QJyLh6qFm08ulMQW8oCUoY,Ugy0Rkx4EKQyKYP33Qh4AaABAg,UCeYSnd34IPe57sM8hkjWhrw,ShW6FY-vbmo,"No le falten el respeto a Profeco. Esa institución también funciona, bien y bonito ❤","No le falten el respeto a Profeco. Esa institución también funciona, bien y bonito ❤",@LadySkywalkerW,https://yt3.ggpht.com/ytc/AIdro_lwbDah96CnBihX4Y-e36Gm0TnYnOORwUSk-Wx4KTUTgw=s48-c-k-c0x00ffffff-no-rj,http://www.youtube.com/@LadySkywalkerW,UCC-kANsNvPcG9ut34SPngeg,True,none,1.0,2024-06-04T19:26:39Z,2024-06-04T19:26:39Z,True,0.0,True,,,,,,,,,,,,,
youtube#commentThread,rCczrmF9i0P6rDuhbNwhRS-HhWo,UgwsCxfwZDrTH--MZ2V4AaABAg,UCeYSnd34IPe57sM8hkjWhrw,ShW6FY-vbmo,youtube#comment,GITwnc3o-ox63I3X3Z0Ad11V54U,UgwsCxfwZDrTH--MZ2V4AaABAg,UCeYSnd34IPe57sM8hkjWhrw,ShW6FY-vbmo,"Hola solo para informar sobre lo que hablaron al inicio del video, México ha pedido incorporarse al caso contra Israel en la Corte Internacional de Justicia (CIJ) por el genocidio en la Franja de Gaza. De lo que hablaron ya tiene como un mes que pasó, pero bno no sé cuándo lo grabaron xd.","Hola solo para informar sobre lo que hablaron al inicio del video, México ha pedido incorporarse al caso contra Israel en la Corte Internacional de Justicia (CIJ) por el genocidio en la Franja de Gaza. De lo que hablaron ya tiene como un mes que pasó, pero bno no sé cuándo lo grabaron xd.",@HugoOch,https://yt3.ggpht.com/ytc/AIdro_lo73MGHERoMbbwJW7HwqKSeA4FsZDCdz2L1C2zdApBoTc=s48-c-k-c0x00ffffff-no-rj,http://www.youtube.com/@HugoOch,UCuJ70soFN2hwvCec8ldyt5A,True,none,4.0,2024-06-04T18:11:55Z,2024-06-04T18:11:55Z,True,2.0,True,"[{'kind': 'youtube#comment', 'etag': 'X2B4G6vW2TrUTUSaTk4TrtqDWxg', 'id': 'UgwsCxfwZDrTH--MZ2V4AaABAg.A4GvWxrTfNeA4H2nTsbutp', 'snippet': {'channelId': 'UCeYSnd34IPe57sM8hkjWhrw', 'videoId': 'ShW6FY-vbmo', 'textDisplay': 'Fue lo primero que dijeron xd 14 de mayo', 'textOriginal': 'Fue lo primero que dijeron xd 14 de mayo', 'parentId': 'UgwsCxfwZDrTH--MZ2V4AaABAg', 'authorDisplayName': '@LadySkywalkerW', 'authorProfileImageUrl': 'https://yt3.ggpht.com/ytc/AIdro_lwbDah96CnBihX4Y-e36Gm0TnYnOORwUSk-Wx4KTUTgw=s48-c-k-c0x00ffffff-no-rj', 'authorChannelUrl': 'http://www.youtube.com/@LadySkywalkerW', 'authorChannelId': {'value': 'UCC-kANsNvPcG9ut34SPngeg'}, 'canRate': True, 'viewerRating': 'none', 'likeCount': 2, 'publishedAt': '2024-06-04T19:24:13Z', 'updatedAt': '2024-06-04T19:24:13Z'}}, {'kind': 'youtube#comment', 'etag': 'F97qUH4KBytMgRkwsxGvusdEE9s', 'id': 'UgwsCxfwZDrTH--MZ2V4AaABAg.A4GvWxrTfNeA4HM8t2obYn', 'snippet': {'channelId': 'UCeYSnd34IPe57sM8hkjWhrw', 'videoId': 'ShW6FY-vbmo', 'textDisplay': '\u200b@@LadySkywalkerW cierto xd', 'textOriginal': '\u200b@@LadySkywalkerW cierto xd', 'parentId': 'UgwsCxfwZDrTH--MZ2V4AaABAg', 'authorDisplayName': '@HugoOch', 'authorProfileImageUrl': 'https://yt3.ggpht.com/ytc/AIdro_lo73MGHERoMbbwJW7HwqKSeA4FsZDCdz2L1C2zdApBoTc=s48-c-k-c0x00ffffff-no-rj', 'authorChannelUrl': 'http://www.youtube.com/@HugoOch', 'authorChannelId': {'value': 'UCuJ70soFN2hwvCec8ldyt5A'}, 'canRate': True, 'viewerRating': 'none', 'likeCount': 0, 'publishedAt': '2024-06-04T22:13:18Z', 'updatedAt': '2024-06-04T22:13:18Z'}}]",,,,,,,,,,,,
youtube#commentThread,o2XRDRvPWkJNuF6-JMT0puVfSKM,Ugz5OYJelIm7wN5IVKh4AaABAg,UCeYSnd34IPe57sM8hkjWhrw,ShW6FY-vbmo,youtube#comment,KZiIhHWuYmA3eDTDFcy_daAXXwQ,Ugz5OYJelIm7wN5IVKh4AaABAg,UCeYSnd34IPe57sM8hkjWhrw,ShW6FY-vbmo,"Los adoro, no cambien nunca! Me acompañan en cada vuelo!","Los adoro, no cambien nunca! Me acompañan en cada vuelo!",@veronicagomez2010,https://yt3.ggpht.com/ytc/AIdro_mPySU5WyR_Fdlyu5aJyXkxSbPFfSuWK-77R9kttAb8YQ=s48-c-k-c0x00ffffff-no-rj,http://www.youtube.com/@veronicagomez2010,UCkzQ-DOVihDj9CYdIMHvr3Q,True,none,1.0,2024-06-04T18:06:03Z,2024-06-04T18:06:03Z,True,0.0,True,,,,,,,,,,,,,
youtube#commentThread,dlpScIe4JnJ7s_h2KxK8k0lzSN0,Ugy7VPv4N58WO6GhynV4AaABAg,UCeYSnd34IPe57sM8hkjWhrw,ShW6FY-vbmo,youtube#comment,-w-iCvziLlXkEIjBcZ9yIFYenG0,Ugy7VPv4N58WO6GhynV4AaABAg,UCeYSnd34IPe57sM8hkjWhrw,ShW6FY-vbmo,Saludenme porfa,Saludenme porfa,@luisangelbarreracuahuizo7031,https://yt3.ggpht.com/ytc/AIdro_llNoc8Uvd1aDAEboGpiX8nu6AKiUZVTtEXDKQWymI=s48-c-k-c0x00ffffff-no-rj,http://www.youtube.com/@luisangelbarreracuahuizo7031,UCbTxrXtcVOZUMWqKaikTApA,True,none,0.0,2024-06-04T17:57:17Z,2024-06-04T17:57:17Z,True,0.0,True,,,,,,,,,,,,,
youtube#commentThread,FA1T3XLgcTpjbsgBDf1zjsiHGCs,UgwsEasLGzHK9uE_8J54AaABAg,UCeYSnd34IPe57sM8hkjWhrw,ShW6FY-vbmo,youtube#comment,SeRQKiLWsYS3nDfQ58zscNQefBo,UgwsEasLGzHK9uE_8J54AaABAg,UCeYSnd34IPe57sM8hkjWhrw,ShW6FY-vbmo,Saludos Tonotos,Saludos Tonotos,@kenoben007,https://yt3.ggpht.com/ytc/AIdro_kxWDZEJveR-n7lRBSA6p7mSF0yL6aRBHNQzPPaxx91AQ=s48-c-k-c0x00ffffff-no-rj,http://www.youtube.com/@kenoben007,UC6LvxKxuyDB3fKGwW1fODhg,True,none,1.0,2024-06-04T17:55:21Z,2024-06-04T17:55:21Z,True,0.0,True,,,,,,,,,,,,,
youtube#comment,X2B4G6vW2TrUTUSaTk4TrtqDWxg,UgwsCxfwZDrTH--MZ2V4AaABAg.A4GvWxrTfNeA4H2nTsbutp,UCeYSnd34IPe57sM8hkjWhrw,ShW6FY-vbmo,,,,,,,,,,,,,,,,,,,,,Fue lo primero que dijeron xd 14 de mayo,Fue lo primero que dijeron xd 14 de mayo,UgwsCxfwZDrTH--MZ2V4AaABAg,@LadySkywalkerW,https://yt3.ggpht.com/ytc/AIdro_lwbDah96CnBihX4Y-e36Gm0TnYnOORwUSk-Wx4KTUTgw=s48-c-k-c0x00ffffff-no-rj,http://www.youtube.com/@LadySkywalkerW,UCC-kANsNvPcG9ut34SPngeg,True,none,2.0,2024-06-04T19:24:13Z,2024-06-04T19:24:13Z
youtube#comment,F97qUH4KBytMgRkwsxGvusdEE9s,UgwsCxfwZDrTH--MZ2V4AaABAg.A4GvWxrTfNeA4HM8t2obYn,UCeYSnd34IPe57sM8hkjWhrw,ShW6FY-vbmo,,,,,,,,,,,,,,,,,,,,,​@@LadySkywalkerW cierto xd,​@@LadySkywalkerW cierto xd,UgwsCxfwZDrTH--MZ2V4AaABAg,@HugoOch,https://yt3.ggpht.com/ytc/AIdro_lo73MGHERoMbbwJW7HwqKSeA4FsZDCdz2L1C2zdApBoTc=s48-c-k-c0x00ffffff-no-rj,http://www.youtube.com/@HugoOch,UCuJ70soFN2hwvCec8ldyt5A,True,none,0.0,2024-06-04T22:13:18Z,2024-06-04T22:13:18Z
youtube#commentThread,EtsIJmGi7wNNcQMt6l2Fh5VxUfA,UgzX0OOcEIbjRLbpgQl4AaABAg,UCeYSnd34IPe57sM8hkjWhrw,rXd-HsVezzs,youtube#comment,qZi-tm761o2j4zQSjBSOwHDZ9jc,UgzX0OOcEIbjRLbpgQl4AaABAg,UCeYSnd34IPe57sM8hkjWhrw,rXd-HsVezzs,"Muy buenos los escucho cuando trabajo o hago tareas, Teka por que hay un pueblo en Estados Unidos que se llama BOLIVIAAAAA!! es una señal?","Muy buenos los escucho cuando trabajo o hago tareas, Teka por que hay un pueblo en Estados Unidos que se llama BOLIVIAAAAA!! es una señal?",@manuelabasto4573,https://yt3.ggpht.com/ytc/AIdro_k-uytXZfyM_Ria9_XlSMtJQSCBbZQZVaM5HnN0usoeyQ=s48-c-k-c0x00ffffff-no-rj,http://www.youtube.com/@manuelabasto4573,UCZXATMMsEvXtT1UCCbsvzbg,True,none,0.0,2024-09-05T17:11:53Z,2024-09-05T17:11:53Z,True,0.0,True,,,,,,,,,,,,,
youtube#commentThread,EbfLvr_57g50cluGbm2lPUNDCLs,UgxHRFxfbGcTI4wsK_B4AaABAg,UCeYSnd34IPe57sM8hkjWhrw,rXd-HsVezzs,youtube#comment,zFqNL__SP6fhqwzVTYI1wJC6sds,UgxHRFxfbGcTI4wsK_B4AaABAg,UCeYSnd34IPe57sM8hkjWhrw,rXd-HsVezzs,"Julio César en 2024: vini, vidi, valistes madre Boliviaaaaaaa!!!","Julio César en 2024: vini, vidi, valistes madre Boliviaaaaaaa!!!",@marcelourra9069,https://yt3.ggpht.com/ytc/AIdro_mijiIuoVVb1TgDkIRtIha9wUuX8jziAgKybsBuYOEzC98=s48-c-k-c0x00ffffff-no-rj,http://www.youtube.com/@marcelourra9069,UCuD2nrlsc8sjoYnLMc-WDZg,True,none,0.0,2024-08-02T19:33:14Z,2024-08-02T19:33:14Z,True,0.0,True,,,,,,,,,,,,,
