kind,etag,id,snippet.channelId,snippet.videoId,snippet.topLevelComment.kind,snippet.topLevelComment.etag,snippet.topLevelComment.id,snippet.topLevelComment.snippet.channelId,snippet.topLevelComment.snippet.videoId,snippet.topLevelComment.snippet.textDisplay,snippet.topLevelComment.snippet.textOriginal,snippet.topLevelComment.snippet.authorDisplayName,snippet.topLevelComment.snippet.authorProfileImageUrl,snippet.topLevelComment.snippet.authorChannelUrl,snippet.topLevelComment.snippet.authorChannelId.value,snippet.topLevelComment.snippet.canRate,snippet.topLevelComment.snippet.viewerRating,snippet.topLevelComment.snippet.likeCount,snippet.topLevelComment.snippet.publishedAt,snippet.topLevelComment.snippet.updatedAt,snippet.canReply,snippet.totalReplyCount,snippet.isPublic,replies.comments
youtube#commentThread,rFe-DiDY0abPC8pnMqArW8TJTlI,UgzkijeQssCFng_wYId4AaABAg,UCeYSnd34IPe57sM8hkjWhrw,cOxTBBHDN-0,youtube#comment,3xX5xA7kTOr2ULf9u7N4VAN93zk,UgzkijeQssCFng_wYId4AaABAg,UCeYSnd34IPe57sM8hkjWhrw,cOxTBBHDN-0,"Me mamó el tema.<br>Yo siendo muy otaku, decidí no bañarme mientras lo oía para ser más realista y fiel.","Me mamó el tema.
Yo siendo muy otaku, decidí no bañarme mientras lo oía para ser más realista y fiel.",@medinamartinezdavid8052,https://yt3.ggpht.com/-qZlbIVr6TicQjMHl6IrrvJIoUstt9h8iK_rOlDEgexpue7JQ9GwPoNFXwNG4LvrO1ZlFPj3dw=s48-c-k-c0x00ffffff-no-rj,http://www.youtube.com/@medinamartinezdavid8052,UCbTyK6oHehb5LiFiA_DUfQQ,True,none,9,2024-09-03T04:26:59Z,2024-09-03T04:26:59Z,True,0,True,
youtube#commentThread,TksQ_2t0jvvUBZJvCfPPCfiFp_0,UgwVwIRGIi3QR8us-jF4AaABAg,UCeYSnd34IPe57sM8hkjWhrw,cOxTBBHDN-0,youtube#comment,GJ6-KI2RRxexu2hlGwXh_e1oXxs,UgwVwIRGIi3QR8us-jF4AaABAg,UCeYSnd34IPe57sM8hkjWhrw,cOxTBBHDN-0,"El audio se fue alv como por ahí de la mitad 😔 pero que chingon capitulo, me dieron ganas de ir a maratonear AstroBoy jajaj","El audio se fue alv como por ahí de la mitad 😔 pero que chingon capitulo, me dieron ganas de ir a maratonear AstroBoy jajaj",@diegoandres29,https://yt3.ggpht.com/ytc/AIdro_mBUdg6EqQ0Vq8tAp9_zqiafsZQBBw66pOrTtBJnfWIR3w=s48-c-k-c0x00ffffff-no-rj,http://www.youtube.com/@diegoandres29,UCvjXIYJAZUIxGtU8dAPQTHg,True,none,9,2024-09-03T04:18:37Z,2024-09-03T04:18:37Z,True,0,True,
youtube#commentThread,TFLRgqDXLZeE1026zivGDyuoR_E,UgyO6Wnh51MZSIsimBN4AaABAg,UCeYSnd34IPe57sM8hkjWhrw,cOxTBBHDN-0,youtube#comment,-yBaN0Kmue3YF47r04W03DQfJl4,UgyO6Wnh51MZSIsimBN4AaABAg,UCeYSnd34IPe57sM8hkjWhrw,cOxTBBHDN-0,"Nunca había quitado un vídeo de ustedes, no entendía nada y me aburrí, no soy Otaku. 😢 <br>Por ahora. 👀","Nunca había quitado un vídeo de ustedes, no entendía nada y me aburrí, no soy Otaku. 😢 
Por ahora. 👀",@arturozavala9513,https://yt3.ggpht.com/ytc/AIdro_l6uu0b2o6LHGgBRXx2YyulnDo45gji9v5q1D6o9XinYk8t=s48-c-k-c0x00ffffff-no-rj,http://www.youtube.com/@arturozavala9513,UClG5_ACnJ3M5RIrzuArDZgQ,True,none,0,2024-09-03T03:46:55Z,2024-09-03T03:46:55Z,True,0,True,
youtube#commentThread,VSqr1mmcE_CCZF84WmykS9JhIBM,UgzT1_S2rlfTP7AOVKZ4AaABAg,UCeYSnd34IPe57sM8hkjWhrw,cOxTBBHDN-0,youtube#comment,jn1oSaxeSxA4gZJiCx146j5tgwU,UgzT1_S2rlfTP7AOVKZ4AaABAg,UCeYSnd34IPe57sM8hkjWhrw,cOxTBBHDN-0,Ni a chambear llego tan rapido😂,Ni a chambear llego tan rapido😂,@diegoyaelbanuelosmejia303,https://yt3.ggpht.com/ytc/AIdro_mx5iiLsPXZ0u16MINo374Y72v6Rt1GvcCKF9EtA6g=s48-c-k-c0x00ffffff-no-rj,http://www.youtube.com/@diegoyaelbanuelosmejia303,UCdTwwU5lOYXiU_-jPJuUylw,True,none,0,2024-09-03T03:24:20Z,2024-09-03T03:24:20Z,True,0,True,
youtube#commentThread,ZPb51b4FQVj5K11NTR16Hfu7OTE,UgwJcXsvHBWaEa5HaPZ4AaABAg,UCeYSnd34IPe57sM8hkjWhrw,cOxTBBHDN-0,youtube#comment,ovfvMj34gOhW-geLMYXooupFVbU,UgwJcXsvHBWaEa5HaPZ4AaABAg,UCeYSnd34IPe57sM8hkjWhrw,cOxTBBHDN-0,"Apenas van unos segundos y ya están diciendo mamadas, los amoooo perrotes","Apenas van unos segundos y ya están diciendo mamadas, los amoooo perrotes",@OmarAlejandroEsparza,https://yt3.ggpht.com/ytc/AIdro_laKiAQG6APgun5ka2vr77FM6nHj6zegkYUZsMSwWKDpioFAo0JNiuSsgQgZcAW5aHBYg=s48-c-k-c0x00ffffff-no-rj,http://www.youtube.com/@OmarAlejandroEsparza,UCPlRSU1fPqlPLya8OhQh_ig,True,none,0,2024-09-03T03:04:44Z,2024-09-03T03:04:44Z,True,0,True,
youtube#commentThread,Op53cbC3-LrgvtXfPvurREdGSRc,Ugz21U1uwDjLcM_Ujg14AaABAg,UCeYSnd34IPe57sM8hkjWhrw,cOxTBBHDN-0,youtube#comment,pl2xt0YnU3gGA-KY08qUiWoN-RE,Ugz21U1uwDjLcM_Ujg14AaABAg,UCeYSnd34IPe57sM8hkjWhrw,cOxTBBHDN-0,"Me encanta que historia para  tontos con el pasar de los episodios se vuelve más funables, hasta parece que lo escriben los mismos que hicieron la casa de los dibujos y una felicitación extra a Iker por aceptar se tal y como es un Otaku, y Teka deberías amenazar a Iker con una barra de jabón para que así ya suba lo shownotes","Me encanta que historia para  tontos con el pasar de los episodios se vuelve más funables, hasta parece que lo escriben los mismos que hicieron la casa de los dibujos y una felicitación extra a Iker por aceptar se tal y como es un Otaku, y Teka deberías amenazar a Iker con una barra de jabón para que así ya suba lo shownotes",@martinhernandezperez6415,https://yt3.ggpht.com/ytc/AIdro_nZa2L5tvX7AvSd4Ge5CNES4grhI0iSwAR0FOEKVgy-ONyNf84-qq6U12ADeVbgPcot_Q=s48-c-k-c0x00ffffff-no-rj,http://www.youtube.com/@martinhernandezperez6415,UCQJcY-k832QfbRhOITH7aPw,True,none,5,2024-09-03T02:47:46Z,2024-09-03T02:47:46Z,True,0,True,
youtube#commentThread,_J1s6Xqncx2DdgCT6SerRVOqT6M,UgzVWjfncSX-EQDgcpV4AaABAg,UCeYSnd34IPe57sM8hkjWhrw,cOxTBBHDN-0,youtube#comment,uEvE4mAjeqPyNpkKMg9ZE2vuFO8,UgzVWjfncSX-EQDgcpV4AaABAg,UCeYSnd34IPe57sM8hkjWhrw,cOxTBBHDN-0,primer comentario!!!!!.... ahora que?,primer comentario!!!!!.... ahora que?,@Mr_Absolute_Zero,https://yt3.ggpht.com/ytc/AIdro_mm_mPJ8jj8Y8mfKAiH4zs3e_F63hCEj2L0FxUsqxeIWMs=s48-c-k-c0x00ffffff-no-rj,http://www.youtube.com/@Mr_Absolute_Zero,UC3nxzCOV0D5BBxXGbz1b2cw,True,none,1,2024-09-03T02:42:14Z,2024-09-03T02:42:14Z,True,0,True,
