kind,etag,id,snippet.channelId,snippet.videoId,snippet.topLevelComment.kind,snippet.topLevelComment.etag,snippet.topLevelComment.id,snippet.topLevelComment.snippet.channelId,snippet.topLevelComment.snippet.videoId,snippet.topLevelComment.snippet.textDisplay,snippet.topLevelComment.snippet.textOriginal,snippet.topLevelComment.snippet.authorDisplayName,snippet.topLevelComment.snippet.authorProfileImageUrl,snippet.topLevelComment.snippet.authorChannelUrl,snippet.topLevelComment.snippet.authorChannelId.value,snippet.topLevelComment.snippet.canRate,snippet.topLevelComment.snippet.viewerRating,snippet.topLevelComment.snippet.likeCount,snippet.topLevelComment.snippet.publishedAt,snippet.topLevelComment.snippet.updatedAt,snippet.canReply,snippet.totalReplyCount,snippet.isPublic,replies.comments
youtube#commentThread,kasZHfjMzgPmxTtQA433aZbDg_Q,UgxA8LcCVJJ3QLAefAl4AaABAg,UCeYSnd34IPe57sM8hkjWhrw,cOxTBBHDN-0,youtube#comment,oZIOc8Byaof1P8GpzL_jnRHWL_4,UgxA8LcCVJJ3QLAefAl4AaABAg,UCeYSnd34IPe57sM8hkjWhrw,cOxTBBHDN-0,Cuando quieran nos aventamos la historia de Pokémon ;),Cuando quieran nos aventamos la historia de Pokémon ;),@criticalhitpkmcast9695,https://yt3.ggpht.com/BbJoVLehNKKgwedrkChdqxtcV-afkThpSqm3CtCN9iuujFkTuEU-1Q0has9C38hI3QkIudxQAIs=s48-c-k-c0x00ffffff-no-rj,http://www.youtube.com/@criticalhitpkmcast9695,UCFFNiAVhfjgkllXRxajXGnQ,True,none,0,2024-10-04T14:07:56Z,2024-10-04T14:07:56Z,True,0,True,
youtube#commentThread,gYzb70jBwL3__F-iFY93r2wgMos,UgyhVrYnG0HVzQzLZ6J4AaABAg,UCeYSnd34IPe57sM8hkjWhrw,cOxTBBHDN-0,youtube#comment,u0axJFeU4iW6QxDUmLdmpZCVyx0,UgyhVrYnG0HVzQzLZ6J4AaABAg,UCeYSnd34IPe57sM8hkjWhrw,cOxTBBHDN-0,Que poco Otaku de mi parte bañarme mientras escucho este episodio!,Que poco Otaku de mi parte bañarme mientras escucho este episodio!,@ElFisioAguilar,https://yt3.ggpht.com/vrXr_yWzIt9CXd8d7dnE0V_eskO7BGD0-duBE4xOGpNX5EcqGI24D4NrftyXrXO_o2p7cQ-_uW4=s48-c-k-c0x00ffffff-no-rj,http://www.youtube.com/@ElFisioAguilar,UCGO2IuwcvuwK1LwRue2WcfQ,True,none,0,2024-09-30T21:07:21Z,2024-09-30T21:07:21Z,True,0,True,
youtube#commentThread,yKDT0k1-N-pXpds8bKwSCAhcF0Q,Ugw7zx0W3YF2DDbB3kp4AaABAg,UCeYSnd34IPe57sM8hkjWhrw,cOxTBBHDN-0,youtube#comment,BjU_Gr7XbuI3SzlIOWSg9irXrfM,Ugw7zx0W3YF2DDbB3kp4AaABAg,UCeYSnd34IPe57sM8hkjWhrw,cOxTBBHDN-0,"Porque han desperdiciado tanto el capitulo de la era Meiji como el de la historia del anime para hablar de Rurouni Kenshin, que casi da para hacerle un capitulo por si sola!!!!! no mmn vayan a verla (o mejor a leer el maga) y se me regresan alv a hacer capitulo!!","Porque han desperdiciado tanto el capitulo de la era Meiji como el de la historia del anime para hablar de Rurouni Kenshin, que casi da para hacerle un capitulo por si sola!!!!! no mmn vayan a verla (o mejor a leer el maga) y se me regresan alv a hacer capitulo!!",@TheOscardlr,https://yt3.ggpht.com/TXKw0I0GRuveqNgmSo_sxxFiKXeBe-z65n3BJ3qgCsOKv7xlr8_qsAmt1OWDUXyWQ_fJzN9b1zg=s48-c-k-c0x00ffffff-no-rj,http://www.youtube.com/@TheOscardlr,UCPi-7XzOLmh6fO7e_l0KOUg,True,none,0,2024-09-30T02:28:42Z,2024-09-30T02:28:42Z,True,0,True,
youtube#commentThread,L_Y3Ca39vijW_T49rPFH1n7wlnc,Ugy8YyM77pRMh2ztnVV4AaABAg,UCeYSnd34IPe57sM8hkjWhrw,cOxTBBHDN-0,youtube#comment,Sjq78vC1CI9gb3mXSn7pY9f2mZo,Ugy8YyM77pRMh2ztnVV4AaABAg,UCeYSnd34IPe57sM8hkjWhrw,cOxTBBHDN-0,SI COMPRARIA ESE MANGA.....,SI COMPRARIA ESE MANGA.....,@jessicanq1459,https://yt3.ggpht.com/ytc/AIdro_lgtQx-L3sDzsW8WG5y4qcQ3H6YpM2vnpv66Ie89NtbVQ=s48-c-k-c0x00ffffff-no-rj,http://www.youtube.com/@jessicanq1459,UCMQNSX21vOt3pfvLvPP7nEg,True,none,1,2024-09-17T23:24:12Z,2024-09-17T23:24:12Z,True,0,True,
youtube#commentThread,PZAnDQgFMyLQ-PTp7GblcWjd_xI,UgyFtcjTItmjMgxhRl54AaABAg,UCeYSnd34IPe57sM8hkjWhrw,cOxTBBHDN-0,youtube#comment,gJaKH6V_HyaTbtVu_BuFlc09mss,UgyFtcjTItmjMgxhRl54AaABAg,UCeYSnd34IPe57sM8hkjWhrw,cOxTBBHDN-0,no le tenia fe a este capitulo... no soy fan del anime... pero en serio me encantoooooo y creo que me he estado perdiendo de mucho.... vieron la serie de BLUE EYES SAMURAI????? SE ME HIZO SUPER INTERESANTE!!!!<br>soy de la generacion de candy candy y de remi.... UNA GENERACION TRAUMADA CON ESAS HISTORIAS!<br>Perooooo.... de niña mi favorita era MAZINGER Z,"no le tenia fe a este capitulo... no soy fan del anime... pero en serio me encantoooooo y creo que me he estado perdiendo de mucho.... vieron la serie de BLUE EYES SAMURAI????? SE ME HIZO SUPER INTERESANTE!!!!
soy de la generacion de candy candy y de remi.... UNA GENERACION TRAUMADA CON ESAS HISTORIAS!
Perooooo.... de niña mi favorita era MAZINGER Z",@jessicanq1459,https://yt3.ggpht.com/ytc/AIdro_lgtQx-L3sDzsW8WG5y4qcQ3H6YpM2vnpv66Ie89NtbVQ=s48-c-k-c0x00ffffff-no-rj,http://www.youtube.com/@jessicanq1459,UCMQNSX21vOt3pfvLvPP7nEg,True,none,2,2024-09-17T22:14:52Z,2024-09-17T22:14:52Z,True,0,True,
youtube#commentThread,v4bthk4PhNJoL8BwvcnzcGAfIKo,UgwEpXOi8moTqJRMTNt4AaABAg,UCeYSnd34IPe57sM8hkjWhrw,cOxTBBHDN-0,youtube#comment,2bGaKPo6tGIIvGMd4GOLgftx5zY,UgwEpXOi8moTqJRMTNt4AaABAg,UCeYSnd34IPe57sM8hkjWhrw,cOxTBBHDN-0,Saludos a mi compa azteca  cuando se jala a Quiroga compa yo pongo las caritas ; puro terreno tranqui por acá,Saludos a mi compa azteca  cuando se jala a Quiroga compa yo pongo las caritas ; puro terreno tranqui por acá,@olivoek4943,https://yt3.ggpht.com/ytc/AIdro_kUpev3UoxeMEST6HoCvjFH_DgpCCzbrQK_oNUjTkthH2-WV5A-n1zN2EavYE8xZ7xOFQ=s48-c-k-c0x00ffffff-no-rj,http://www.youtube.com/@olivoek4943,UC4fA8M7r-SPeyvI5zLhmbVQ,True,none,0,2024-09-14T22:06:34Z,2024-09-14T22:06:34Z,True,0,True,
youtube#commentThread,_gs7raSqj6N46xgrqJ0kjeB4fyQ,UgzYPhhFd-pHSh3CJkZ4AaABAg,UCeYSnd34IPe57sM8hkjWhrw,cOxTBBHDN-0,youtube#comment,ity212GVSSNxqCp5Bto4ed1obg4,UgzYPhhFd-pHSh3CJkZ4AaABAg,UCeYSnd34IPe57sM8hkjWhrw,cOxTBBHDN-0,Vuelvan a subir el de Fritz por qué en Spotify no aparece y en Youtube no hay vídeo 🫠,Vuelvan a subir el de Fritz por qué en Spotify no aparece y en Youtube no hay vídeo 🫠,@medinamartinezdavid8052,https://yt3.ggpht.com/-qZlbIVr6TicQjMHl6IrrvJIoUstt9h8iK_rOlDEgexpue7JQ9GwPoNFXwNG4LvrO1ZlFPj3dw=s48-c-k-c0x00ffffff-no-rj,http://www.youtube.com/@medinamartinezdavid8052,UCbTyK6oHehb5LiFiA_DUfQQ,True,none,0,2024-09-13T16:28:49Z,2024-09-13T16:28:49Z,True,0,True,
youtube#commentThread,9QtNfXm2VWnUZOzOX427phu9PQA,Ugw_gKoeyK4PJukphKN4AaABAg,UCeYSnd34IPe57sM8hkjWhrw,cOxTBBHDN-0,youtube#comment,gW8gbVErNrx0yvQ12dsIWUTghys,Ugw_gKoeyK4PJukphKN4AaABAg,UCeYSnd34IPe57sM8hkjWhrw,cOxTBBHDN-0,"Saludos un excelente capítulo ¿Cuando saldrá la parte 3 de Teotihuacán muy buena explicación de Teca, Iker Milhouse cuando se baña se ve más sabroso 😊😊saludos","Saludos un excelente capítulo ¿Cuando saldrá la parte 3 de Teotihuacán muy buena explicación de Teca, Iker Milhouse cuando se baña se ve más sabroso 😊😊saludos",@George-m4y,https://yt3.ggpht.com/ytc/AIdro_nxD7eTXBA5iUaLZmCQrPDXyKw9eMZ7JKRriegncRoCnn_XRrAEQ7ckpgil4YDZdF1_DQ=s48-c-k-c0x00ffffff-no-rj,http://www.youtube.com/@George-m4y,UCpSwh_ORbse43vHd5K1uMbw,True,none,0,2024-09-11T22:51:07Z,2024-09-11T22:51:07Z,True,0,True,
youtube#commentThread,HM5ez8n1Xiw2o9GuECgIy9BDElk,UgyrORnJr9e-a91JYxd4AaABAg,UCeYSnd34IPe57sM8hkjWhrw,cOxTBBHDN-0,youtube#comment,rgvd5e8-bbTOy5kdWUkWhqiEelU,UgyrORnJr9e-a91JYxd4AaABAg,UCeYSnd34IPe57sM8hkjWhrw,cOxTBBHDN-0,Haikyuu hombre de cultura,Haikyuu hombre de cultura,@jasseralbertogodinezhernan2319,https://yt3.ggpht.com/ytc/AIdro_kpCZPXRTpppydEMIbMs0Y8f4un6P-a_srv4Qfm8H99hF9g=s48-c-k-c0x00ffffff-no-rj,http://www.youtube.com/@jasseralbertogodinezhernan2319,UC0YJwJ86dCLbeIscYUqpVKQ,True,none,0,2024-09-09T04:47:55Z,2024-09-09T04:47:55Z,True,0,True,
youtube#commentThread,VoU2S3-IOl-gCUbitotlVOh9X6o,Ugxh1U1-1ow_s2xQa894AaABAg,UCeYSnd34IPe57sM8hkjWhrw,cOxTBBHDN-0,youtube#comment,2M9SoZEya_YzE0PJMJ4SU-3Z0LE,Ugxh1U1-1ow_s2xQa894AaABAg,UCeYSnd34IPe57sM8hkjWhrw,cOxTBBHDN-0,Hola. Anécdota: En la universidad me pidieron trascribir un podcast para checar la ortografía y todo ese pedo y decidí hacer el de Golpe de estado en Bolivia y la neta no podía escribir dos renglones porque ya salían con un chingo de groserías. Así se lo mandé a la profesora.<br>Nunca cambien,"Hola. Anécdota: En la universidad me pidieron trascribir un podcast para checar la ortografía y todo ese pedo y decidí hacer el de Golpe de estado en Bolivia y la neta no podía escribir dos renglones porque ya salían con un chingo de groserías. Así se lo mandé a la profesora.
Nunca cambien",@fatimafaboliamercadogarcia1741,https://yt3.ggpht.com/ytc/AIdro_nuZIdHK9BNlEAgs1ZB-J6pQnJKyatA_dl0U1aec3qwcQ=s48-c-k-c0x00ffffff-no-rj,http://www.youtube.com/@fatimafaboliamercadogarcia1741,UCU-g-Icb0qFhoRdTASSpirA,True,none,0,2024-09-07T23:24:43Z,2024-09-07T23:25:11Z,True,0,True,
youtube#commentThread,NfNwHlRV8FkCG3Gt6GFz7jIvGe8,Ugytedy-ZAG_zbpbozx4AaABAg,UCeYSnd34IPe57sM8hkjWhrw,cOxTBBHDN-0,youtube#comment,qDI8PTHKbzm4XQqi_roGTGqmoD8,Ugytedy-ZAG_zbpbozx4AaABAg,UCeYSnd34IPe57sM8hkjWhrw,cOxTBBHDN-0,"Me cae que si confirman su asistencia en la Mole, me bañare para ir a conocerlos","Me cae que si confirman su asistencia en la Mole, me bañare para ir a conocerlos",@arnulfozaurio,https://yt3.ggpht.com/ytc/AIdro_mgiecCeDhoeuClR7u9M4pNEdntPSH6djpCsrfK2wC94KA=s48-c-k-c0x00ffffff-no-rj,http://www.youtube.com/@arnulfozaurio,UCnQp2Z3mY6_WwnvP2QATzPQ,True,none,0,2024-09-07T23:10:10Z,2024-09-07T23:10:10Z,True,0,True,
youtube#commentThread,eQy5sSjoVdT9Ykki1CefSWrvvNk,UgyXvMzu9j_4IXJnLed4AaABAg,UCeYSnd34IPe57sM8hkjWhrw,cOxTBBHDN-0,youtube#comment,ZE6XPTKPPtMucTPoBaVez5tio68,UgyXvMzu9j_4IXJnLed4AaABAg,UCeYSnd34IPe57sM8hkjWhrw,cOxTBBHDN-0,Vengo de Spotify solo para corroborar que Iker si se parece a Milhouse jajaja<br>Me encanta la historia y gracias a ustedes la amo más y he aprendido más en 2 años escuchándolos que en todo mi tiempo en la escuela,"Vengo de Spotify solo para corroborar que Iker si se parece a Milhouse jajaja
Me encanta la historia y gracias a ustedes la amo más y he aprendido más en 2 años escuchándolos que en todo mi tiempo en la escuela",@Ivxnotfound,https://yt3.ggpht.com/LEPPdezYZb9Ppo7zAixM47zZoU41wB9CwdX_kIx8KU3DGlSyn0Y_4y6_OtFMN8VXO7KiRLqsBeU=s48-c-k-c0x00ffffff-no-rj,http://www.youtube.com/@Ivxnotfound,UCn6SGcA6_F-s0ebYFVjvc4Q,True,none,1,2024-09-07T06:50:28Z,2024-09-07T06:50:28Z,True,0,True,
youtube#commentThread,YOOkNLOms-ojCzq-ZvfhD9ukqTY,UgwR3OXSOkge3cqYEuV4AaABAg,UCeYSnd34IPe57sM8hkjWhrw,cOxTBBHDN-0,youtube#comment,-4XxYNNdndyQI6e1rQDHABt2Qaw,UgwR3OXSOkge3cqYEuV4AaABAg,UCeYSnd34IPe57sM8hkjWhrw,cOxTBBHDN-0,Avatar es anime,Avatar es anime,@ericgabrielbautistajaimes9187,https://yt3.ggpht.com/ytc/AIdro_nSA4cVsKyqzmQZKE7Yr3n7a2KyKBPikQgmCWkYtLU=s48-c-k-c0x00ffffff-no-rj,http://www.youtube.com/@ericgabrielbautistajaimes9187,UCNo0b1bQ-9pQoYzH7TQVxpg,True,none,0,2024-09-07T04:22:39Z,2024-09-07T04:22:39Z,True,0,True,
youtube#commentThread,HCqhKjwqEjtbGzMPMJo5U0AvJpM,Ugz8A-M8-HQvKfGbSgF4AaABAg,UCeYSnd34IPe57sM8hkjWhrw,cOxTBBHDN-0,youtube#comment,mcJwdjrrTSguWtOlOBdULqbqVxs,Ugz8A-M8-HQvKfGbSgF4AaABAg,UCeYSnd34IPe57sM8hkjWhrw,cOxTBBHDN-0,"Hola chicos, fan del podcast aquí. Sólo vengo a decir que estoy escuchando los captilos en orden para distraerme en el trabajo y les quiero dar el consuelo de que el audio de esos capitulos antiguos no es tan terrible como lo pintan, a la banda que no quiere escucharlos les aseguro que el esfuerzo vale la pena porque desde el capitulo uno el podcast ha sido muy interesante y muy muy divertido. Los tqm, sigan así.","Hola chicos, fan del podcast aquí. Sólo vengo a decir que estoy escuchando los captilos en orden para distraerme en el trabajo y les quiero dar el consuelo de que el audio de esos capitulos antiguos no es tan terrible como lo pintan, a la banda que no quiere escucharlos les aseguro que el esfuerzo vale la pena porque desde el capitulo uno el podcast ha sido muy interesante y muy muy divertido. Los tqm, sigan así.",@joannamartinez1744,https://yt3.ggpht.com/ytc/AIdro_lGY1vrRP5AxKvO5SKzckkbWKwxSbrFZdMJ-nDgmttqAl4=s48-c-k-c0x00ffffff-no-rj,http://www.youtube.com/@joannamartinez1744,UCG9WqDoXweAVrr6Wc2U2dyg,True,none,3,2024-09-06T23:12:41Z,2024-09-06T23:12:41Z,True,0,True,
youtube#commentThread,0Uc5pC2096kibKW90uVaipIbRj8,UgwQFWxGjbLvMH1ycH14AaABAg,UCeYSnd34IPe57sM8hkjWhrw,cOxTBBHDN-0,youtube#comment,t4zPdNpD7l9kxHhg2IvICYVQzgQ,UgwQFWxGjbLvMH1ycH14AaABAg,UCeYSnd34IPe57sM8hkjWhrw,cOxTBBHDN-0,De lejos el mejor cap de todos jajajajaja estos temas si que me gustan,De lejos el mejor cap de todos jajajajaja estos temas si que me gustan,@EconomiaParaTodos00,https://yt3.ggpht.com/QNeVVa-q9PYISNQB5xLUWYui6LZsqOD5DYBPCWGSjOlYA0PBrhZXzA7mj9SWQqYFKPAQR0hS=s48-c-k-c0x00ffffff-no-rj,http://www.youtube.com/@EconomiaParaTodos00,UCSgR2s3qyzT0TPFEAIUWcfA,True,none,0,2024-09-06T20:47:30Z,2024-09-06T20:47:30Z,True,0,True,
youtube#commentThread,52aWDmCjL7OH7dxhWvjM-ON-FvI,UgwvRrbj-gY0gviEVmB4AaABAg,UCeYSnd34IPe57sM8hkjWhrw,cOxTBBHDN-0,youtube#comment,lY3zqWvFVZ8gBFYhYykA7pD3bn0,UgwvRrbj-gY0gviEVmB4AaABAg,UCeYSnd34IPe57sM8hkjWhrw,cOxTBBHDN-0,"No puedo creer que ya los alcancé. Escuchaba dos o tres videos al día para tenerlos de fondo, incluso instalé una bocina en la cocina para seguir el ritmo y ahora deberé esperar una semana para escuchar a dos de los personajes y personas más divertidas, inteligentes y listas que he escuchado. Los te quiero mucho ❤🎉😊","No puedo creer que ya los alcancé. Escuchaba dos o tres videos al día para tenerlos de fondo, incluso instalé una bocina en la cocina para seguir el ritmo y ahora deberé esperar una semana para escuchar a dos de los personajes y personas más divertidas, inteligentes y listas que he escuchado. Los te quiero mucho ❤🎉😊",@ivmarciott4695,https://yt3.ggpht.com/ytc/AIdro_mKrojca--bh6T1kP41dnZWFjEBed5ahFDPwFpTxICqGVs=s48-c-k-c0x00ffffff-no-rj,http://www.youtube.com/@ivmarciott4695,UCE4c_1LhjC2Re9pXZepXHHA,True,none,2,2024-09-06T19:09:26Z,2024-09-06T19:09:26Z,True,0,True,
youtube#commentThread,sYu1cZgtk8htd0EzwseCRHs-iGY,UgzlTtlSQ-F1caBSJe94AaABAg,UCeYSnd34IPe57sM8hkjWhrw,cOxTBBHDN-0,youtube#comment,ukEJ2gyM2REI1G5vOnIl4qKvkJ0,UgzlTtlSQ-F1caBSJe94AaABAg,UCeYSnd34IPe57sM8hkjWhrw,cOxTBBHDN-0,"solo vine a decir que en amazon music traen un desmadre con los números de los capítulos jajajajaja <br><br>pd. muchas gracias por su contenido, la vrdd alimentan a este mi gusto por la historia, el cual nació  con mis clases de historia de mis maestros que tenían un estilo parecido de al de ustedes y eso esta chingon. de nuevo gracias !","solo vine a decir que en amazon music traen un desmadre con los números de los capítulos jajajajaja 

pd. muchas gracias por su contenido, la vrdd alimentan a este mi gusto por la historia, el cual nació  con mis clases de historia de mis maestros que tenían un estilo parecido de al de ustedes y eso esta chingon. de nuevo gracias !",@homeroesparza7444,https://yt3.ggpht.com/ytc/AIdro_lcUUQLawcKgxiT4_i9fBOghKsp1ZPpLigcqnwsiimPS3w=s48-c-k-c0x00ffffff-no-rj,http://www.youtube.com/@homeroesparza7444,UCeqDxNL-4hcdB0wU5qaYv4g,True,none,0,2024-09-04T20:05:31Z,2024-09-04T20:05:31Z,True,0,True,
youtube#commentThread,15Klj_5a0xG2jXsIW_FW721f-qk,Ugw8MikleqYjdEAnXYJ4AaABAg,UCeYSnd34IPe57sM8hkjWhrw,cOxTBBHDN-0,youtube#comment,JZFajtVMe4gkT0_dFJuJB09YP1I,Ugw8MikleqYjdEAnXYJ4AaABAg,UCeYSnd34IPe57sM8hkjWhrw,cOxTBBHDN-0,uffff yo si le invertía al manga de la conquista,uffff yo si le invertía al manga de la conquista,@zelskidorantestavera3891,https://yt3.ggpht.com/ytc/AIdro_kXvTlnXWtAsHsgvNx7BAP52Pm1b3bjM0OY9EwyTIjpEh2bKTqa8c_wCpnLkUh1q_T6Iw=s48-c-k-c0x00ffffff-no-rj,http://www.youtube.com/@zelskidorantestavera3891,UC5o84xEIK9RAs9G9OHK1fUQ,True,none,0,2024-09-04T04:07:15Z,2024-09-04T04:07:15Z,True,0,True,
youtube#commentThread,uiMqv1mjfvttYz9dI0wFqABh0RA,UgwWAuXcojKeouq6I_N4AaABAg,UCeYSnd34IPe57sM8hkjWhrw,cOxTBBHDN-0,youtube#comment,SC7-T9bgE9QH3PQquqAF2yoNMxM,UgwWAuXcojKeouq6I_N4AaABAg,UCeYSnd34IPe57sM8hkjWhrw,cOxTBBHDN-0,un anime de zapata madreandose a los hacendados por favor,un anime de zapata madreandose a los hacendados por favor,@zelskidorantestavera3891,https://yt3.ggpht.com/ytc/AIdro_kXvTlnXWtAsHsgvNx7BAP52Pm1b3bjM0OY9EwyTIjpEh2bKTqa8c_wCpnLkUh1q_T6Iw=s48-c-k-c0x00ffffff-no-rj,http://www.youtube.com/@zelskidorantestavera3891,UC5o84xEIK9RAs9G9OHK1fUQ,True,none,0,2024-09-04T04:04:37Z,2024-09-04T04:04:37Z,True,0,True,
youtube#commentThread,DJYwFehWl3GuWLXf0laiyrvbi9o,Ugz621nz3hLkuTK_eBV4AaABAg,UCeYSnd34IPe57sM8hkjWhrw,cOxTBBHDN-0,youtube#comment,nebq6QRwYF76sBx2YLgHC-DcjtQ,Ugz621nz3hLkuTK_eBV4AaABAg,UCeYSnd34IPe57sM8hkjWhrw,cOxTBBHDN-0,"Interesante capitulo! Hoy sería el primero que veo ya al corriente con todos los demas.<br><br>Recomendación de mi parte, una colaboración con Lalo Elizarrarás con la historia de la lucha libre!","Interesante capitulo! Hoy sería el primero que veo ya al corriente con todos los demas.

Recomendación de mi parte, una colaboración con Lalo Elizarrarás con la historia de la lucha libre!",@JoseCarlosEspinosaMonroy,https://yt3.ggpht.com/X3wXLxzsgnGiS6ikfN7Gz7DXretMl_5TXYJvuVQHh63d6MPrPr6tV2Mbgm2WOhYmkiZhjlve4Ds=s48-c-k-c0x00ffffff-no-rj,http://www.youtube.com/@JoseCarlosEspinosaMonroy,UCj0d2DoTBe9xKVAdbUHWXGA,True,none,0,2024-09-04T02:32:14Z,2024-09-04T02:32:14Z,True,0,True,
youtube#commentThread,nbOSLvreIQs8CZGuejxs_CtI810,UgwptA6u0YDQ1b1i3Ph4AaABAg,UCeYSnd34IPe57sM8hkjWhrw,cOxTBBHDN-0,youtube#comment,2cSFhLCRF5RNZ1Ql8D-6OnISRRk,UgwptA6u0YDQ1b1i3Ph4AaABAg,UCeYSnd34IPe57sM8hkjWhrw,cOxTBBHDN-0,Junji Itto es lo Máximo,Junji Itto es lo Máximo,@mariouzielolivarescruz7257,https://yt3.ggpht.com/ytc/AIdro_kmJoKrA-6nlYDRLXP929N61UM6E86UoCtrZ-TBBG6Yuqc=s48-c-k-c0x00ffffff-no-rj,http://www.youtube.com/@mariouzielolivarescruz7257,UCvwdkp-7AzIR_qHgd43GFyA,True,none,0,2024-09-03T23:09:08Z,2024-09-03T23:09:08Z,True,0,True,
youtube#commentThread,g10U4RF3XGRTIrjgcKm0_OeBNCQ,Ugw5SmOAGGVQgd6rwYd4AaABAg,UCeYSnd34IPe57sM8hkjWhrw,cOxTBBHDN-0,youtube#comment,QrVCanC3EqRvkZww_PIM1CjuCd0,Ugw5SmOAGGVQgd6rwYd4AaABAg,UCeYSnd34IPe57sM8hkjWhrw,cOxTBBHDN-0,"Si Cesar es tan chingon animando, por que el no animo 25000 frames en el Niño y la Garza?","Si Cesar es tan chingon animando, por que el no animo 25000 frames en el Niño y la Garza?",@gustavohernandez6046,https://yt3.ggpht.com/ytc/AIdro_lGrcofUALTcp7GmgXzG4pLHF6T7XUfdjuuEmwkNog=s48-c-k-c0x00ffffff-no-rj,http://www.youtube.com/@gustavohernandez6046,UCiAdxF6KCxuxr9L-EKe8KkA,True,none,2,2024-09-03T22:33:01Z,2024-09-03T22:33:01Z,True,0,True,
youtube#commentThread,hsa0G7JcA2r0ZBORC2ydPzfCyNA,UgzxD7FjuyMEA0D8QdV4AaABAg,UCeYSnd34IPe57sM8hkjWhrw,cOxTBBHDN-0,youtube#comment,LncsWZQeX28XNUSxtCdkgiyM0Y0,UgzxD7FjuyMEA0D8QdV4AaABAg,UCeYSnd34IPe57sM8hkjWhrw,cOxTBBHDN-0,Teka: &quot;no sé si comprarian un manga de la conquista de México&quot; <br>Los tontos: &quot;cállese y tome todo mi dinero&quot;,"Teka: ""no sé si comprarian un manga de la conquista de México"" 
Los tontos: ""cállese y tome todo mi dinero""",@martinhernandezperez6415,https://yt3.ggpht.com/ytc/AIdro_nZa2L5tvX7AvSd4Ge5CNES4grhI0iSwAR0FOEKVgy-ONyNf84-qq6U12ADeVbgPcot_Q=s48-c-k-c0x00ffffff-no-rj,http://www.youtube.com/@martinhernandezperez6415,UCQJcY-k832QfbRhOITH7aPw,True,none,1,2024-09-03T20:50:41Z,2024-09-03T20:50:41Z,True,0,True,
youtube#commentThread,z-wmz-rC9nZ_P807MaIJxttq5cQ,UgzhgKwy3k4v7vLoqU14AaABAg,UCeYSnd34IPe57sM8hkjWhrw,cOxTBBHDN-0,youtube#comment,yy9IvwuToxPrCfVZhAN19frqgDg,UgzhgKwy3k4v7vLoqU14AaABAg,UCeYSnd34IPe57sM8hkjWhrw,cOxTBBHDN-0,"Tan épico el invitado que le empezó a salir delay al hablar, chido capitulo cracks saludos desde monterrey, PD por si lo leen, saludo a mi novia kat que esta bien preciosa ❤ casi igual que iker","Tan épico el invitado que le empezó a salir delay al hablar, chido capitulo cracks saludos desde monterrey, PD por si lo leen, saludo a mi novia kat que esta bien preciosa ❤ casi igual que iker",@eduardogamez6331,https://yt3.ggpht.com/rJgQ2YF3EUV5U_DfIn6yX78V1heqv46qqFy7pmrXmogitM3OrkeeE6HrLVU6WOzv-9oTECd9_w=s48-c-k-c0x00ffffff-no-rj,http://www.youtube.com/@eduardogamez6331,UC2KvC57taRsC-4EznL1v8Bw,True,none,0,2024-09-03T20:31:55Z,2024-09-03T20:31:55Z,True,0,True,
youtube#commentThread,KtZAX0eNUfCtUDGiUNYpivBNq9k,UgxcxiuUK9ji7TaXgpt4AaABAg,UCeYSnd34IPe57sM8hkjWhrw,cOxTBBHDN-0,youtube#comment,5vA7QAKOxRz0hoebcR2vXnz2OOA,UgxcxiuUK9ji7TaXgpt4AaABAg,UCeYSnd34IPe57sM8hkjWhrw,cOxTBBHDN-0,"Desde el <a href=""https://www.youtube.com/watch?v=cOxTBBHDN-0&amp;t=2788"">46:28</a> se hace eco xd",Desde el 46:28 se hace eco xd,@turboyarag,https://yt3.ggpht.com/ytc/AIdro_mkl9DcEvN7fXSUFHyFIO6OR9trcZAlmJoi4qsyonR5ztw=s48-c-k-c0x00ffffff-no-rj,http://www.youtube.com/@turboyarag,UCNWWmgBcSEC_HG2g8CaRPKw,True,none,0,2024-09-03T19:44:57Z,2024-09-03T19:44:57Z,True,0,True,
youtube#commentThread,mD_3IV0K9-FHWJ4Pu_WPJjxTXf0,Ugwo9WE9-Zi_0wDJLjB4AaABAg,UCeYSnd34IPe57sM8hkjWhrw,cOxTBBHDN-0,youtube#comment,_AnrbO23RiBsY4k797dV62PpIT0,Ugwo9WE9-Zi_0wDJLjB4AaABAg,UCeYSnd34IPe57sM8hkjWhrw,cOxTBBHDN-0,Los estaba escuchando y me dijeron que son unos mecos debido a mis reacciones.. soy de 40..,Los estaba escuchando y me dijeron que son unos mecos debido a mis reacciones.. soy de 40..,@eddiethepaintermiguel8775,https://yt3.ggpht.com/ytc/AIdro_nBgi7q1fvql3wv_OjifJ2qZ9YYJlRLXsfufkMeVl0=s48-c-k-c0x00ffffff-no-rj,http://www.youtube.com/@eddiethepaintermiguel8775,UChKxrIytwdp7v2AfslkRkcQ,True,none,0,2024-09-03T18:15:13Z,2024-09-03T18:15:13Z,True,0,True,
youtube#commentThread,uekB8Ix4-OcxBfVlICnX5yDzoVw,Ugzk_F8Ga8-_r8NajY54AaABAg,UCeYSnd34IPe57sM8hkjWhrw,cOxTBBHDN-0,youtube#comment,dV4LVwwYgnJ29hNG7OG3xTFrBVk,Ugzk_F8Ga8-_r8NajY54AaABAg,UCeYSnd34IPe57sM8hkjWhrw,cOxTBBHDN-0,"uff .. ya no pude seguir a partir del minuto 47, se escucha eco y me da en mi problemas sensoriales","uff .. ya no pude seguir a partir del minuto 47, se escucha eco y me da en mi problemas sensoriales",@joselineirmabastidazaldiva5422,https://yt3.ggpht.com/ytc/AIdro_mvgtRVLGWNjj9_SxNs8YxW8Dgg8qj_z0jll2Cay9I=s48-c-k-c0x00ffffff-no-rj,http://www.youtube.com/@joselineirmabastidazaldiva5422,UCdfgAllgGFrhYSf7R_9h7fg,True,none,1,2024-09-03T18:07:23Z,2024-09-03T18:07:23Z,True,0,True,
youtube#commentThread,3WfDWiJdx1zkJ1PF_3LO8HW9Nk8,UgybOmKpAZ-WqewOFTp4AaABAg,UCeYSnd34IPe57sM8hkjWhrw,cOxTBBHDN-0,youtube#comment,pY4xX3nrOZxSdLom_9OFCoNyt0E,UgybOmKpAZ-WqewOFTp4AaABAg,UCeYSnd34IPe57sM8hkjWhrw,cOxTBBHDN-0,Al fin mi compa al que le gusta el anime va a disfrutar el episodio.<br>&quot;Primera postura: ver anime y no se Otaku&quot; 😂,"Al fin mi compa al que le gusta el anime va a disfrutar el episodio.
""Primera postura: ver anime y no se Otaku"" 😂",@ignaciogomez2201,https://yt3.ggpht.com/ytc/AIdro_lOwVUPHxqmmgJhsIkZ7uWrlNR5Cg-FjJoX3TsvGgWjewM=s48-c-k-c0x00ffffff-no-rj,http://www.youtube.com/@ignaciogomez2201,UCCBOMg8EQdhMrCqmKyEGP4w,True,none,1,2024-09-03T15:04:37Z,2024-09-03T15:04:37Z,True,0,True,
youtube#commentThread,LC66DDmlgwyRq0k0EP2rfULKXNc,Ugz72DRW7UnG0A7qrVJ4AaABAg,UCeYSnd34IPe57sM8hkjWhrw,cOxTBBHDN-0,youtube#comment,RC314LImIaz8wy7NQy4m7jUvk9U,Ugz72DRW7UnG0A7qrVJ4AaABAg,UCeYSnd34IPe57sM8hkjWhrw,cOxTBBHDN-0,"<a href=""https://www.youtube.com/watch?v=cOxTBBHDN-0&amp;t=1555"">25:55</a> Iker y cesar bien clavados en el tema y teca en modo simon simon ustedes hablen.<br>Mientras el bien entrado practicando sus jutsus","25:55 Iker y cesar bien clavados en el tema y teca en modo simon simon ustedes hablen.
Mientras el bien entrado practicando sus jutsus",@izmaelvilchis4305,https://yt3.ggpht.com/ytc/AIdro_k8gmdv0p4e1O_PWwZ2o-DdKw6lLX2bi6fWS2VWJi0=s48-c-k-c0x00ffffff-no-rj,http://www.youtube.com/@izmaelvilchis4305,UCMKpPyRyTQfndi7FPKpMbYA,True,none,7,2024-09-03T08:31:27Z,2024-09-03T08:36:59Z,True,1,True,"[{'kind': 'youtube#comment', 'etag': 'NRr5Wfqog0JvIhcS20KNShMKJyc', 'id': 'Ugz72DRW7UnG0A7qrVJ4AaABAg.A7vCR9FvMiHA7vm22NLLvZ', 'snippet': {'channelId': 'UCeYSnd34IPe57sM8hkjWhrw', 'videoId': 'cOxTBBHDN-0', 'textDisplay': 'jajajajjaja por estas cosas es que vengo a Youtube joya', 'textOriginal': 'jajajajjaja por estas cosas es que vengo a Youtube joya', 'parentId': 'Ugz72DRW7UnG0A7qrVJ4AaABAg', 'authorDisplayName': '@tatyal1000', 'authorProfileImageUrl': 'https://yt3.ggpht.com/ytc/AIdro_kdNr5iIcoA85QCzjOGa77eTtwPXEPex386_j0mzuSagKs=s48-c-k-c0x00ffffff-no-rj', 'authorChannelUrl': 'http://www.youtube.com/@tatyal1000', 'authorChannelId': {'value': 'UCQ4oGTX67O8BCKNcvhfgDGw'}, 'canRate': True, 'viewerRating': 'none', 'likeCount': 0, 'publishedAt': '2024-09-03T13:51:20Z', 'updatedAt': '2024-09-03T13:51:20Z'}}]"
youtube#commentThread,tTivnW-JEdDaYD0b3qVCdnH8uik,Ugynql8unX7x6-cmy9B4AaABAg,UCeYSnd34IPe57sM8hkjWhrw,cOxTBBHDN-0,youtube#comment,WiFyDEoDIodoLJpVDbFxyYBvOyQ,Ugynql8unX7x6-cmy9B4AaABAg,UCeYSnd34IPe57sM8hkjWhrw,cOxTBBHDN-0,"ufff más de una vez me han dado temas de conversación fabulosos peeeero hoy se la volaron! Con esta información ahora tengo tema para enamorar a un Otaku  que me encanta. jajaja Los amo, me hacen reír mucho. Teca e Iker muchas gracias!!!!  y por cierto es verdad que no dejan hablar a Iker jejeje😚","ufff más de una vez me han dado temas de conversación fabulosos peeeero hoy se la volaron! Con esta información ahora tengo tema para enamorar a un Otaku  que me encanta. jajaja Los amo, me hacen reír mucho. Teca e Iker muchas gracias!!!!  y por cierto es verdad que no dejan hablar a Iker jejeje😚",@alejandranavarro464,https://yt3.ggpht.com/_IdCNA3l2e4QZ175cWoUUzp_EG53aDHwC_Kf940vrAgfK75Vhph_tJ7B2vNTFBL_NeC3mbxf4A=s48-c-k-c0x00ffffff-no-rj,http://www.youtube.com/@alejandranavarro464,UCwfZIbgLOHYsNdWFfiMmfHg,True,none,0,2024-09-03T05:09:07Z,2024-09-03T05:09:07Z,True,0,True,
