channelId,videoId,commentId,textDisplay,textOriginal,authorDisplayName,authorProfileImageUrl,authorChannelUrl,authorChannelId,canRate,viewerRating,likeCount,publishedAt,updatedAt,canReply,totalReplyCount,isPublic,replies
UCeYSnd34IPe57sM8hkjWhrw,7Jo3NR5lgd8,Ugxa1_10v55bFlr2ZKt4AaABAg,"<a href=""https://www.youtube.com/watch?v=7Jo3NR5lgd8&amp;t=1650"">27:30</a><br>Chile le declara la guerra a Japón el 13 de abril de 1945 <br>Y las bombas fueron hasta agosto del mismo año <br>Aún no caían las bombas","27:30
Chile le declara la guerra a Japón el 13 de abril de 1945 
Y las bombas fueron hasta agosto del mismo año 
Aún no caían las bombas",@Kobe6365,https://yt3.ggpht.com/2bZBna4A2PpRGKfoLVGaat9-HPhyG0_CyxhD8mK011-4XYnJ4aIfUM7yPFvfsdpTeu6m4kYAXA=s48-c-k-c0x00ffffff-no-rj,http://www.youtube.com/@Kobe6365,UCauHokhlxQkD2biFxhRJlRg,True,none,0,2024-08-27T22:00:39Z,2024-08-27T22:00:39Z,True,0,True,{}
UCeYSnd34IPe57sM8hkjWhrw,7Jo3NR5lgd8,Ugwp4SdhfbElEtkcjFB4AaABAg,espero cuenten como una fuente de consulta valida para mi proyecto de la universidad 🤣🤣🤣😅,espero cuenten como una fuente de consulta valida para mi proyecto de la universidad 🤣🤣🤣😅,@AlexaV97,https://yt3.ggpht.com/ytc/AIdro_m9IENA3zqLKSO6l2Dl4aakVRop3yWmVrqs1HwLjhPL-9Bs=s48-c-k-c0x00ffffff-no-rj,http://www.youtube.com/@AlexaV97,UCtmZlJB6TXjyS7eYSzpVw-A,True,none,0,2024-08-08T22:27:42Z,2024-08-08T22:27:42Z,True,0,True,{}
UCeYSnd34IPe57sM8hkjWhrw,7Jo3NR5lgd8,UgyfXuVjjsWHYMxG2Mx4AaABAg,Ah perros 🤟,Ah perros 🤟,@adanflores8711,https://yt3.ggpht.com/ytc/AIdro_kToWTo9cfPIW0F1gnatUSdIPwNLaYbQJZbOoILPNY=s48-c-k-c0x00ffffff-no-rj,http://www.youtube.com/@adanflores8711,UC80uODVSVMjeJuBWgVHsm8w,True,none,0,2024-07-10T22:11:50Z,2024-07-10T22:11:50Z,True,0,True,{}
UCeYSnd34IPe57sM8hkjWhrw,7Jo3NR5lgd8,UgywpvNG7WL_fXspRBd4AaABAg,Yo todos los capítulos de usteds los escucho en Spotify por la tarde opor la noche para no gastar batería es la primera vez que los estoy viendo en Youtube y se ven bien simpáticos y ocurrentes 😅😅😅,Yo todos los capítulos de usteds los escucho en Spotify por la tarde opor la noche para no gastar batería es la primera vez que los estoy viendo en Youtube y se ven bien simpáticos y ocurrentes 😅😅😅,@HumbertoVegaBernardo,https://yt3.ggpht.com/UtRQ-ccHnLkieZUG3arB7Tp70iJ-vdOzDd0q7fg976vuiS_ZVjlpfBACsj6Zg7Le3bTq0bFTzA=s48-c-k-c0x00ffffff-no-rj,http://www.youtube.com/@HumbertoVegaBernardo,UCp-gggOVm2qqCTrTbED4ezA,True,none,1,2024-07-03T21:51:06Z,2024-07-03T21:54:20Z,True,0,True,{}
UCeYSnd34IPe57sM8hkjWhrw,7Jo3NR5lgd8,UgyJuUelNf6KtRUN6WB4AaABAg,"Considero que se debió platicar con poco más de profundidad la forma en que Israel ha tratado a los palestinos desde la creación del estado de Israel, eso explica mucha de la animadversión que existe entre ellos , y pues no es chisme que Israel haya creado Hamas para generar división dentro de la OLP , hay evidencia en torno a ello .","Considero que se debió platicar con poco más de profundidad la forma en que Israel ha tratado a los palestinos desde la creación del estado de Israel, eso explica mucha de la animadversión que existe entre ellos , y pues no es chisme que Israel haya creado Hamas para generar división dentro de la OLP , hay evidencia en torno a ello .",@rodrigoobaldia8913,https://yt3.ggpht.com/ytc/AIdro_kO7A3QM1MAJIpjHKh7CLPQlOVthr-TtG_oROlbg-Q=s48-c-k-c0x00ffffff-no-rj,http://www.youtube.com/@rodrigoobaldia8913,UC2P1upUhn9qIn7irO28Mq8w,True,none,0,2024-06-15T23:24:03Z,2024-06-15T23:24:03Z,True,0,True,{}
UCeYSnd34IPe57sM8hkjWhrw,7Jo3NR5lgd8,UgwUZ6OvB3Os8o3Ons14AaABAg,"Yo estoy firme en que no estoy de acuerdo con el gobierno sionista, que es genocida.","Yo estoy firme en que no estoy de acuerdo con el gobierno sionista, que es genocida.",@AndreyCasallas,https://yt3.ggpht.com/ytc/AIdro_nomQ_-qLnhl9rVoYM7P5kea1fJ7KJCGv2el7iDZxVV69o=s48-c-k-c0x00ffffff-no-rj,http://www.youtube.com/@AndreyCasallas,UCz83NcubGqwopXts8LQQXHg,True,none,0,2024-06-03T13:12:17Z,2024-06-03T13:12:17Z,True,0,True,{}
UCeYSnd34IPe57sM8hkjWhrw,7Jo3NR5lgd8,UgxjdaANMiNWAe788TJ4AaABAg,Free Palestine 🇵🇸,Free Palestine 🇵🇸,@RavenGreyLugosi,https://yt3.ggpht.com/dgzcws7Sc6UHSDO11rwccu8RlaPxBoj-VlJV7FHInOXU-vSgcdFnoL5PZwx9rV95mUXHPyt8=s48-c-k-c0x00ffffff-no-rj,http://www.youtube.com/@RavenGreyLugosi,UC2P4WX0L0ilyF3XuXC0dAlA,True,none,0,2024-04-27T03:27:52Z,2024-04-27T03:27:52Z,True,0,True,{}
UCeYSnd34IPe57sM8hkjWhrw,7Jo3NR5lgd8,UgxMjSSTKFMFV-4AwnR4AaABAg,Medio culebrón. Ya me perdí. Están todos locos allá,Medio culebrón. Ya me perdí. Están todos locos allá,@sergiolopez2882,https://yt3.ggpht.com/ytc/AIdro_lq6THB01VwTqgYqMsLHcJRcy9O6aHIhUIAgXVPqhhfZVQ=s48-c-k-c0x00ffffff-no-rj,http://www.youtube.com/@sergiolopez2882,UCtJHvWUinGlfrDgwlZ5exSQ,True,none,0,2024-04-08T19:27:32Z,2024-04-08T19:27:32Z,True,0,True,{}
UCeYSnd34IPe57sM8hkjWhrw,7Jo3NR5lgd8,Ugzhh6QpsPgX1hO2MM94AaABAg,auto determinacion de los pueblos y putin si claro ja,auto determinacion de los pueblos y putin si claro ja,@Taller01digital,https://yt3.ggpht.com/ytc/AIdro_nPDM-4L8XK5rjibJNEi60tQ5mzuiP2drJv-JuyNMeHkw=s48-c-k-c0x00ffffff-no-rj,http://www.youtube.com/@Taller01digital,UCDuzDNikY_fKtFw5kfmOwfA,True,none,0,2024-03-23T21:30:59Z,2024-03-23T21:30:59Z,True,0,True,{}
UCeYSnd34IPe57sM8hkjWhrw,7Jo3NR5lgd8,Ugx2jQm5xUdYnDnO5-h4AaABAg,Siento que chile es el país que se menciona para recordar un meme... Orgullosa de ser de chile jahajajaja😅,Siento que chile es el país que se menciona para recordar un meme... Orgullosa de ser de chile jahajajaja😅,@nathalyburgos9442,https://yt3.ggpht.com/ytc/AIdro_nEjd-7OhN0ux0vfJ439CZF1EvV-j4ZhIcmMhVefpnrZXU=s48-c-k-c0x00ffffff-no-rj,http://www.youtube.com/@nathalyburgos9442,UCZEDe9hYa-XGgCXd-UzyohA,True,none,3,2024-02-28T16:25:54Z,2024-02-28T16:26:07Z,True,0,True,{}
UCeYSnd34IPe57sM8hkjWhrw,7Jo3NR5lgd8,Ugz9KwVJDy2blAws-Vx4AaABAg,Mi comentario antes de ver el podcast: El ataque o &quot;defensa&quot; de Israel es desmedido y visceral. No lo apruebo para nada,"Mi comentario antes de ver el podcast: El ataque o ""defensa"" de Israel es desmedido y visceral. No lo apruebo para nada",@Diego45377,https://yt3.ggpht.com/ytc/AIdro_n5gXNcx00CNZMjikwuS7MgpqkOf5Dj8t43_NXBpwqck8Y=s48-c-k-c0x00ffffff-no-rj,http://www.youtube.com/@Diego45377,UCkPUuJ3O0mR8Tnus0W-sknA,True,none,0,2024-02-26T18:57:02Z,2024-02-26T18:57:02Z,True,0,True,{}
UCeYSnd34IPe57sM8hkjWhrw,7Jo3NR5lgd8,UgwsUJH-ZqgrtMk9kSF4AaABAg,Palestina libre 🇯🇴,Palestina libre 🇯🇴,@coochie_monster_,https://yt3.ggpht.com/QWUTPiWcmk-SzSvpLmQQGP6b2CzG1U4KWo8NOOdQA0lfQ9n8d-g6a2IUJdO5z-DChlLp43OB=s48-c-k-c0x00ffffff-no-rj,http://www.youtube.com/@coochie_monster_,UCcE0pl560SaUU3q-eHXRjHg,True,none,4,2024-02-17T19:34:40Z,2024-02-17T19:34:40Z,True,0,True,{}
UCeYSnd34IPe57sM8hkjWhrw,7Jo3NR5lgd8,UgxuwHsY1hD1LRqH5wV4AaABAg,🇯🇴 🫶🏻,🇯🇴 🫶🏻,@auxiliarmedicinadeltrabajo5179,https://yt3.ggpht.com/ytc/AIdro_nkg9HV0HqQUfTkJVr3O5cuRJ7q9rttxPGihAsVO8bOHw=s48-c-k-c0x00ffffff-no-rj,http://www.youtube.com/@auxiliarmedicinadeltrabajo5179,UC-ASV2CSWa5dInRTRjcHGVg,True,none,5,2024-02-16T00:31:49Z,2024-02-16T00:31:49Z,True,0,True,{}
UCeYSnd34IPe57sM8hkjWhrw,7Jo3NR5lgd8,UgyDi1hQcsxgts9lLfl4AaABAg,"Hola, yo los escucho en Amazon music, desde que tenían un audio bien feo 😅.<br>Que onda con la lámpara de Iker 🤣🤣🤣🤣🤣","Hola, yo los escucho en Amazon music, desde que tenían un audio bien feo 😅.
Que onda con la lámpara de Iker 🤣🤣🤣🤣🤣",@perisqm1340,https://yt3.ggpht.com/ytc/AIdro_nouQSP4Kb2XeZ6XqCDJPsC02OWBYKZdVLJQNYbRFNaCmL3=s48-c-k-c0x00ffffff-no-rj,http://www.youtube.com/@perisqm1340,UCrkpEiXYMvIWUS1YD2NBu8A,True,none,9,2024-02-13T19:00:17Z,2024-02-13T19:00:17Z,True,0,True,{}
UCeYSnd34IPe57sM8hkjWhrw,7Jo3NR5lgd8,Ugz0gP2BLSx0oqD5TDx4AaABAg,A mí sí me gustan las pasas😂!!!!!,A mí sí me gustan las pasas😂!!!!!,@yannomarzav2998,https://yt3.ggpht.com/ytc/AIdro_kEbkMqtXQbdDJsI9imgSrZWbhchUZoxUOd6IQ1XbteJYM=s48-c-k-c0x00ffffff-no-rj,http://www.youtube.com/@yannomarzav2998,UCXqMS9XDCHQBIEhdPQ_8n8g,True,none,3,2024-02-13T12:21:46Z,2024-02-13T12:21:46Z,True,0,True,{}
UCeYSnd34IPe57sM8hkjWhrw,7Jo3NR5lgd8,UgzF4R9j8g70S6f902d4AaABAg,El episodio más esperado por toda Latinoamérica unida,El episodio más esperado por toda Latinoamérica unida,@ProduccionesCERO,https://yt3.ggpht.com/ytc/AIdro_n8E3L03zG39xP70p5sFBd3xtB1_WCZQEy1PEANRCz4cg=s48-c-k-c0x00ffffff-no-rj,http://www.youtube.com/@ProduccionesCERO,UCEmgbPw-oeVKKSoRC1a8Tdg,True,none,3,2024-02-12T13:39:33Z,2024-02-12T13:39:33Z,True,0,True,{}
UCeYSnd34IPe57sM8hkjWhrw,7Jo3NR5lgd8,Ugzc-poBKkBxF6-jgU94AaABAg,"Los árabes no eran dueños de esa región, así que no chillen, los Turcos aceptaron su derrota y se retiraron.Palestina es un nombre dado por los ingleses en 1920 y no eran todos árabes, fueron contados como musulmanes. Ellos recibieron trasjordania e irán, que tampoco existía y cisjordania y Gaza de pilón. Cuál pobrecitos que poquito les dieron.","Los árabes no eran dueños de esa región, así que no chillen, los Turcos aceptaron su derrota y se retiraron.Palestina es un nombre dado por los ingleses en 1920 y no eran todos árabes, fueron contados como musulmanes. Ellos recibieron trasjordania e irán, que tampoco existía y cisjordania y Gaza de pilón. Cuál pobrecitos que poquito les dieron.",@adrianarana3250,https://yt3.ggpht.com/ytc/AIdro_k4LkePajK8kGBw1xU-45gRgIwE9F3tfaNBqzwlf5A=s48-c-k-c0x00ffffff-no-rj,http://www.youtube.com/@adrianarana3250,UCwHqbBJ9iMqehdSHfTl44UA,True,none,2,2024-02-09T23:57:46Z,2024-02-09T23:57:46Z,True,0,True,{}
UCeYSnd34IPe57sM8hkjWhrw,7Jo3NR5lgd8,Ugx7IV8ybQdxAcOGP_x4AaABAg,"Algo que me llama la atención es que en Palestina hay muchas ciudades con nombres Judíos y que históricamente tiene nombres Hebreos, (Belen, Hebron, etc...)  y que cuando se creo el estado Israelí, los habitantes eran mas de los que habitaban, pues la mayoria estaba en proceso de exiliarse de todo Europa y otros paises , ósea que ese es el problema, que es el único pais Judío, mientras árabes tienen muchos paises donde pueden reubicarse","Algo que me llama la atención es que en Palestina hay muchas ciudades con nombres Judíos y que históricamente tiene nombres Hebreos, (Belen, Hebron, etc...)  y que cuando se creo el estado Israelí, los habitantes eran mas de los que habitaban, pues la mayoria estaba en proceso de exiliarse de todo Europa y otros paises , ósea que ese es el problema, que es el único pais Judío, mientras árabes tienen muchos paises donde pueden reubicarse",@jpsandov,https://yt3.ggpht.com/ytc/AIdro_k8_7PK9TUeyjoh80riO0WGTsjl5ehHf9d_j9jrXEx9bHg=s48-c-k-c0x00ffffff-no-rj,http://www.youtube.com/@jpsandov,UC5X1oRyoukGic6frUDHy0vA,True,none,0,2024-02-08T20:29:05Z,2024-02-08T20:29:05Z,True,1,True,"{""comments"": [{""kind"": ""youtube#comment"", ""etag"": ""yrmWonWXUfxRQZToJu9_sws9fOQ"", ""id"": ""Ugx7IV8ybQdxAcOGP_x4AaABAg.A-ZuDD_VyrOA-breekGyIW"", ""snippet"": {""channelId"": ""UCeYSnd34IPe57sM8hkjWhrw"", ""videoId"": ""7Jo3NR5lgd8"", ""textDisplay"": ""Precisamente por que es y fue&#39; por m\u00e1s de 1500 a\u00f1os territorio de los jud\u00edos y su nombre era JUDEA. Podr\u00eda refutar casi todo lo dicho aqu\u00ed, pero que flojera."", ""textOriginal"": ""Precisamente por que es y fue' por m\u00e1s de 1500 a\u00f1os territorio de los jud\u00edos y su nombre era JUDEA. Podr\u00eda refutar casi todo lo dicho aqu\u00ed, pero que flojera."", ""parentId"": ""Ugx7IV8ybQdxAcOGP_x4AaABAg"", ""authorDisplayName"": ""@adrianarana3250"", ""authorProfileImageUrl"": ""https://yt3.ggpht.com/ytc/AIdro_k4LkePajK8kGBw1xU-45gRgIwE9F3tfaNBqzwlf5A=s48-c-k-c0x00ffffff-no-rj"", ""authorChannelUrl"": ""http://www.youtube.com/@adrianarana3250"", ""authorChannelId"": {""value"": ""UCwHqbBJ9iMqehdSHfTl44UA""}, ""canRate"": true, ""viewerRating"": ""none"", ""likeCount"": 0, ""publishedAt"": ""2024-02-10T00:04:29Z"", ""updatedAt"": ""2024-02-10T00:04:29Z""}}]}"
UCeYSnd34IPe57sM8hkjWhrw,7Jo3NR5lgd8,UgxVTIoByDQ_OwhETy54AaABAg,Seles olvida las mujeres violad@s por hamas fue halgo BRUTAL,Seles olvida las mujeres violad@s por hamas fue halgo BRUTAL,@juanguadalupemauricio755,https://yt3.ggpht.com/ytc/AIdro_k-MzDvwxnuj6z-kjvOikxxnpcpPdx-R7eZp8tEOxOxNwo=s48-c-k-c0x00ffffff-no-rj,http://www.youtube.com/@juanguadalupemauricio755,UCq3MX7j0aYxRiBst9MlfgyA,True,none,0,2024-02-08T06:03:28Z,2024-02-08T06:03:28Z,True,0,True,{}
UCeYSnd34IPe57sM8hkjWhrw,7Jo3NR5lgd8,Ugy9mwbfwWJ87aXhh6F4AaABAg,El 7 de octubre del 2023 no se olvidará VIVA ISRAEL AM ISRAEL JAI ❤️🇮🇱❤️❤️‍🔥❤️‍🔥❤️‍🔥,El 7 de octubre del 2023 no se olvidará VIVA ISRAEL AM ISRAEL JAI ❤️🇮🇱❤️❤️‍🔥❤️‍🔥❤️‍🔥,@juanguadalupemauricio755,https://yt3.ggpht.com/ytc/AIdro_k-MzDvwxnuj6z-kjvOikxxnpcpPdx-R7eZp8tEOxOxNwo=s48-c-k-c0x00ffffff-no-rj,http://www.youtube.com/@juanguadalupemauricio755,UCq3MX7j0aYxRiBst9MlfgyA,True,none,1,2024-02-08T05:28:02Z,2024-02-08T05:28:02Z,True,0,True,{}
