channelId,videoId,commentId,textDisplay,textOriginal,authorDisplayName,authorProfileImageUrl,authorChannelUrl,authorChannelId,canRate,viewerRating,likeCount,publishedAt,updatedAt,canReply,totalReplyCount,isPublic,replies
UCeYSnd34IPe57sM8hkjWhrw,Go2KlhN4cQk,Ugw0eV3HrDb7pLM2s_t4AaABAg,"Estaba escuchando este episodio y no se como se cambio a paralelos historicos y yo estaba confundida! Que tiene que ver la caida de los Mexicas con barba roja🤔😅<br>Bueno, estuvo chido el episodio🫡","Estaba escuchando este episodio y no se como se cambio a paralelos historicos y yo estaba confundida! Que tiene que ver la caida de los Mexicas con barba roja🤔😅
Bueno, estuvo chido el episodio🫡",@mohighcavs10,https://yt3.ggpht.com/ytc/AIdro_kwFdjuVBrsh_1_g07b2pe40SIuk2JVwamBUV0NOIk=s48-c-k-c0x00ffffff-no-rj,http://www.youtube.com/@mohighcavs10,UCpPbsjTqZO21FOA2k-SRK7Q,True,none,0,2024-09-24T15:30:30Z,2024-09-24T15:30:30Z,True,0,True,{}
UCeYSnd34IPe57sM8hkjWhrw,Go2KlhN4cQk,UgwuXlPiLqv-onm2k5J4AaABAg,Son el mejor podcast de historia🫡,Son el mejor podcast de historia🫡,@vocanegra131,https://yt3.ggpht.com/P-q8Dxj-l_KMKl_4-ZAXDmhGGjXQrOJpRvqrq1MrOINj53dJMP1ix9LP2obtm_H1CsxdeV5mGAY=s48-c-k-c0x00ffffff-no-rj,http://www.youtube.com/@vocanegra131,UCCbjt6kxJ54gqEWeXPpZJnA,True,none,0,2024-06-21T02:00:50Z,2024-06-21T02:00:50Z,True,0,True,{}
UCeYSnd34IPe57sM8hkjWhrw,Go2KlhN4cQk,Ugw5-g3Y_NhVuKCIBGZ4AaABAg,Ayuda para encontrar los libros porfa,Ayuda para encontrar los libros porfa,@SuoIgar,https://yt3.ggpht.com/ytc/AIdro_neAWLH7sZOed0nxggmhltv1elkeHlOQumeJrdVd-uJprIR_0tQYDxrh34wywukW1kbeQ=s48-c-k-c0x00ffffff-no-rj,http://www.youtube.com/@SuoIgar,UCb462lavBkasNXDxA4kOdUg,True,none,0,2024-06-11T00:18:11Z,2024-06-11T00:18:11Z,True,0,True,{}
UCeYSnd34IPe57sM8hkjWhrw,Go2KlhN4cQk,UgyfALTIo8eRJDJQpLN4AaABAg,Aaaaaay! Así me imaginaba al gordito jajajajajaj yeeeey!!!! El otro niño no tanto pero me encantó también jajajaja,Aaaaaay! Así me imaginaba al gordito jajajajajaj yeeeey!!!! El otro niño no tanto pero me encantó también jajajaja,@RicardoRomanov,https://yt3.ggpht.com/ytc/AIdro_kNn6ML5JlhLrSoExrtw_OWTxjwv-pPPh8GhTrE49w-bzrwzJrjG1FoMdgRo3BUt4v3Gw=s48-c-k-c0x00ffffff-no-rj,http://www.youtube.com/@RicardoRomanov,UC9oBU-cHhmzYMZNSt44z2DA,True,none,0,2024-04-25T04:54:02Z,2024-04-25T04:54:02Z,True,0,True,{}
UCeYSnd34IPe57sM8hkjWhrw,Go2KlhN4cQk,UgwVF_r-2VStx8kxpXp4AaABAg,Iker no se ve tan chistoso como se oye 😅,Iker no se ve tan chistoso como se oye 😅,@nosoy3041,https://yt3.ggpht.com/EFmkDANXNsjv7aeCqRsQ1RQXRBMagbyMpA3450NfgVGzMNLSTVav9ThcScVkO5_GtPC3xPD0JQ=s48-c-k-c0x00ffffff-no-rj,http://www.youtube.com/@nosoy3041,UCl2vBYtxTN0cXzj8jXZ8i1w,True,none,0,2024-04-02T13:06:37Z,2024-04-02T13:06:37Z,True,0,True,{}
UCeYSnd34IPe57sM8hkjWhrw,Go2KlhN4cQk,Ugxf3LFDcb6DqOrB0It4AaABAg,También vengo de Spoty,También vengo de Spoty,@nosoy3041,https://yt3.ggpht.com/EFmkDANXNsjv7aeCqRsQ1RQXRBMagbyMpA3450NfgVGzMNLSTVav9ThcScVkO5_GtPC3xPD0JQ=s48-c-k-c0x00ffffff-no-rj,http://www.youtube.com/@nosoy3041,UCl2vBYtxTN0cXzj8jXZ8i1w,True,none,0,2024-04-02T13:04:23Z,2024-04-02T13:04:23Z,True,0,True,{}
UCeYSnd34IPe57sM8hkjWhrw,Go2KlhN4cQk,Ugz2Xp1VCHcGYiZWC6J4AaABAg,"Por qué viene a ver el vídeo, por las patas de Iker jajajaj","Por qué viene a ver el vídeo, por las patas de Iker jajajaj",@samruiz1921,https://yt3.ggpht.com/ytc/AIdro_lOlRnb2QjLPNliNBr-RcAo_dHIVARFsRlhDyKcKiSbGEw4=s48-c-k-c0x00ffffff-no-rj,http://www.youtube.com/@samruiz1921,UCX6DUQqUCLYuWJPj9vFrLQw,True,none,0,2024-04-01T17:58:35Z,2024-04-01T17:58:35Z,True,0,True,{}
UCeYSnd34IPe57sM8hkjWhrw,Go2KlhN4cQk,UgxzbwdDrOSdxGAcGcV4AaABAg,Vine del podcast solo a ver las patas de Iker. <br><br>Los amo❤<br>Saludos tropicales desde Colombia,"Vine del podcast solo a ver las patas de Iker. 

Los amo❤
Saludos tropicales desde Colombia",@magdar.620,https://yt3.ggpht.com/ytc/AIdro_nwzG1BOG-9XxhiloWkMjzclGNvbFSEkDOGS_LwiAkgH-X7=s48-c-k-c0x00ffffff-no-rj,http://www.youtube.com/@magdar.620,UCDNGj---XY_TdEGcYmUMOSQ,True,none,6,2024-03-26T02:32:51Z,2024-03-26T02:32:51Z,True,0,True,{}
UCeYSnd34IPe57sM8hkjWhrw,Go2KlhN4cQk,Ugw4O-AjhmukaDoXUEF4AaABAg,barba negra termino de gobernador de haiti,barba negra termino de gobernador de haiti,@Taller01digital,https://yt3.ggpht.com/ytc/AIdro_nPDM-4L8XK5rjibJNEi60tQ5mzuiP2drJv-JuyNMeHkw=s48-c-k-c0x00ffffff-no-rj,http://www.youtube.com/@Taller01digital,UCDuzDNikY_fKtFw5kfmOwfA,True,none,0,2024-03-23T22:31:04Z,2024-03-23T22:31:04Z,True,0,True,{}
UCeYSnd34IPe57sM8hkjWhrw,Go2KlhN4cQk,UgxtWp8Y5iE5Pfov0CJ4AaABAg,Ya me oi todo en Spotify y me hicieron venirme a youtube solo para apoyarlos x aca tambien. Besitos weyes,Ya me oi todo en Spotify y me hicieron venirme a youtube solo para apoyarlos x aca tambien. Besitos weyes,@JorgeLopezGonzalez-ky6vn,https://yt3.ggpht.com/1JuUq0mPXnxXa_MOEvDzgwJHS6246_HYRATzRTOantqX5iPALFMkKG03o7b_Ktg9kyocgllVvw=s48-c-k-c0x00ffffff-no-rj,http://www.youtube.com/@JorgeLopezGonzalez-ky6vn,UCoyb6f9YP-Bq6Z54ko4VFBw,True,none,10,2024-03-22T18:59:11Z,2024-03-22T18:59:11Z,True,0,True,{}
UCeYSnd34IPe57sM8hkjWhrw,Go2KlhN4cQk,UgzWl7WaVMkffimUFQt4AaABAg,Soy enculado del Teca,Soy enculado del Teca,@robertoalejo3350,https://yt3.ggpht.com/ytc/AIdro_mLcOUuMsOj0Gg6DU6chGr8aS93OFM4SIAHYYIDuH5YKsea=s48-c-k-c0x00ffffff-no-rj,http://www.youtube.com/@robertoalejo3350,UCLdoIMxFGN-TsdCjKga9Wug,True,none,0,2024-03-22T04:51:17Z,2024-03-22T04:51:17Z,True,0,True,{}
UCeYSnd34IPe57sM8hkjWhrw,Go2KlhN4cQk,UgwqqOv2Dd8Nx6e_ufp4AaABAg,"Cubana aquí 😂 gracias por la mención! Pero no gracias, no apoyen lo que está pasando en mi país. 😅 Ni de broma.","Cubana aquí 😂 gracias por la mención! Pero no gracias, no apoyen lo que está pasando en mi país. 😅 Ni de broma.",@bettycordovi7514,https://yt3.ggpht.com/ytc/AIdro_l3OitQUywJ0lvSzDU_88XQZ9I3WblZIoK_peVvaLw-MXY=s48-c-k-c0x00ffffff-no-rj,http://www.youtube.com/@bettycordovi7514,UCXlWajpvjLfRR_LNYuds_kw,True,none,4,2024-03-21T23:35:02Z,2024-03-21T23:35:02Z,True,0,True,{}
UCeYSnd34IPe57sM8hkjWhrw,Go2KlhN4cQk,UgwBYfsc4H_r3rMbXO94AaABAg,"Estaba atrasado desde octubre, en 2 semanas ya estoy al día porque me mama el chisme. Por cierto, dónde está la historia de la animación japonesa? No es que sea Otaku, es para un amigo, salu2","Estaba atrasado desde octubre, en 2 semanas ya estoy al día porque me mama el chisme. Por cierto, dónde está la historia de la animación japonesa? No es que sea Otaku, es para un amigo, salu2",@ignaciogomez2201,https://yt3.ggpht.com/ytc/AIdro_lOwVUPHxqmmgJhsIkZ7uWrlNR5Cg-FjJoX3TsvGgWjewM=s48-c-k-c0x00ffffff-no-rj,http://www.youtube.com/@ignaciogomez2201,UCCBOMg8EQdhMrCqmKyEGP4w,True,none,0,2024-03-21T22:49:36Z,2024-03-21T22:49:36Z,True,0,True,{}
UCeYSnd34IPe57sM8hkjWhrw,Go2KlhN4cQk,UgwTBb75mPWb0UibqoV4AaABAg,Pensé en el age of empires cuando ví el título,Pensé en el age of empires cuando ví el título,@Anna.torres,https://yt3.ggpht.com/irvkQAfUt4QbQTb6GPujW4blr1WLT46sG5SJNChrwd0EK7ddk9cv-T9NvIGgQ1oKdxRoNnD53w=s48-c-k-c0x00ffffff-no-rj,http://www.youtube.com/@Anna.torres,UC95iEkbb0psecAmrmDjTbzw,True,none,0,2024-03-21T18:04:54Z,2024-03-21T18:04:54Z,True,0,True,{}
UCeYSnd34IPe57sM8hkjWhrw,Go2KlhN4cQk,UgwfgHLpt9bv_wjPJ4d4AaABAg,Que manera más chingona de enseñar historia son los mejores cabrones ❤🎉,Que manera más chingona de enseñar historia son los mejores cabrones ❤🎉,@cancionesinfantiles9699,https://yt3.ggpht.com/ytc/AIdro_ldQNCJoqb2ACiWS5tI0fa5OHsUN-DbrYZMr0kII7wBc0yO3d9TcCxQjkS5SREDdYZ3kA=s48-c-k-c0x00ffffff-no-rj,http://www.youtube.com/@cancionesinfantiles9699,UC-rUhbxjkRmPCWluDkh6qDg,True,none,0,2024-03-21T17:39:29Z,2024-03-21T17:39:29Z,True,0,True,{}
UCeYSnd34IPe57sM8hkjWhrw,Go2KlhN4cQk,UgwI9sYWRsbUOUpGzFp4AaABAg,"<a href=""https://www.youtube.com/watch?v=Go2KlhN4cQk&amp;t=1908"">31:48</a> el fedelobo se mete en el capitulo",31:48 el fedelobo se mete en el capitulo,@eliasemmanuelcruzdircio9086,https://yt3.ggpht.com/ytc/AIdro_m13PcfifRvzFlQNPGMrze2sBIuauUxukZJP3ncod0=s48-c-k-c0x00ffffff-no-rj,http://www.youtube.com/@eliasemmanuelcruzdircio9086,UCvzKdsSyZKrKMFa6YZSEQDA,True,none,1,2024-03-21T15:55:31Z,2024-03-21T15:55:31Z,True,0,True,{}
UCeYSnd34IPe57sM8hkjWhrw,Go2KlhN4cQk,Ugw5UXNi1zDz9gPVygB4AaABAg,Pues eran de 15 metros y podían llevar 250 a 300 hombres de los cuales 150 podían ser remeros,Pues eran de 15 metros y podían llevar 250 a 300 hombres de los cuales 150 podían ser remeros,@YairTerrazasBalderas,https://yt3.ggpht.com/ytc/AIdro_kXPpC91hWBfq9kR4J1VteYD5pZC7CaWzeH_gaYjVNe4rdWPt3VI-qtFVO3abjvzqNChQ=s48-c-k-c0x00ffffff-no-rj,http://www.youtube.com/@YairTerrazasBalderas,UCouNAWDwnhj2R1BFxpXZqSw,True,none,0,2024-03-21T08:03:52Z,2024-03-21T08:03:52Z,True,0,True,{}
UCeYSnd34IPe57sM8hkjWhrw,Go2KlhN4cQk,UgwYkISwnbfgt1eNJnR4AaABAg,Que sexy se ve el Teca❤😊 Interesante podcast saludos 😅,Que sexy se ve el Teca❤😊 Interesante podcast saludos 😅,@REGINACOAHUIAS,https://yt3.ggpht.com/pshinThRyDNaWeKnJNYI9lklzqlhcQ6K8tdp4Q-LR9Rj1AcXfEfbu1kT7NZfbuUJm29yg55d=s48-c-k-c0x00ffffff-no-rj,http://www.youtube.com/@REGINACOAHUIAS,UCIzRgG5naNp_c8Tp8OGkezQ,True,none,0,2024-03-21T07:36:38Z,2024-03-21T07:36:38Z,True,0,True,{}
UCeYSnd34IPe57sM8hkjWhrw,Go2KlhN4cQk,UgweN1Si59RdVOgXQMV4AaABAg,Yo uso brave y es muy bueno porque me permite reproducir yutu incluso con el celular bloqueado. Saludos desde Honduras.,Yo uso brave y es muy bueno porque me permite reproducir yutu incluso con el celular bloqueado. Saludos desde Honduras.,@wickermanhn,https://yt3.ggpht.com/ytc/AIdro_nHMDpbrCbjjawpdaRtvuDcF-LOBckwYXbkt--oithv9A=s48-c-k-c0x00ffffff-no-rj,http://www.youtube.com/@wickermanhn,UC9iAPdeLhPC5S_9O0CQu-LA,True,none,0,2024-03-21T05:52:48Z,2024-03-21T05:52:48Z,True,0,True,{}
UCeYSnd34IPe57sM8hkjWhrw,Go2KlhN4cQk,UgyoxxVodHvRQ0m55oR4AaABAg,yo sé que no son historiadores pero el podcast me dió ganas de serlo jajaja,yo sé que no son historiadores pero el podcast me dió ganas de serlo jajaja,@andreavega7884,https://yt3.ggpht.com/ytc/AIdro_l9eciOgjvl_QYBVYEjLN8uwdto_0rIvV3oa4wRWzyKlCLU=s48-c-k-c0x00ffffff-no-rj,http://www.youtube.com/@andreavega7884,UC4el1tPFgleYjIRKb4rrScA,True,none,2,2024-03-21T05:34:19Z,2024-03-21T05:34:19Z,True,0,True,{}
