youtube#commentThread,gIDyVMHA5W6sMnOMIzQ11aPL4oM,Ugx0ACbT8WvS0wNhH8V4AaABAg,UCeYSnd34IPe57sM8hkjWhrw,t3MogAmkMUg,youtube#comment,0z0pimkHNXXRa-VR4Mk-_aEJ_FU,Ugx0ACbT8WvS0wNhH8V4AaABAg,UCeYSnd34IPe57sM8hkjWhrw,t3MogAmkMUg,"Awebooo historia y ciencia, de las dos cosas más favoritas de los nerds","Awebooo historia y ciencia, de las dos cosas más favoritas de los nerds",@Katyrosales6800,https://yt3.ggpht.com/ytc/AIdro_l16U345KzB94emL_QM5e_0nkiOSm3Czpbnzzyk0vaEJEM=s48-c-k-c0x00ffffff-no-rj,http://www.youtube.com/@Katyrosales6800,UCn0X6dHbLHclPijeMMN4vEg,True,none,0.0,2024-08-20T08:42:35Z,2024-08-20T08:42:35Z,True,0.0,True,,,,,,,,,,,,,
youtube#commentThread,J5rQEJvzg3KnS3ONO-N5ZJ67Q4A,UgyeIO0RPfPtIBkwX494AaABAg,UCeYSnd34IPe57sM8hkjWhrw,t3MogAmkMUg,youtube#comment,le1C6IbrCrqS_v9uk1JX7hTUMRw,UgyeIO0RPfPtIBkwX494AaABAg,UCeYSnd34IPe57sM8hkjWhrw,t3MogAmkMUg,"no quiero ser mamador, pero Teca la eneida la pidió Augusto César el primer emperador. Y si, es el fanfic más sobrevalorado de la historia y el cuento más largo para justificar que estas destinado por cuestiones divinas de estar gobernando un imperio. Lo que hace el dinero","no quiero ser mamador, pero Teca la eneida la pidió Augusto César el primer emperador. Y si, es el fanfic más sobrevalorado de la historia y el cuento más largo para justificar que estas destinado por cuestiones divinas de estar gobernando un imperio. Lo que hace el dinero",@Asenjoxwave,https://yt3.ggpht.com/ytc/AIdro_m_kcXENewzE5pEaFVD_e8wmLSJyQej9bTSM_jiIFo=s48-c-k-c0x00ffffff-no-rj,http://www.youtube.com/@Asenjoxwave,UCqGWMjeFHKGDBB4fDx9uMHA,True,none,0.0,2024-08-20T04:38:04Z,2024-08-20T04:38:04Z,True,0.0,True,,,,,,,,,,,,,
youtube#commentThread,qWmz4mKYphM22WTr4BdYs2euLwc,UgwKaHx2-RXhvDanIxJ4AaABAg,UCeYSnd34IPe57sM8hkjWhrw,t3MogAmkMUg,youtube#comment,c8JQSWPp8aXCImxVVJB49a3rUI4,UgwKaHx2-RXhvDanIxJ4AaABAg,UCeYSnd34IPe57sM8hkjWhrw,t3MogAmkMUg,Tengo una pregunta ¿porque se piensa que las civilizaciones antiguas eran menos inteligentes de lo que somos actualmente si somos iguales en términos evolutivos no hemos cambiado nada desde la edad de bronce? <br><br>Pd:Para cuando la guerra México vs Usa saludos para el cara con mapa.,"Tengo una pregunta ¿porque se piensa que las civilizaciones antiguas eran menos inteligentes de lo que somos actualmente si somos iguales en términos evolutivos no hemos cambiado nada desde la edad de bronce? 

Pd:Para cuando la guerra México vs Usa saludos para el cara con mapa.",@Lotus4kHd,https://yt3.ggpht.com/ytc/AIdro_k4aCF8bLyrhlFnafsDgsyFgC0Uc6yhFOEHK1no9EcuKw=s48-c-k-c0x00ffffff-no-rj,http://www.youtube.com/@Lotus4kHd,UCtbYI7EAx1d9Mw8eJpEAy6g,True,none,1.0,2024-08-20T02:57:57Z,2024-08-20T02:57:57Z,True,0.0,True,,,,,,,,,,,,,
youtube#commentThread,_opldglS0OUZWpfa-z6b044XJGg,Ugw0FUT85uKQdw3C4-h4AaABAg,UCeYSnd34IPe57sM8hkjWhrw,t3MogAmkMUg,youtube#comment,R_hr1Xxv9BnegTUOIdaBFzptpSM,Ugw0FUT85uKQdw3C4-h4AaABAg,UCeYSnd34IPe57sM8hkjWhrw,t3MogAmkMUg,Un episodio sobre los viajes espaciales. ❤😂😅,Un episodio sobre los viajes espaciales. ❤😂😅,@jorgetito3,https://yt3.ggpht.com/ytc/AIdro_mYIW3lM07cB5FWf4UuB-Egc8uiprCP6uQUb3ZUnFo=s48-c-k-c0x00ffffff-no-rj,http://www.youtube.com/@jorgetito3,UCII2fqrLiQXe1nIqpnNK7WQ,True,none,0.0,2024-08-20T01:10:31Z,2024-08-20T01:10:31Z,True,0.0,True,,,,,,,,,,,,,
youtube#commentThread,ZlBbMXu9y5hPfbqsgvd9V2D4oAE,Ugwk5U_FE-8Ih18sRqt4AaABAg,UCeYSnd34IPe57sM8hkjWhrw,t3MogAmkMUg,youtube#comment,cvTJTgKoz9FyTepVwbEVcfXLHC4,Ugwk5U_FE-8Ih18sRqt4AaABAg,UCeYSnd34IPe57sM8hkjWhrw,t3MogAmkMUg,"Con el fuego griego aunque imagino en la cabeza de Teca está muy claro no creo que se haya explicado completamente; no era solo el hecho que estando en agua no se apagara sino que tratar de apagarlo solo lo avivaba. El petróleo y agua tienen distintas densidades así que el porqué cuando hay fuegos en plataformas y el petróleo continúa ardiendo en el agua, es bastante claro. Si bien es cierto que hoy día los historiadores están de acuerdo en que el fuego griego se formaba con petróleo y resinas, a razón de este podcast sobre metales yo hare mi propia teoría acerca del uso de magnesio. El magnesio en forma pura (polvo por ejemplo) es altamente flamable y reacciona con volatilidad al agua, de esta manera el agua no apaga un incendio de magnesio y por el contrario lo hace mayor, como muestra el Ferrari F1 de Nikki Lauda en el accidente que casi muere calcinado e incluso los extinguidores de la epoca no lograban apagar las llamas.","Con el fuego griego aunque imagino en la cabeza de Teca está muy claro no creo que se haya explicado completamente; no era solo el hecho que estando en agua no se apagara sino que tratar de apagarlo solo lo avivaba. El petróleo y agua tienen distintas densidades así que el porqué cuando hay fuegos en plataformas y el petróleo continúa ardiendo en el agua, es bastante claro. Si bien es cierto que hoy día los historiadores están de acuerdo en que el fuego griego se formaba con petróleo y resinas, a razón de este podcast sobre metales yo hare mi propia teoría acerca del uso de magnesio. El magnesio en forma pura (polvo por ejemplo) es altamente flamable y reacciona con volatilidad al agua, de esta manera el agua no apaga un incendio de magnesio y por el contrario lo hace mayor, como muestra el Ferrari F1 de Nikki Lauda en el accidente que casi muere calcinado e incluso los extinguidores de la epoca no lograban apagar las llamas.",@karlaboullosa9502,https://yt3.ggpht.com/ytc/AIdro_mF9atAFMdv5Owu0UEGTazEVO136LV8yutJNrSiZaE=s48-c-k-c0x00ffffff-no-rj,http://www.youtube.com/@karlaboullosa9502,UCYYj1Vol3yauV_wC6ecgbEw,True,none,0.0,2024-08-19T22:55:39Z,2024-08-19T22:55:39Z,True,0.0,True,,,,,,,,,,,,,
youtube#commentThread,rLx3vjIPFBWnctHLuCVpDWJbo_Y,UgwfefCe7SBJOqkPJPl4AaABAg,UCeYSnd34IPe57sM8hkjWhrw,t3MogAmkMUg,youtube#comment,b8QwPAeq3OhOyrO3_ISWrFcGFAo,UgwfefCe7SBJOqkPJPl4AaABAg,UCeYSnd34IPe57sM8hkjWhrw,t3MogAmkMUg,"Yo sigo en espera que inviten a la mamá de Teca, 😊","Yo sigo en espera que inviten a la mamá de Teca, 😊",@claravillanueva5568,https://yt3.ggpht.com/ytc/AIdro_lBCzlFx809SijWkhhq9p_ejL4C8XU_E09cFJAjI0E=s48-c-k-c0x00ffffff-no-rj,http://www.youtube.com/@claravillanueva5568,UCC0Rgws4Krd9AVFH5ElNgXg,True,none,22.0,2024-08-19T20:49:20Z,2024-08-19T20:49:20Z,True,2.0,True,"[{'kind': 'youtube#comment', 'etag': '8dw98axroLiBkJaPz86NhbCFINA', 'id': 'UgwfefCe7SBJOqkPJPl4AaABAg.A7KtxQ3N9PNA7LKlAHyZhP', 'snippet': {'channelId': 'UCeYSnd34IPe57sM8hkjWhrw', 'videoId': 't3MogAmkMUg', 'textDisplay': 'Sería épico.<br>Pero serían Teca y Iker, se tendrían que portar bien.', 'textOriginal': 'Sería épico.\nPero serían Teca y Iker, se tendrían que portar bien.', 'parentId': 'UgwfefCe7SBJOqkPJPl4AaABAg', 'authorDisplayName': '@mbre2209', 'authorProfileImageUrl': 'https://yt3.ggpht.com/ytc/AIdro_mP653-UIbeli1KcC_sVYiGZwgSE4OeTMBsqYIEWLWa76I=s48-c-k-c0x00ffffff-no-rj', 'authorChannelUrl': 'http://www.youtube.com/@mbre2209', 'authorChannelId': {'value': 'UCfIw_Z7stj4FAM_5kx7KBdw'}, 'canRate': True, 'viewerRating': 'none', 'likeCount': 0, 'publishedAt': '2024-08-20T00:52:20Z', 'updatedAt': '2024-08-20T00:52:20Z'}}, {'kind': 'youtube#comment', 'etag': 'Muvk9KxuyomK_ItnQvwAQSLlyK4', 'id': 'UgwfefCe7SBJOqkPJPl4AaABAg.A7KtxQ3N9PNA7LbZjsEB-D', 'snippet': {'channelId': 'UCeYSnd34IPe57sM8hkjWhrw', 'videoId': 't3MogAmkMUg', 'textDisplay': 'Síiii, que inviten a la suegraaa', 'textOriginal': 'Síiii, que inviten a la suegraaa', 'parentId': 'UgwfefCe7SBJOqkPJPl4AaABAg', 'authorDisplayName': '@LadySkywalkerW', 'authorProfileImageUrl': 'https://yt3.ggpht.com/ytc/AIdro_lwbDah96CnBihX4Y-e36Gm0TnYnOORwUSk-Wx4KTUTgw=s48-c-k-c0x00ffffff-no-rj', 'authorChannelUrl': 'http://www.youtube.com/@LadySkywalkerW', 'authorChannelId': {'value': 'UCC-kANsNvPcG9ut34SPngeg'}, 'canRate': True, 'viewerRating': 'none', 'likeCount': 2, 'publishedAt': '2024-08-20T03:27:55Z', 'updatedAt': '2024-08-20T03:27:55Z'}}]",,,,,,,,,,,,
youtube#commentThread,1SaAiBpMGmQh6Zwyf9ZDz_xwGSE,Ugynq_4zrGGttu_Tvih4AaABAg,UCeYSnd34IPe57sM8hkjWhrw,t3MogAmkMUg,youtube#comment,K4xd4DxZnbzwrGzvGvmZOZKJM8M,Ugynq_4zrGGttu_Tvih4AaABAg,UCeYSnd34IPe57sM8hkjWhrw,t3MogAmkMUg,"<a href=""https://www.youtube.com/watch?v=t3MogAmkMUg&amp;t=1858"">30:58</a> ese horno estaba ubicado en las maderas de las montañas para cuando la época del monson que dura 6 meses y con vientos de hasta 180km/h le dieran directo a la cueva de la montaña los vientos le dieran al horno y subiera la temperatura y con los metales se fundieran más con ese viento más constante.",30:58 ese horno estaba ubicado en las maderas de las montañas para cuando la época del monson que dura 6 meses y con vientos de hasta 180km/h le dieran directo a la cueva de la montaña los vientos le dieran al horno y subiera la temperatura y con los metales se fundieran más con ese viento más constante.,@s4maeldeath,https://yt3.ggpht.com/ytc/AIdro_nK3QByTqVPUoB7DIXadX5doFph_in0ycNQXKivo-aIZw=s48-c-k-c0x00ffffff-no-rj,http://www.youtube.com/@s4maeldeath,UCBXy6Ywa9vI-kXGb9qm0PrA,True,none,0.0,2024-08-19T20:36:57Z,2024-08-19T20:36:57Z,True,0.0,True,,,,,,,,,,,,,
youtube#commentThread,d0qh8vB8Y3A2458EYsvqndzXRcA,UgwbIguhEGgFQwquu8x4AaABAg,UCeYSnd34IPe57sM8hkjWhrw,t3MogAmkMUg,youtube#comment,kCq73p3geicZr5aZO_vOf37FEPc,UgwbIguhEGgFQwquu8x4AaABAg,UCeYSnd34IPe57sM8hkjWhrw,t3MogAmkMUg,"<a href=""https://www.youtube.com/watch?v=t3MogAmkMUg&amp;t=1802"">30:02</a> se les pasó hablar de los africanos, ellos se pasaron el bronce por el forro y fueron directo al hierro y acero cuando los hititas y griegos apenas estaban en el bronce. Chirikure, S. (2015). Metals in past societies: A global perspective on Indigenous African metallurgy. Springer. Herbjornsrud, D. 2019. The African Enlightenment <a href=""https://www.youtube.com/watch?v=t3MogAmkMUg&amp;t=1802"">30:02</a>","30:02 se les pasó hablar de los africanos, ellos se pasaron el bronce por el forro y fueron directo al hierro y acero cuando los hititas y griegos apenas estaban en el bronce. Chirikure, S. (2015). Metals in past societies: A global perspective on Indigenous African metallurgy. Springer. Herbjornsrud, D. 2019. The African Enlightenment 30:02",@s4maeldeath,https://yt3.ggpht.com/ytc/AIdro_nK3QByTqVPUoB7DIXadX5doFph_in0ycNQXKivo-aIZw=s48-c-k-c0x00ffffff-no-rj,http://www.youtube.com/@s4maeldeath,UCBXy6Ywa9vI-kXGb9qm0PrA,True,none,2.0,2024-08-19T20:30:45Z,2024-08-19T20:30:45Z,True,0.0,True,,,,,,,,,,,,,
youtube#commentThread,17HmO9jID8gWFoFeaCimtD3aMns,Ugwti3CVtv_bmIURYB94AaABAg,UCeYSnd34IPe57sM8hkjWhrw,t3MogAmkMUg,youtube#comment,3pJG_BIIQ-d1w20uJJJSCFx6Mb4,Ugwti3CVtv_bmIURYB94AaABAg,UCeYSnd34IPe57sM8hkjWhrw,t3MogAmkMUg,"<a href=""https://www.youtube.com/watch?v=t3MogAmkMUg&amp;t=2528"">42:08</a> el Iker buscando la fecha del Acero Damasco parece hacker o villano de película de los 80&#39;s",42:08 el Iker buscando la fecha del Acero Damasco parece hacker o villano de película de los 80's,@medinamartinezdavid8052,https://yt3.ggpht.com/-qZlbIVr6TicQjMHl6IrrvJIoUstt9h8iK_rOlDEgexpue7JQ9GwPoNFXwNG4LvrO1ZlFPj3dw=s48-c-k-c0x00ffffff-no-rj,http://www.youtube.com/@medinamartinezdavid8052,UCbTyK6oHehb5LiFiA_DUfQQ,True,none,6.0,2024-08-19T20:10:46Z,2024-08-19T20:11:12Z,True,0.0,True,,,,,,,,,,,,,
youtube#commentThread,bhK3sfX7SEr03ogZ9Y2m3JMDXuI,UgyUPf0ERcGIFOCTJQF4AaABAg,UCeYSnd34IPe57sM8hkjWhrw,t3MogAmkMUg,youtube#comment,apzvy6N4zDxGGpFqHQz42rgbGqc,UgyUPf0ERcGIFOCTJQF4AaABAg,UCeYSnd34IPe57sM8hkjWhrw,t3MogAmkMUg,Mi hombre de metal 🫶🏽🫶🏽🫶🏽,Mi hombre de metal 🫶🏽🫶🏽🫶🏽,@TwiSagaSan,https://yt3.ggpht.com/ytc/AIdro_nTB8vH9HR1ayp7VVSuRCN8MfjolgP_2nostXbsrnoBXvA=s48-c-k-c0x00ffffff-no-rj,http://www.youtube.com/@TwiSagaSan,UCf5_yUUnLP03e9n0NzzFRpA,True,none,4.0,2024-08-19T19:58:58Z,2024-08-19T19:58:58Z,True,0.0,True,,,,,,,,,,,,,
youtube#commentThread,8wSxk2QdKgz2v0AUy3EsWvUOxSU,Ugyuq-tSoKFj7HEnAQ54AaABAg,UCeYSnd34IPe57sM8hkjWhrw,t3MogAmkMUg,youtube#comment,G_pL0x_Nmvi7C0kj8fHi_IWkcCA,Ugyuq-tSoKFj7HEnAQ54AaABAg,UCeYSnd34IPe57sM8hkjWhrw,t3MogAmkMUg,"Justo a tiempo para hacerme pndja en el trabajo, algo bien el invitado","Justo a tiempo para hacerme pndja en el trabajo, algo bien el invitado",@estefaniasandoval9999,https://yt3.ggpht.com/ytc/AIdro_mMaSKwPUvmnRHuqhbnWyZnpgxdXM86oFXd_i0F7qaW0wlz=s48-c-k-c0x00ffffff-no-rj,http://www.youtube.com/@estefaniasandoval9999,UCEDVPkLmXatD3pPEmukHDmw,True,none,0.0,2024-08-19T19:46:46Z,2024-08-19T19:46:46Z,True,0.0,True,,,,,,,,,,,,,
youtube#commentThread,X4xqkZX0x2OmHUMWh4fe2ck4iGA,Ugy2h_vD89gf_8eeFph4AaABAg,UCeYSnd34IPe57sM8hkjWhrw,t3MogAmkMUg,youtube#comment,fWBX1bGUjpM7nRaQcNKN1P7BpFQ,Ugy2h_vD89gf_8eeFph4AaABAg,UCeYSnd34IPe57sM8hkjWhrw,t3MogAmkMUg,"Ya que son Otakus declarados, les recomiendo el anime Dr Stone.<br>Es un anime donde enseñan como hacer procesos desde cero y está bien v3rg4s.<br>Y en un capítulo, hacen hierro.","Ya que son Otakus declarados, les recomiendo el anime Dr Stone.
Es un anime donde enseñan como hacer procesos desde cero y está bien v3rg4s.
Y en un capítulo, hacen hierro.",@medinamartinezdavid8052,https://yt3.ggpht.com/-qZlbIVr6TicQjMHl6IrrvJIoUstt9h8iK_rOlDEgexpue7JQ9GwPoNFXwNG4LvrO1ZlFPj3dw=s48-c-k-c0x00ffffff-no-rj,http://www.youtube.com/@medinamartinezdavid8052,UCbTyK6oHehb5LiFiA_DUfQQ,True,none,0.0,2024-08-19T19:33:41Z,2024-08-19T19:33:41Z,True,0.0,True,,,,,,,,,,,,,
youtube#commentThread,btoZQh1KTx4_A0e8kLI3d4BAUmg,Ugx7vBivUc-z-n8H76t4AaABAg,UCeYSnd34IPe57sM8hkjWhrw,t3MogAmkMUg,youtube#comment,CcywvY3FEol-BcpzJpjundijK6k,Ugx7vBivUc-z-n8H76t4AaABAg,UCeYSnd34IPe57sM8hkjWhrw,t3MogAmkMUg,"Pero dejen hablar al invitado, chavos banda!! :D","Pero dejen hablar al invitado, chavos banda!! :D",@hoffnerbass,https://yt3.ggpht.com/ytc/AIdro_mr4HFF0yTVivOWcg8hiSdSV7y7kuQK8QZ67K7tQwk=s48-c-k-c0x00ffffff-no-rj,http://www.youtube.com/@hoffnerbass,UCzyaecofs2BCd6bI1BqqBWA,True,none,1.0,2024-08-19T19:33:18Z,2024-08-19T19:33:18Z,True,0.0,True,,,,,,,,,,,,,
youtube#commentThread,Xf-HPCYvwS0mb7JyqR4t_eoHZx4,Ugzvu7xFsIUo8ibNXPJ4AaABAg,UCeYSnd34IPe57sM8hkjWhrw,t3MogAmkMUg,youtube#comment,FLjbXmI4uIIbM1ZQNW-hMSKWARM,Ugzvu7xFsIUo8ibNXPJ4AaABAg,UCeYSnd34IPe57sM8hkjWhrw,t3MogAmkMUg,El primer metal no sería el Na cuando el humano utilizó la sal 😏,El primer metal no sería el Na cuando el humano utilizó la sal 😏,@LuisAndresOtalvaroSanchez,https://yt3.ggpht.com/ytc/AIdro_m0TWGDJ1pPXYKd1OWZSHyNjjQEhHTuPiVpVP_rKDXXx93mplIIvtbIMrbtzIhsrc4YVA=s48-c-k-c0x00ffffff-no-rj,http://www.youtube.com/@LuisAndresOtalvaroSanchez,UCxu2psJcT48v7iCtU-YS3KA,True,none,0.0,2024-08-19T19:13:00Z,2024-08-19T19:13:00Z,True,0.0,True,,,,,,,,,,,,,
youtube#commentThread,OBq15WOOkVZGkZnpWOHgG9R_IwA,Ugx6mGMWrp3CU7o7Lwd4AaABAg,UCeYSnd34IPe57sM8hkjWhrw,t3MogAmkMUg,youtube#comment,yv8yKkXG4JYnco8VDd5FE9AWIto,Ugx6mGMWrp3CU7o7Lwd4AaABAg,UCeYSnd34IPe57sM8hkjWhrw,t3MogAmkMUg,A tiempo para mi novela favorita 👌🏽,A tiempo para mi novela favorita 👌🏽,@hugogomez2232,https://yt3.ggpht.com/ytc/AIdro_lGMpmNQmszVAGUnvBVWWHfeGD0yDBt1ozMsKtykHw74yn2=s48-c-k-c0x00ffffff-no-rj,http://www.youtube.com/@hugogomez2232,UCRKEMLsie7vd42rN8EjxNTw,True,none,0.0,2024-08-19T18:55:54Z,2024-08-19T18:55:54Z,True,0.0,True,,,,,,,,,,,,,
youtube#comment,8dw98axroLiBkJaPz86NhbCFINA,UgwfefCe7SBJOqkPJPl4AaABAg.A7KtxQ3N9PNA7LKlAHyZhP,UCeYSnd34IPe57sM8hkjWhrw,t3MogAmkMUg,,,,,,,,,,,,,,,,,,,,,"Sería épico.<br>Pero serían Teca y Iker, se tendrían que portar bien.","Sería épico.
Pero serían Teca y Iker, se tendrían que portar bien.",UgwfefCe7SBJOqkPJPl4AaABAg,@mbre2209,https://yt3.ggpht.com/ytc/AIdro_mP653-UIbeli1KcC_sVYiGZwgSE4OeTMBsqYIEWLWa76I=s48-c-k-c0x00ffffff-no-rj,http://www.youtube.com/@mbre2209,UCfIw_Z7stj4FAM_5kx7KBdw,True,none,0.0,2024-08-20T00:52:20Z,2024-08-20T00:52:20Z
youtube#comment,Muvk9KxuyomK_ItnQvwAQSLlyK4,UgwfefCe7SBJOqkPJPl4AaABAg.A7KtxQ3N9PNA7LbZjsEB-D,UCeYSnd34IPe57sM8hkjWhrw,t3MogAmkMUg,,,,,,,,,,,,,,,,,,,,,"Síiii, que inviten a la suegraaa","Síiii, que inviten a la suegraaa",UgwfefCe7SBJOqkPJPl4AaABAg,@LadySkywalkerW,https://yt3.ggpht.com/ytc/AIdro_lwbDah96CnBihX4Y-e36Gm0TnYnOORwUSk-Wx4KTUTgw=s48-c-k-c0x00ffffff-no-rj,http://www.youtube.com/@LadySkywalkerW,UCC-kANsNvPcG9ut34SPngeg,True,none,2.0,2024-08-20T03:27:55Z,2024-08-20T03:27:55Z
